,Keyword,Date,Title,Contents,Words,Comments,Source,URL
56,퍼실 향,2016.01.18. 17:47,퍼실 센서티브?,퍼실 주방세제써봤는데 향도좋고 거품도  넘잘나서요쭉쓰려는데 혹시 세탁세제요 두돌아기랑 쓰려고하는데 센서티브?이거쓰시는분있나요?향이랑 세정력어떤가요?지금은 유재석이선전하는거모더라 그거써요,"'퍼실', '주방', '세제', '향', '거품', '쭉', '혹시', '세탁', '세제', '돌', '아기', '센서티브', '거', '쓰시', '향', '정력', '가요', '지금', '유재석', '선전', '더', '그거'","'저 쓰는데 좋아요 ^^ 홈쇼핑 방송있을때 체크해서 구매하는 편이예요ㅎㅎ', '퍼실이 다른세제에 비해 비싼편인가요?', '아 홈쇼핑 방송할때 사면 오히려 더 싼것같던데요 정확한 가격 비교는 모르겠구요ㅜㅜ 아이 옷들이라 화학 성분이 최소화된점이 좋은것같아서요'",네이버 카페,https://cafe.naver.com/ArticleRead.nhn?clubid=10094499&page=5&inCafeSearch=true&searchBy=0&query=%C6%DB%BD%C7+%C7%E2&includeAll=&exclude=&include=&exact=&searchdate=2014-02-182019-08-17&media=0&sortBy=date&articleid=30340359&referrerAllArticles=true
57,퍼실 향,2016.01.17. 22:19,퍼실이요..궁금해요,"현재 라벤더쓰고있는데요 이제 아기도태어날꺼라 센서티브로봐꿀예정이에요""근데 기존퍼실보다 세정력은약하다그래서  그려려니하는데  혹시 향은 어떤지 궁금해서요~~","'현재', '라벤더', '이제', '아기', '센서티브', '꿀', '예정', '기', '정력', '혹시', '향'","'향 나쁘지않아요', '섬유유연제 쓴것처럼 향이나요 향도 괜찮았었어요', '저희집 그거쓰는데 유연제안써도 향나요~'",네이버 카페,https://cafe.naver.com/ArticleRead.nhn?clubid=10094499&page=5&inCafeSearch=true&searchBy=0&query=%C6%DB%BD%C7+%C7%E2&includeAll=&exclude=&include=&exact=&searchdate=2014-02-182019-08-17&media=0&sortBy=date&articleid=30332003&referrerAllArticles=true
58,퍼실 향,2016.01.13. 22:28,아토팜세제 써보신분 계세요??,애티튜드 쓰다가 궁중비책으류 바꾼지 6개월정도 됬어요지금 11개월이구요~^^아기세제 그만쓰고 퍼실쓸까 하다가그래도 두돌까지는 아기세제쓰자 싶은데궁중비책이 지겨워서요 ㅋ 나쁜간 아닌데 ㅋ개인적으로 비앤비는 답답한 향이라 안좋아하구오애기가 로션을 아토팜으로 쭉 쓰고잇어서괜히 세제도 바꿀까싶네요 ㅎㅎ써보신분 계세요??,"'애티튜드', '궁', '비책', '류', '개월', '정도', '지금', '개월', '이구', '아기', '세제', '퍼실쓸까', '돌', '아기', '세제', '궁', '비책', '간', '개인', '비앤', '향', '애기', '로션', '아토', '쭉', '세제', '보신', '계세'","'신생아때 부터 아토팜 쓰다가 이번에 다른걸로 바꿨는데 아토팜이 훨 좋아요 ㅎㅎㅎ 향이 마음에 들고 잘 헹궈지는것 같아요 ㅎㅎㅎ 전 다시 아토팜으로 돌아가려구요 ㅎㅎ', '행 괜찮나요?? 궁중비책 쓰는게 향때문라서요 ㅎㅎ', '저는 향이 마음에 드는데 좀 진하다는 사람도 있더라구요 ㅎㅎㅎ'",네이버 카페,https://cafe.naver.com/ArticleRead.nhn?clubid=10094499&page=6&inCafeSearch=true&searchBy=0&query=%C6%DB%BD%C7+%C7%E2&includeAll=&exclude=&include=&exact=&searchdate=2014-02-182019-08-17&media=0&sortBy=date&articleid=30297202&referrerAllArticles=true
59,퍼실 향,2016.01.07. 21:41,아기세제,"아기세제 추천해주세요토루토루 썻었는데 저렴하고 향좋은걸루요ㅎㅎ아 퍼실센서티브 이거 괜찮나요?▶카페이용 전 반드시 카페규정?http://cafe.naver.com/imsanbu/28123090 을 미리 숙지하시어???? 규정위반으로 인한 카페활동제약 등 불편함이 없으시길 바랍니다.▶각 질문방의 주제에 맞지 않는 글들은 적정한 게시판으로?각 무통보 이동됩니다.▶?타인에게 불쾌감을 줄 수도 있는 사진들은?자제해주시고,?부득이한 경우에는 매너사진으로 올려주세요.??(공지 http://cafe.naver.com/imsanbu/18729542?2번항 참고)? ???????????? ?? ??","'아기', '세제', '추천', '토', '루토루', '썻었는데', '향', '루', '퍼실', '센서티브', '거', '카페', '이용', '전', '반드시', '카페', '규정', '미리', '숙지', '규정', '위반', '카페', '활동', '제약', '등', '각', '질문방', '주제', '글', '게시판', '각', '무', '통보', '이동', '타인', '불쾌감', '줄', '수도', '사진', '자제', '부득이', '경우', '사진', '공지', '번항', '참고'","'저능 고민끝에 에티튜드 구매햇어요~두달후 출산이라.. 미리준비^^', '저두에디튜드쓰는데다음에는런드레스로바꿔볼려구요', '마마앤부 유연제 향 좋아요~용량도 대용량이고 가격도 저렴하구요', '퓨토에서 새로나온 세제 사용하는데 순하고 좋아요~'",네이버 카페,https://cafe.naver.com/ArticleRead.nhn?clubid=10094499&page=6&inCafeSearch=true&searchBy=0&query=%C6%DB%BD%C7+%C7%E2&includeAll=&exclude=&include=&exact=&searchdate=2014-02-182019-08-17&media=0&sortBy=date&articleid=30240202&referrerAllArticles=true
60,퍼실 향,2015.12.23. 17:22,넬리세제요~,내년 1월 출산인데 퍼실 향이 너무 진해서 교체할겸 넬리로 샀어요~ 그런데 이거 신생아용품 빨아도 되는 세제인가요??,"'내년', '출산', '퍼실', '향', '교체', '겸', '넬리', '거', '신생아', '용품', '세제'","'네  넬리조아요..제아기신생아부터 돌인지금까지 넬리써요', '넹^^ 표백제도 같이 샀는데 아기한테는 쓰면 안되겠죠?', '산소표백제로는 아기얼룩?묻은거 담가놓기도햇어요..그리고다시 넬리세제쓰고세딱기돌리구요', '아~ 천연이라 역시 좋네용ㅋㅋ 감사해요^^', '저도 넬리로 베넷이랑 아기꺼 다 빨았어용', '이제보니 넬리 베이비세제도 있던데 그거 사용하시는건 아니죠? 베이비세제도 있어서 순간 사야하는건지 그냥 써야하는건지 엄청 고민하고 있네요;', '저도 그냥 넬리로 했어요! 베이비 아니구요^^', '저도 그래야겠어요; 보니까 같은 코코넛 성분이던데 베이비는 또 뭔지@@ㅎㅎ 감사해용!^^'",네이버 카페,https://cafe.naver.com/ArticleRead.nhn?clubid=10094499&page=6&inCafeSearch=true&searchBy=0&query=%C6%DB%BD%C7+%C7%E2&includeAll=&exclude=&include=&exact=&searchdate=2014-02-182019-08-17&media=0&sortBy=date&articleid=30112138&referrerAllArticles=true
61,퍼실 향,2015.12.14. 00:11,[피죤] 아기옷 세탁도 빨래엔 피죤~~~ ♩,"?지금도 빨래를 할 때면, 광고가 종종 생각나요.?빨래엔 피죤 ~ ♩이 CM송 다들 아시죠?? ㅋㅋ?섬유유연제로 유명한?회사인데-베이비제품도 나왔다기에 얼른 신청해서 받아본 제품 ?액츠베이비와 피죤베이비를 소개합니다.?퍼실을 사용하면서 . . 아기세제건 어른세제건 액체세제가 편하긴 하더라구요.그래서 늘 액체세제를 선호하게 되는데요.?향도 좋고, 세척력도 좋은 액츠,피존 베이비 ♩?아가들 쓰는 세제라 그런지 색상도 넘 은은하니 예쁘죠??하늘색과 베이비핑크 :) ㅋㅋ더 순할 것 같은 느낌이에요.????선물용으로 들고 갈 수 있도록 포장박스에 담겨서 왔더라구요.?아이있는집에... 찾아갈때 가져가면 딱 좋을 것 같지요?? ㅎㅎㅎㅎ?깨끗한 마음을 담은 선물 피죤 ♪????손잡이가 있어서 들고가기도 편하겠더라구요.?그치만, 상자 안은 잘 살펴보고 가져가야할듯해요ㅠ제껀 액체세제가 다 세서 왔어요. 흑흑;미리 열어서 살펴볼걸...신랑 입원해있어서 나중에 확인했더니.. 요거 좀 아쉽더라구요.???손잡이도 있어서 ?6가지 무첨가, 천연 달맞이꽃 오일 성분 첨가, 항균효과가 들어있는 섬유유연제이구요.자몽,유자, 유칼립투스 등 천연항균성분이 첨가되어있고, 무형광증백제, 천연 오렌지성분의 세정력으로 피부에 자극없이 깨끗하게 빨래할 수 있는 세제랍니다.????액츠베이비 1400ml 일반용이에요.?요즘 날도 추워지고 빨래도 잘 안말라서... 큰 세탁기로 같이 빠는지라..일반용 베이비세제 넘 반갑네요. ㅎㅎ??화학성분의 최소화 ?듣던 중 반가운 소리이지요????????천연 오렌지 추출물이 첨가되어있어 빨래를 깨끗하게 세탁해준다고해요!!?표준사용량이 작게 적혀있어서.. 한참 찾았어요.이건 개선이 필요할 것 같아요뚜껑에 눈금도 안보여서 짐작으로만 넣게 되서... 조금 아쉽더라구요.????손잡이가 있으니 세제 넣는다고 쏟지는 않겠지요? ㅋㅋㅋ?1.4l니까요; ㅋㅋㅋ이정도는 쉽게 들어줘야죠??파우더향의 피존베이비?아기 옷에서 파우더향이 나니 넘 좋더라구요. ^^;;;;;?????표백제, 형광증백제, 인공색소, 인산염, 효소, SLES를 첨가하지 않아 안심할 수 있답니다.거기에 천연 달맞이꽃 오일 성분으로 아기피부를 보호해주고 있구요.항균효과가 들어있어 의류에 생길 수 있는 각종 세균을 억제해준다고 하네요. ???????뚜껑이 넘 예쁜것 같아요. ㅎㅎ?기존에도 액츠세제를 사용해보았던 터라... 뚜껑보고 예쁘다 했었는데- ㅋㅋ베이비제품들도 넘 예쁜 꽃모양이라... 세제 덜면서도 감탄하게 되더라구요 ㅋㅋㅋㅋㅋ????투명하고 묽은 농도의 베이비세제세제에서도 향이 나요. :)?????투명한 세제인데 거품도 잘 나더라구요.구석구석 빨래도 잘 될 것 같은 느낌 ♩?역시 유연제는 우유에 물탄색깔 ㅋㅋㅋ?????파우더향이 너무 좋더라구요. 완죤 맘에 들었어요. ??안그래도 겨울철 빨래는.....밖에다 널수가 없어서 은근 빨래의 꿉꿉한 냄새가 남곤 했는데파우더향이 솔솔나니 빨래냄새가 안나더라구요 ;;?????세탁할때 세제와 유연제를 세제통에 넣고 열심히 빨아주었답니다.??아쉬운건, 위에 언급했듯;;세제 계량해야하는데 눈금이 안 보여서 대충 넣고 빨았다는거.소량/ 중간/ 일반 빨래... 세제 양은 적혀있는데 뚜껑에 눈금이 안보이니 답답했어요.??????간만에 날씨가 좋아... 밖에 열심히 빨래를 널었답니다.?겨울철 냄새나는 빨래피죤으로 향긋하게 만들어보아요.???- 해당 포스팅은 업체로부터 제품만 무상으로 제공받아 직접 사용해보고 작성되었습니다.-??? ","'빨래', '때', '광고', '종종', '빨래', '피죤', '이', '송', '아시', '섬유', '유연제', '회사', '베이비', '제품', '얼른', '신청', '제품', '피죤', '베이비', '소개', '퍼실', '사용', '아기', '건', '어른', '세제', '건', '액체', '세제', '늘', '액체', '세제', '선호', '향', '세척', '액츠', '피존', '베이비', '아가', '세제', '색상', '하늘색', '베이비', '핑크', '더', '것', '느낌', '선물', '용', '수', '포장', '박스', '아이', '집', '때', '것', '마음', '선물', '피죤', '손잡이', '기도', '상자', '해', '제껀', '액체', '세제', '미리', '걸', '신랑', '입원', '나중', '확인', '거', '좀', '손잡이', '무', '첨가', '천연', '달맞이꽃', '오일', '성분', '첨가', '항균', '효과', '섬유', '유연제', '이구', '자몽', '유자', '유칼립투스', '등', '항균', '성분', '첨가', '무형', '광증', '백제', '천연', '오렌지', '성분', '정력', '피부', '자극', '빨래', '수', '랍니', '액츠', '베이비', '용이', '요즘', '날', '빨래', '세탁기', '일반', '용', '베이비', '세제', '화학', '성분', '최소', '중', '소리', '이지', '천연', '오렌지', '추출', '물이', '첨가', '빨래', '세탁', '고해', '표준', '용량', '한참', '이건', '개선', '것', '뚜껑', '눈금', '안보', '짐작', '조금', '손잡이', '세제', '니', '정도', '파우더', '향', '피존', '베이비', '아기', '옷', '파우더', '향', '나니', '표백제', '형광', '증', '백제', '인공', '색소', '인산염', '효소', '를', '첨가', '수', '거기', '천연', '달맞이꽃', '오일', '성분', '아기', '피부', '보호', '항균', '효과', '의류', '수', '각종', '세균', '억제', '기존', '액츠세제', '사용', '터', '뚜껑', '보고', '베이비', '제품', '꽃', '모양', '세제', '감탄', '농도', '베이비', '세제', '향', '세제', '거품', '구석구석', '빨래', '것', '느낌', '역시', '유연제', '우유', '물탄', '색깔', '파우더', '향', '완죤', '맘', '겨울철', '빨래', '밖', '은근', '빨래', '냄새', '남곤', '파우더', '향', '솔솔', '나니', '빨래', '냄새', '세탁', '때', '세제', '유연제', '통', '위', '언급', '세제', '계량', '눈금', '안', '보', '대충', '소량', '중간', '일반', '빨래', '세제', '양은', '뚜껑', '눈금', '안보', '간만', '날씨', '빨래', '겨울철', '냄새', '나', '빨래', '피죤', '향', '보아', '해당', '포스팅', '업체', '로부터', '제품', '무상', '제공', '직접', '사용', '작성'",,네이버 카페,https://cafe.naver.com/ArticleRead.nhn?clubid=10094499&page=6&inCafeSearch=true&searchBy=0&query=%C6%DB%BD%C7+%C7%E2&includeAll=&exclude=&include=&exact=&searchdate=2014-02-182019-08-17&media=0&sortBy=date&articleid=30024142&referrerAllArticles=true
62,퍼실 향,2015.12.07. 16:57,세제 퍼실 쓰시는 분? 향이 원래 이렇게 강한가요?ㅠ,퍼실 세제를 쓰는데 임신을 해서 향이 진하게 느껴지는건지 원래 진한건지 모르겠네요ㅠㅠ섬유유연제를 넣었는데도 퍼실 냄새밖에 안나요;;원래 이렇게 강해요??ㅠㅠ 임신 전엔 퍼실 쓰면서 어땠는지 기억이 안나네요ㅎㅎ;;향이 진하지 않은 다른 세제 추천해주세요ㅠㅠㅠㅠㅠ,"'퍼실', '세제', '임신', '향', '원래', '섬유', '유연제', '퍼실', '냄새', '안나', '원래', '임신', '전', '퍼실', '기억', '안나', '향', '다른', '세제', '추천'","'퍼실향ㅇㅣ강해요^^그리고퍼실은 다른새제들보다 넣는 량도 작구요!!', '맞아요ㅠㅠ퍼실냄새 독해요ㅠㅠ가끔 많이넣으면 냄새 머리아파요', '초록색이랑 파란색은 냄새 진해서 보라색써요.. 그나마 연하더라구요.'",네이버 카페,https://cafe.naver.com/ArticleRead.nhn?clubid=10094499&page=6&inCafeSearch=true&searchBy=0&query=%C6%DB%BD%C7+%C7%E2&includeAll=&exclude=&include=&exact=&searchdate=2014-02-182019-08-17&media=0&sortBy=date&articleid=29967469&referrerAllArticles=true
63,퍼실 향,2015.11.16. 21:24,섬유유연제 어디꺼 쓰세요??,"신생아 키우는 중이구요항상 따로 세탁기 돌리다가 너무 귀찮아서퍼실 센서티브로 통일시킨후에 좀 편해졌는데섬유유연제는 무얼 쓸까.. 고민돼서 여쭤봐요원래는?다우니 파란색썼다가...버넬 와일드로즈로 바꿔봤는데 좀 제가 찾던 은은하고 포근하고 그런향은 아니더라구요향좋은거..추천해주세요아가옷이랑 같이 쓸거에요^^아참,그런데 스너글이란 섬유유연제는 향 좋나요??인스타그램에 태그 걸어서 검색좀 했는데저걸 많이들 쓰시길래 궁금하네요어떤향인지..?아시는분,..;대충?비슷한향으로 알려주세요ㅠㅠ?","'신생아', '중이', '항상', '세탁기', '귀', '센서티브', '통일', '후', '좀', '섬유', '유연제', '무얼', '고민', '원래', '다우니', '파란색', '버넬', '와일드', '로', '좀', '제', '향', '향', '거', '추천', '아가', '옷', '스너글', '섬유', '유연제', '향', '인스타그램', '태그', '검색', '좀', '저걸', '향', '아시', '분', '대충', '향'","'호호에미 프리지아향 만족하며 쓰다가 다른거써보려고 이번에 비앤비 베르가못으로 바꿨어요. 비앤비는 사용전이라 잘모르겠는데 호호에미는 좋았어요~', '저도 호호에미 유연제 향 좋아서 잘 쓰고 잇어요  향좋아서 빨래개면서 킁킁 대네요^^', '비앤비 베르가못이요태어날때부터이것만써서그런가향도좋구그렇네요'",네이버 카페,https://cafe.naver.com/ArticleRead.nhn?clubid=10094499&page=6&inCafeSearch=true&searchBy=0&query=%C6%DB%BD%C7+%C7%E2&includeAll=&exclude=&include=&exact=&searchdate=2014-02-182019-08-17&media=0&sortBy=date&articleid=29784826&referrerAllArticles=true
64,퍼실 향,2015.11.15. 22:27,퍼* 세제 쓰시는분 질문요~,퍼실세제 이번에 첨 써보려는데요~ 향이 강하다해서요..섬유유연제 같이 사용하면 향이 이상하게 섞이지 않나요?? 글구 퍼실쓰시는분들은 옥시크린 따로 사용 안하시죠??,"'퍼', '실세', '제', '이번', '향', '서요', '섬유', '유연제', '사용', '향', '글구', '퍼실', '쓰시', '분', '옥', '시크', '린', '사용'","'섬유유연제 안쓰면 퍼실향강하긴한데써도 섞이는거같진않아요 그냥 유연제냄새나요', '혹시나했는데 걍 유연제 써야겠어요^^', '유연제 향만 나던데요. 그리고 옥시크린은 어떤 세제를 쓰든 좋은거 아닌가요? 저도 정확히는 모르지만 전 같이 써요', '옥시크린도 같이써도 되는군요ㅋ 감사해요~~', '저는 검정색 네이비 챠콜 색상은 같이 퍼실만 쓰고 수건이나 다른 컬러 의류 속옷은 퍼실 옥시크린 반반씩 써요.유연제 안하면 퍼실향 나고 유연제 쓰면 유연제향만 나요.또 실외에 건조하면 향 덜하고 실내에 건조하면 향이 좀 남더라고요.', '자세한설명 감사해요^^'",네이버 카페,https://cafe.naver.com/ArticleRead.nhn?clubid=10094499&page=6&inCafeSearch=true&searchBy=0&query=%C6%DB%BD%C7+%C7%E2&includeAll=&exclude=&include=&exact=&searchdate=2014-02-182019-08-17&media=0&sortBy=date&articleid=29775487&referrerAllArticles=true
65,퍼실 향,2015.11.06. 14:09,세탁세제 퍼실말고   향  괜찮은제품추천즘요,임신하고는 퍼실 냄새가 너무 강하게 느껴지내요..통돌이 세제 머쓰시나요?향너무 강하지않고 좋은제품 추천좀 부탁드립ㄴ다^^,"'임신', '퍼실', '냄새', '통', '돌이', '세제', '머', '향', '제품', '추천', '좀'","'저는 그냥 액츠쓰고 피죤으로행궈내는데..향독한건모르겠네요', '저도 임신중 퍼실 냄새가 역해서 못쓰고 언니네 줘버렸어요.태크나 리큐는 덜하던데 써보세요.^^', '저도 리큐써요~'",네이버 카페,https://cafe.naver.com/ArticleRead.nhn?clubid=10094499&page=6&inCafeSearch=true&searchBy=0&query=%C6%DB%BD%C7+%C7%E2&includeAll=&exclude=&include=&exact=&searchdate=2014-02-182019-08-17&media=0&sortBy=date&articleid=29696686&referrerAllArticles=true
66,퍼실 향,2015.11.05. 12:49,퍼실쓰시는분들,전 퍼실녹색 썼었는데요향이진하긴 하더라구요혹시 라벤더향 써보신분들있어요?그건어떤지 궁굼해용ㅋㅋ,"'전', '퍼실', '녹색', '향', '혹시', '라벤더', '향', '보신', '건어', '궁굼'","'개인적으로 저는 라벤더향이 더 진한것 같아요;;', '아 감사요향도 괜찮나요?', '저녹색.보라색.파란색 있어요ㅋ 라벤더향평소에좋아해서 좋아요 주로이불빨래할땐  그거써요^^', '파랑색도있어여?ㅋ라벤더향이 젤 나요?', '파랑은 색있는옷 컬러감더살려주고플때 쓰는거래요ㅋ저는 퍼실향 대부분좋아해서 진해서더좋턴데요빨래말리고밬에나갔다 들어올때 집에냄새나서 좋터라구요 남편이 모르고세제많이넣었을땐 밖에까지 퍼실향이 ㅎㄷㄷㄷ라벤더향 전 좋아요ㅋ', '저도 얼렁 구매해야겠어요좋은정보 감사해요~^^', '저도 초록색 보라색 파란색 다쓰고있어요~ 초록색은 흰옷이랑 속옷 보라색은 이불이랑 수건 파란색은 색깔옷 세탁할때 쓰는데 좋아요 향이 진해서 섬유유연제 따로 안넣어도 잔향이 남아요~', '네 저도지금구매하려구용라벤더로세가지말고 한가지만ㅋㅋ', '보라도 좋고,파랑도 좋아요보라가 좀더 여성스런 향이고, 파랑은 약간 중성적인 향인거 같아요', '보라색 구입했어용~^^', '라벤더가진한대향이 거북하지않아 괜찮아요', '녹색보다 더 진해여?녹색도 장난아니게진하던데피죤냄세가 묻혀버려여ㅋㅋㅋ', '네 제가느끼기엔 녹색보다진해여라벤더도 피존묻혀요 ㅋ'",네이버 카페,https://cafe.naver.com/ArticleRead.nhn?clubid=10094499&page=6&inCafeSearch=true&searchBy=0&query=%C6%DB%BD%C7+%C7%E2&includeAll=&exclude=&include=&exact=&searchdate=2014-02-182019-08-17&media=0&sortBy=date&articleid=29686995&referrerAllArticles=true
67,퍼실 향,2015.08.23. 12:14,세제 뭐쓰시나요?(퍼실제외),?결혼하고는 쭉 퍼실만 썼는데 바꿔보려 합니다.??향좋고 세탁력도 좋은거 없을까요?드럼이구요▶게시판 이용전?반드시 카페규정?http://cafe.naver.com/imsanbu/28123090 을 미리 숙지 당부드립니다.▶수다방 성격에 맞지않는 이탈글은 적합한 게시판으로 이동 또는 삭제예정게시판으로 이동됩니다. ???????????????????????????????,"'쭉', '퍼실', '향', '세탁', '거', '드럼', '이구', '게시판', '이용', '전', '반드시', '카페', '규정', '미리', '숙지', '당부', '다방', '성격', '이탈', '글', '게시판', '이동', '삭제', '예정', '게시판', '이동'","'리큐요^^', '리큐쓰긴하는데퍼실이 좀더 좋은거 같아여~', '퍼실만한게 없는거같아요', '저도 리큐 써봤는데..퍼실이..더..좋..좋은것 같아요...'",네이버 카페,https://cafe.naver.com/ArticleRead.nhn?clubid=10094499&page=6&inCafeSearch=true&searchBy=0&query=%C6%DB%BD%C7+%C7%E2&includeAll=&exclude=&include=&exact=&searchdate=2014-02-182019-08-17&media=0&sortBy=date&articleid=29052010&referrerAllArticles=true
68,퍼실 향,2015.06.26. 19:58,임신 7주 차인데요.. 라벤더 향이 안좋은가요?ㅜㅠ,오늘이 딱 7주 되는 날이에요~제가 여태 퍼실(세탁세제) 라벤더 향을 써왔거든요.. 이것도 해로운건가요? 이제부터 안쓰겠지만.. 그래도 걱정이 돼요.그리고 애니데이도 라벤더 향을 썼는데-아가 괜찮을까요?아.. 왜 진작 깨닫지 못했는지 몰라요.오일이 아닌건 상관이 없는걸까요..답변 좀 주시면 감사하겠습니다ㅠㅠ,"'오늘이', '주', '날', '제', '여태', '퍼실', '세탁', '세제', '라벤더', '향', '것', '가요', '이제', '걱정', '애니', '데이', '라벤더', '향', '아가', '왜', '진작', '오일이', '상관', '답변', '좀', '주시'","'직접적으로뿌리는것만아니면괜찮으셔용ㅎ', '그런가요.. 임신하고 나서 조심해얄것들이 한둘이 아니네요ㅠㅠ', '삭제된 댓글입니다.', '네~ 최대한 안쓰도록 해봐야겠어요.좀 더 신경써야겠네요..^^', '삭제된 댓글입니다.', '네! 지금부터 안써야겠어요...'",네이버 카페,https://cafe.naver.com/ArticleRead.nhn?clubid=10094499&page=6&inCafeSearch=true&searchBy=0&query=%C6%DB%BD%C7+%C7%E2&includeAll=&exclude=&include=&exact=&searchdate=2014-02-182019-08-17&media=0&sortBy=date&articleid=28561802&referrerAllArticles=true
69,퍼실 향,2015.06.02. 14:15,퍼실 라벤다 쓰면 유연제 안써도 될까요?,라벤다 쓰면서 유연제 따로 쓰면 향 섞여 별로까요?,"'벤다', '유연제', '향', '별로'",,네이버 카페,https://cafe.naver.com/ArticleRead.nhn?clubid=10094499&page=6&inCafeSearch=true&searchBy=0&query=%C6%DB%BD%C7+%C7%E2&includeAll=&exclude=&include=&exact=&searchdate=2014-02-182019-08-17&media=0&sortBy=date&articleid=28340188&referrerAllArticles=true
70,퍼실 향,2015.05.14. 12:03,퍼실 센서티브 아기세제로 괜찮나요?,																																																																																												이제까지 궁중비책이나 에티튜드로 아기세제 따로 썼는데 퍼실센서티브 아기세제로도 괜찮대서 바꿔볼까 해서요.짐 홈쇼핑 방송하는데 구성이 엄청..난 양..;;;;;한번 사면 일년넘게 이것만 써야 할것 같은데..써보신분 소감 부탁드립니다 ^^세척력이나 향이나 실내건조시 냄새나는지..이런 내용이요!블로거들은 넘 제공후기가 많아서 못믿겠다능..;;?,"'이제', '궁', '비책', '에티튜드', '아기', '세제', '퍼실', '센서티브', '아기', '제로', '대서', '짐', '홈쇼핑', '방송', '구성', '난', '양', '한번', '사면', '년', '것', '보신', '소감', '세척', '향', '실내', '건조', '시', '냄새', '용이', '블로거', '후기', '능'",'저 지금25개월 아기 그거써요~세제향은 은은하고 좋아요~~ 빨래두 아기세제보다 훨 잘빨리구요~~ 저두 바꾼지 얼마안됐는데 3통다쓰고 이번에 또 주문해서 쓰고있어요~~일반세제보다 양이 적게 들어있는데 이싸요 ㅠㅠ 그렇지만 트러블없이 좋더라구요~~ 참고로 저는 섬유유연제 중독자라 항상 빨래말리면 유연제냄새밖에 안나서 자세한향은 모르겠어요~~',네이버 카페,https://cafe.naver.com/ArticleRead.nhn?clubid=10094499&page=6&inCafeSearch=true&searchBy=0&query=%C6%DB%BD%C7+%C7%E2&includeAll=&exclude=&include=&exact=&searchdate=2014-02-182019-08-17&media=0&sortBy=date&articleid=28181340&referrerAllArticles=true
