,Keyword,Contents,Words,Source,URL
98,테크세제,"테크 실내건조 드럼용 액상세제, 3L, 1개 너무 효과적이에요36%  13,900원   8,780원  (1회당 59원)      ?구성: 본품?제형: 액상형?용기 타입: 일반형?종류: 드럼용세탁세제?기준단위당 사용용량: 20ml?쿠팡상품번호: 2854779 - 316678  한번 써보고 재구매입니다 우선 포장 안전하게 뽁뽁이 넣어서 오구요 로켓배송이라 정말좋아요 저는 오피스텔이라 집내부에서 빨래건조를하는데 문구처럼 꿉꿉한 냄새전혀없이 햇볕에건조한듯한 느낌이들어요.이제품 써보시길 권장합니다 이거 상품 제대로 온건지 모르겠네요. 용기가 리뉴얼되서 바뀐건지 아니면 잘못 온건지 검정색 용기 테크가 아니라 빨간통으로 왔어요 두통 주문해서 뭣모르고 한통 개봉해서 빨래 한번 돌렸는데  ㅋㅋㅋ딱히 안좋은점 없고. 향도 괜찮고 빨래도 잘 되서  그냥 사용하려구요ㅋㅋㅋ 섬유유연제는 꽃담초를 사용하고,빨래 세제는 테크 실내건조+진드기99%제거 둘이 섞어서 쓰는데 궁합이 참 괜찮은 것 같아요! 테크 세제 역할이 세탁한 옷이 마르면서 발생되는 세균을 억제 시켜 주니 섬유유연제는 꽃담초를 같이 사용하니 냄새 나는 일이 없네요*^^*바지 허리 부분은 두껍고 잘 안 말라서 자칫 세균으로 인해 걸레 냄새나기 쉬운데, 섬유유연제와 빨래 세제 궁합이 좋으니 그만하면 세균 냄새가 안 나는 편인 것 같아요! + 1년 4개월 넘게 여지껏 빨래를 해도 수건에서 걸레 냄새가 났던 적이 딱 두 번 있었는데 이건 수건에 세균이 많은 거라서 수건은 한 번씩 삶음 코스로 뜨겁게 세탁해 주셔야 해요. 그리고 세탁기도 한 번씩 살균 코스로 돌려 주셔서 내부 청소를 해주셔서 세탁기 관리를 잘 해주셔야 빨래 세탁 효과가 배로 탁월해 지는 것 같아요!테크 액체세제 추천합니다!!!!적은 양으로도 거품이 잘 나고, 모든지 적정량을 사용해야 효과가 좋은건 아시죠?경제적이고 빨래도 깨끗하게 잘 빨립니다!오염도 잘 지워져요! ? 테크 실내건조 드럼용 액상세제COUPANGcoupa.ng","'테크', '실내', '건조', '드럼', '용', '액', '세제', '개', '효과', '구성', '품', '형', '액', '상형', '용기', '타입', '일반', '종류', '드럼', '용', '세탁', '세제', '기준', '단위', '사용', '용량', '쿠팡', '상품', '번호', '한번', '보고', '우선', '포장', '뽁뽁', '오구', '로켓', '배송', '정말', '저', '오피스텔', '집', '내부', '빨래', '건조', '문구', '냄새', '전혀', '햇볕', '느낌', '제품', '권장', '거', '상품', '제대로', '온건', '용기', '리뉴얼', '잘못', '온건', '검정색', '용기', '테크', '빨', '간통', '두통', '주문', '뭣모르', '통', '개봉', '빨래', '한번', '점', '향', '빨래', '그냥', '사용', '섬유', '유연제', '꽃담초', '사용', '빨래', '세제', '테크', '실내', '건조', '진드기', '제거', '둘', '궁합', '것', '테크', '세제', '역할', '세탁', '옷', '발생', '세균', '억제', '주니', '섬유', '유연제', '꽃담초', '사용', '냄새', '나', '바지', '허리', '부분', '안', '말', '자칫', '세균', '걸레', '냄새', '나기', '섬유', '유연제', '빨래', '세제', '궁합', '세균', '냄새', '안', '나', '편', '것', '개월', '여지', '껏', '빨래', '해도', '수건', '걸레', '냄새', '적', '두', '번', '이건', '수건', '세균', '거', '수건', '번', '코스', '세탁', '해', '세탁기', '번', '살균', '코스', '내부', '청소', '세탁기', '관리', '빨래', '세탁', '효과', '배', '것', '테크', '액체', '세제', '추천', '양으로', '거품', '모든', '적', '정량', '사용', '효과', '건', '아시', '경제', '빨래', '빨립니', '오염', '테크', '실내', '건조', '드럼', '용', '액', '세제'",네이버 블로그,https://blog.naver.com/yaoeiknd/221440743704
99,테크세제,,,,
100,테크세제,"아울 샤프란 섬유연제 테크시트 세탁세제 섬유유연제, 2개오늘 구매 시 화요일 8/13까지 도착 보장!이 포스팅은 2019년 8월 8일 14시 25분을 기준으로 작성되었습니다.'아울 샤프란 섬유연제 테크시트 세탁세제 섬유유연제, 2개'▼ 제품후기 및 상세정보 열어보기 ▼162개 상품평★★★★☆12,700 (0% 할인 적용)12,700원아래 링크를 클릭하면 구매처로 이동됩니다아울 샤프란 섬유연제 테크시트 세탁세제 섬유유연제, 2개COUPANGcoupa.ng품명 및 모델명아우라 드라이시트 40매 윌 유 메리미 x 2개인증사항F-A04B-A001008-A150제조국(원산지)대한민국제조자(수입자)(주)LG생활건강소비자상담 관련 전화번호-수량: 2개상품평최고 77%좋음 14%보통 3%별로 2%나쁨 4%향 만족도아주 만족해요 78%적당히 만족해요 16%만족스럽지 않아요 6%지속도예상보다 오래 남아요 52%적당히 지속 돼요 40%향이 금방 달아나요 8%'아울 샤프란 섬유연제 테크시트 세탁세제 섬유유연제, 2개'매일 서로이웃 신청 확인하고 있으니 거리낌 없이 신청해주시길 부탁드립니다제품에 대한 후기 및 자세한 사항은 링크를 통해 확인하세요","'울', '샤프란', '섬유', '연제', '테크', '시트', '세탁', '세제', '섬유', '유연제', '개', '오늘', '구매', '시', '화요일', '도착', '보장', '이', '포스팅', '기준', '작성', '울', '샤프란', '섬유', '연제', '테크', '시트', '세탁', '세제', '섬유', '유연제', '개', '제품', '후기', '및', '상세', '정보', '보기', '개', '상품', '평', '할인', '적용', '링크', '클릭', '처', '이동', '샤프란', '섬유', '연제', '테크', '시트', '세탁', '세제', '섬유', '유연제', '개', '품명', '및', '모델', '아우라', '드라이', '시트', '매', '윌', '유', '메', '리미', '개인', '증', '사항', '조국', '원산지', '대한민국', '제조', '수입', '주', '생활', '건강', '소비자', '상담', '관련', '전화번호', '수량', '개', '품평', '최고', '보통', '별로', '향', '만족도', '아주', '만족', '도예', '남아', '지속', '향', '금방', '울', '샤프란', '섬유', '연제', '테크', '시트', '세탁', '세제', '섬유', '유연제', '개', '매일', '서로', '이웃', '신청', '확인', '거리', '낌', '신청', '제품', '대한', '후기', '및', '사항', '링크', '통해', '확인'",네이버 블로그,https://blog.naver.com/oooo0722/221609780750
101,테크세제," <샤프란 아로마시트&테크 간편시트> 간편하고 안전한 세제와 섬유유연제   요즘 한참 김연아선수가 광고모델로 나오는 섬유유연제 와 같은 회사 제품인 세제 랍니다..이런식의 시트 제품을.. 몇년전 미국에서 봤었답니다.. 세제는 일반적인 액체 세제 였는데..섬유유연제 대신에 건조기에 넣는 시트제품의 제품...그땐 그게 어찌나 신기하던지 말이죠..... 트롬세탁기 같은거 사용해본적 없는 사람이었던지라.. 건조기에서마른 빨래가 나오는게 어찌나 신기하던지.. 귀찮기도 했네요...세탁기에서 세탁이 다 끝난 빨랫감들을 꺼내서 옆에 있는 건조기에 넣어야 되는거였거든요...딱 일년 생활하고 한국으로 돌아왔는데.. 한국에도 어느새 이런 시트 제품이 참 많더라구요..처음에는 섬유유연제만 이었던거 같은데.. 세제도 나오네요.... ^^  지금까지 사용했던 세제는.. 저렴하니까 자주 사용했던 가루세제류들...얼마전에는 끌고 다니는 카트를 주는 행사를 하길래..  퍼* 사용하고 있었답니다...가루세제류는 옷에 남는다는 이야기들 때문에.. 뜨거운물로 녹여서 사용하곤 했었던터라.... 가스비가.. @.@퍼* 은 나름 만족하고 있었답니다.. 일단 녹이지 않아도 되고.. 세탁력도 나름 괜찮았거든요..무거운걸 들어서 정량을 넣어야 한다는 단점이 있는거만 뺀다면 말이죠..아이 낳고 손목이 그닥 좋은 상태를 아니기 때문에 힘겨웠었는데...  이번에 사용하게된 제품들은 무겁게 들지 않아도 되고 세제찌꺼기 걱정도 없고 보관하기에도 편하다는장점들이 있답니다  세탁은 언제나 세제를 먼저 사용하기 때문에....테크 간편시트부터 사용해 봤답니다...테크 간편시트는 사용량이 비교적 자세하게 두가지의 상황에 따라 나뉘기 때문에 적정량을 잘 찾을수있어서 사용하기 편하답니다세척력이 강력한 반면 찌꺼기가 남지 않은 말끔함과 더불어 식물성분으로 피부보호 까지 가능하기 때문에유아세제를 따로 쓰지 않으면서 아토피성피부염이 있는 아이들이 있는 저한테는 너무 좋은 제품이랍니다테크 간편시트에 대해서 잘 알아봤으니..  이제 세탁을 시작해 볼까요?테크세탁세제 사용량에 보면 1/2 이라는 단위가 있답니다... 대체 요걸 어찌 써야하는건가.. 가위를 사용해야하는건가? 하면서 뜯어봤답니다... 걱정 싸악.... 중간에 점선으로 뜯어지게 되어있어요..   세탁이 끝났으니까... 섬유유연제 사용을 해야겠죠?...이번엔 김연아씨가 선전하는 [샤프란 아로마시트] 를 사용했답니다..  [샤프란 아로마시트] 에 대해서 알아볼까요~~가장 큰 특징은 무색소 무형광 제품이라서 아이옷에도 사용하기 적합한 제품이라는 점이랍니다 ^^사용한 시트는 집안 방향제로 사용할수 있다는점도 큰 장점이구요    사용이 끝난 샤프란 아로마 시트는 방향제로 사용할수도 있답니다... 신발장이나 실내에 놔두었다가말려서 옷장이나 서랍장 제일 위에 놔두면 좋은 향기가 난답니다...지난주에 세탁에 사용한 시트를 말려서 서랍장에 넣어두었는데.. 아직까지 좋은 향기가 난답니다..요즘처럼 장마 기간에는 햇볕에 말릴수 없기 때문에 세탁이 끝나고 말린 옷에서 냄새가 나기 쉬운데..이 시트를 위에 넣어 놓으니 좋은 냄새가 살짝 배여서 좋으네요  ^^  시트로 되어있는 제품들이라 여행할때 세탁기가 있다면 두어장씩 챙겨서 다니기에도 참 좋은 여행용 세제도가능하네요 ^^   테크 간편시트와 샤프란 아로마시트와 같이 받은 제품이 샤프란 섬유 탈취제 였답니다..작은 사이즈로 고기집에 갈때 들고가면 딱 좋겟더라구요...대장균, 화농균에 대해 항균 99% 까지 가능하면서 탈취 기능까지 있기 때문에 아이들 옷이나 쉽게 빨수없는커튼이나 침구류에 뿌려주면 좋을듯 싶어요...여름옷은 냄새가 배일때 바로 빨래 할수 있어서 그닥 많이 사용하지는 않지만 식당에 들고 다니기 좋은사이즈 네요.... 외출시에 사용할 섬유탈취제로는 딱 좋아요~ ^^ ","'샤프란', '아로마', '시트', '테크', '간편', '시트', '세제', '섬유', '유연제', '요즘', '한참', '김연아', '선수', '광고', '모델', '섬유', '유연제', '회사', '제품', '세제', '식', '시트', '제품', '년전', '미국', '세제', '일반', '액체', '세제', '섬유', '유연제', '대신', '건조기', '시트', '제품', '제품', '그땐', '그게', '말', '트롬', '세탁기', '사용', '적', '사람', '건조기', '빨래', '기도', '세탁기', '세탁', '빨랫감들', '옆', '건조기', '년', '생활', '한국', '한국', '시트', '제품', '처음', '섬유', '유연제', '세제', '지금', '사용', '세제', '자주', '사용', '가루', '류', '얼마', '전', '끌', '카트', '행사', '사용', '가루', '류', '옷', '이야기', '때문', '물', '녹', '사용', '곤', '터', '가스', '비', '은', '나름', '일단', '녹', '세탁', '나름', '걸', '정량', '단점', '말', '아이', '손목', '그닥', '상태', '때문', '이번', '사용', '제품', '찌꺼기', '걱정', '보관', '장점', '세탁', '세제', '먼저', '사용', '때문', '테크', '간편', '시트', '사용', '테크', '간편', '시트', '용량', '비교', '가지', '상황', '때문', '적', '정량', '사용', '세척', '반면', '찌꺼기', '남지', '함', '식물성', '피부', '보호', '때문', '유아', '세제', '아토피', '피부염', '아이', '테', '제품', '랍니', '테크', '간편', '시트', '대해', '이제', '세탁', '시작', '요', '테크', '세탁', '세제', '용량', '단위', '대체', '걸', '어찌', '건가', '가위', '사용', '건가', '걱정', '악', '중간', '점선', '세탁', '섬유', '유연제', '사용', '이번', '김연아', '선전', '샤프란', '아로마', '시트', '를', '사용', '샤프란', '아로마', '시트', '대해', '요', '가장', '특징', '무', '색소', '무형', '광', '제품', '아이', '옷', '사용', '제품', '점', '랍', '사용', '시트', '집안', '방향', '제로', '사용', '점도', '장점', '이구', '사용', '샤프란', '아로마', '시트', '방향', '제로', '사용', '신발장', '실내', '옷장', '서랍', '제일', '위', '향기', '지난주', '세탁', '사용', '시트', '서랍', '향기', '요즘', '장마', '기간', '햇볕', '때문', '세탁', '옷', '냄새', '나기', '이', '시트', '위', '냄새', '살짝', '배', '시트', '제품', '여행', '때', '세탁기', '어장', '기', '여행', '용', '제도', '테크', '간편', '시트', '샤프란', '아로마', '시트', '제품', '샤프란', '섬유', '탈취', '제', '사이즈', '집', '때', '대장균', '화농', '균', '대해', '항균', '탈취', '기능', '때문', '아이', '옷', '커튼', '침구', '류', '여름', '옷', '냄새', '배일때', '바로', '빨래', '그닥', '사용', '식당', '사이즈', '외출', '시', '사용', '섬유', '탈취', '제로'",네이버 블로그,https://blog.naver.com/eliad/40132631625
102,테크세제,"종이세제 테크간편시트로 처음 써봤어요평소에는 빨래를 할 때 가루세제를 쓰는데요다 떨어져서 마트를 갔더니 5kg짜리 밖에보이지 않더라구요.처음에는 이걸 살까 하다가곰곰히 생각을 해보니 몇 달 있으면이사를 할 지도 모르는데 괜히짐만 될 것 같아서 간단하게 쓸 수있는 세탁세제를 찾아보았어요.그러다 발견하게 된 종이세제 테크간편시트!살림하시는 분들은 이미 다 알고계시겠지만 자취를 하는 저는 이제서야알게 된 제품이에요.세제하면 당연히 가루를 생각하고 있었고그나마 액체세제가 있다는 것까지알고 있었거든요.(ㅎㅎㅎㅎ)그랬던 저에게 이 제품은 정말괜찮게 다가왔답니다.보통 일 주일에 한 번 정도 몰아서빨래를 하는데 요 제품 하나면 한 달을4주로 잡고 계산해보니 4~5달 정도는쓸 수 있겠다 싶어서 구입을 하게 되었어요.이마트에서 구입을 했는데 가격이 3500원 정도했던 걸로 기억을 합니다. 가격은 어떻게구입을 하냐에 따라서 조금씩 차이가있을 수 있으니 잘 알아 보시길 바래요.종이세제 테크간편시트종이박스를 뜯어보니 물티슈처럼 생긴팩이 보이네요.물티슈랑 같이 뒀다가 잘못 쓸 수도있겠다 싶은 엉뚱한 생각을 잠깐 해봅니다.그런데 은근 이런 적 있지 않나요?치약으로 양치해야 하는데세안제를 칫솔에 뿌린다던가샴푸로 머리를 감아야 하는데착각해서 린스를 머리를 감거나 하는 등생각보다 실수할 때가 많지요.(제가 그랬다는 건 아니...)새로운 것에 대한 호기심이랄까과연 종이세제 테크간편시트가 얼마나세탁이 잘 될까 궁금하네요.만약에 만족스럽게 되면재구입도 고려해야 봐야 되겠어요.아~그리고요 제품은 드럼세탁기, 일반세탁기모두에 사용할 수 있으니 참고하세요.종이박스에서 팩만 꺼내서 찍어봤습니다.이렇게 보니 영락없는 물티슈네요.이거 정말 착각할 수도 있을 듯?종이박스의 한 면에는종이세제 간편시트를 사용하는 방법이자세하게 안내가 되어 있어요.시트는 녹지 않으니 빨래와 함께세탁조에 넣어야 한다~!드럼세탁기를 사용하는 분들은배수구 부분이 막힐 수 있으니 넣을 때주의하셔야 한다~부직포를 청소용으로 재활용할 수 있다?요거 괜찮네요 이번에는 그냥 버렸는데포스팅을 하다가 발견하게 되었네요.세탁효과를 더 높이기 위해서는표백제와 함께 사용하면 좋다고 하네요.드디어 개봉박두~!!열어보니 뭐랄까 변기세정제 색상?하늘빛이 나네요.요렇게 해두니 정말 물티슈입니다.하지만 다시 말씀드리자면 이건종이세제 테크간편시트입니다.그런데 솔직히 이 사진만 보여주면누구나 착각을 할 수도 있겠다 싶네요.한 장을 뽑아서 펼쳐 보았는데대충 크기가 짐작이 되시죠?제가 직접 재보지 않아서...흠흠뭔가 허술한 리뷰.그것이 바로 인간적인 매력.궁금하신 분들은 또다시 검색을해보셨으면 좋겠습니다.죄송합니다.사용방법은 간단합니다.일단 빨아야할 빨래감을준비해야 되겠죠?ㅎㅎ세탁조에 모은 빨래에종이세제 테크간편시트를투하!!합니다.세탁조에 있는 빨래감은몇몇 분에게 혐오감을 줄 수 있기때문에 자체적으로 모자이크 처리!궁금하신 분들은...아니 그냥 궁금해 하면 안 됩니다.이것저것 빨래해야 할 것들 입니다.이렇게 넣을 거 다 넣은 뒤에50분을 돌려주면 세탁을 무사히마치게 됩니다.빨래가 끝난 후기를 간단히 말씀드리면가루세제 못지 않게 괜찮게 세탁이되더라구요~간단하게 뽑아쓸 수 있는 점이정말 괜찮은 것 같아요.용량 큰 제품을 사기에는 무게가걸리는 분들은 요거 한 번 고려해보셔도좋을 것 같아요.","'종이', '세제', '테크', '간편', '시트', '처음', '평소', '빨래', '때', '가루', '세제', '마트', '밖', '보이지', '처음', '걸', '생각', '몇', '달', '이사', '지도', '짐', '것', '수', '세탁', '세제', '발견', '종이', '세제', '테크', '간편', '시트', '살림', '분', '자취', '저', '이제', '알', '제품', '세제', '가루', '생각', '액체', '세제', '것', '알', '저', '이', '제품', '정말', '보통', '일', '주일', '번', '정도', '빨래', '요', '제품', '하나', '달', '주로', '잡고', '계산', '달', '정도', '수', '구입', '이마트', '구입', '가격', '정도', '걸', '기억', '가격', '구입', '따라서', '수', '알', '바', '요', '종이', '세제', '테크', '간편', '시트', '종이', '박스', '물티슈', '팩', '물티슈', '잘못', '수도', '생각', '잠깐', '은근', '적', '치약', '양치', '안제', '칫솔', '샴푸', '머리', '착각', '린스', '머리', '등', '생각', '실수', '때', '제', '건', '것', '대한', '호기심', '랄', '과연', '종이', '세제', '테크', '간편', '시트', '얼마나', '세탁', '만약', '만족', '입도', '고려', '제품', '드럼세탁기', '세탁기', '모두', '사용', '수', '참고', '종이', '박스', '팩', '영락', '물티슈', '거', '정말', '착각', '수도', '듯', '종이', '박스', '면', '종이', '세제', '간편', '시트', '사용', '방법', '안내', '시트', '녹지', '빨래', '세탁', '드럼세탁기', '사용', '분', '부분', '수', '때', '주의', '부직포', '청소', '용', '재활', '수', '거', '이번', '그냥', '포스팅', '발견', '세탁', '효과', '더', '위', '표백제', '사용', '개봉', '박두', '어보', '변기', '정제', '색상', '하늘빛', '해', '정말', '물티슈', '다시', '이건', '종이', '세제', '테크', '이', '사진', '누구', '착각', '수도', '장', '대충', '크기', '짐작', '제', '직접', '재', '보지', '뭔가', '술', '리뷰', '그것', '바로', '인간', '매력', '분', '검색', '사용', '방법', '일단', '빨', '빨래', '감', '준비', '세탁', '빨래', '종이', '세제', '테크', '간편', '시트', '투하', '세탁', '빨래', '몇몇', '분', '혐오', '감', '줄', '수', '때문', '자체', '모자이크', '처리', '분', '그냥', '안', '것', '것', '빨래', '것', '거', '뒤', '세탁', '마치', '빨래', '후기', '가루', '세제', '못', '세탁', '수', '점', '정말', '것', '용량', '제품', '사기', '무게', '분', '거', '번', '고려', '것'",네이버 블로그,https://blog.naver.com/eggshamegg/221539738034
103,테크세제,"  주부들의 많은 가사일 가운데 매일매일 사랑하는 가족들의 옷을 세탁하는 일이 차지하는 부분 참 많죠하루만 걸러도 벌써 세탁통에 하나 가득 수북이 쌓이는 세탁물들게다가 가장 흔히 사용해오던 가루세제는 넘 무겁고 또 질질 흘리기 일쑤고, 간혹 물에 쉽게 용해되지않아 기껏 탈수까지 마쳤는데도 옷 틈 사이사이에 꽉 박혀 자리하기도 하구요용해가 쉬운 액체세제도 무겁거나 또는 자꾸만 한쪽으로 쏠리는 패키지 때문에 불편함은 마찬가지  >_<하지만,이제 그런 불편함이나 번거로움을 싹 덜어준 신개념 세제가 나왔답니다바로 생활용품 전문업체 LG생활건강에서 나온 '테크 간편시트'라는 제품인데말 그대로 얇은 시트지 개념의 세제랍니다.      보세요 외관은 바로 일반 티슈와 같구요  종이 상자를 열면 그안에 건조를 막는 또 다른 패키지가 자리해있답니다근데 중요한건 혹시나 공기로 인한 다소의 건조상태가 되어도 물과 만나면 다시 세제 본연의 임무를 다하니까 건조에 대한 염려는 전혀 없는 셈이죠^^  자~ 이렇게 뽑아보니 더더욱 티슈와 닮은 모습이죠?손에 전해지는 미끈거리듯 묵직한 감촉고것이 바로 세제성분 이겠죠?  세탁물을 먼저 넣은 후 이렇게 맨 위에 편평하게 펴주세요  좀더 리얼함을 살리기위해 저희 아들 스트라이프 티셔츠를 받침으로 깔았답니다잘 보이게 하려는  저의 쎈스!!! ^^  과연 종이 한장에 충분한 양의 세제가 담겨있을까 하는 의구심 드시죠?하지만 일반 세제 못지않은 거품과 뿌옇게 변한 오염된 세탁물 빛깔이 저를 안심시켜주네요^^  탈수 마치고나니 세제성분 쏘~옥 빠져버린 건조한 시트로 변해있네요물론 요건 끄집어내주셔야죠             세척력이 궁금하신 분들을 위해...딸아이의 음식 얼룩이 남아있던 티셔츠와 항상 부분 손질을 요했던 교복 블라우스 깃부분입니다누런 얼룩도, 찌든때 자국도 모두모두 사라져버렸답니다  휘뤼릭~~ 하면서 ^^단지 쩜 아쉬운 점 하나 있다면 향의 강도가 다소 부족하지 않나싶어요섬유린스 효과까지 바랬던 제 욕심이 넘 컸나봐요그래서 습관대로 유연제 살짝 추가해주었답니다^^  화창한 봄햇살을 밭으며 더욱 하얘진 옷들을 바라보니 제 맘도 하얘진듯 깨끗함과 상쾌함이 절로절로 느껴집니다  ^&^ ","'부들', '가사', '일', '가운데', '매일', '사랑', '가족', '옷', '세탁', '차지', '부분', '하루', '도', '벌써', '세탁', '통', '하나', '가득', '세탁물', '게다가', '가장', '사용', '가루', '세제', '또', '질질', '일쑤', '간혹', '물', '용해', '기껏', '탈수', '옷', '틈', '사이사이', '꽉', '자리', '용해', '액체', '제도', '자꾸만', '한쪽', '패키지', '때문', '마찬가지', '이제', '움', '싹', '준', '개념', '세제', '바로', '생활용품', '전문', '업체', '생활', '건강', '테크', '간편', '시트', '제품', '말', '그대로', '시트', '개념', '랍니', '외관', '바로', '일반', '티슈', '종이', '상자', '안', '건조', '또', '다른', '패키지', '자리', '혹시', '공기', '다소', '건조', '상태', '물', '다시', '세제', '본연', '임무', '건조', '대한', '염려', '전혀', '자', '더', '더욱', '티슈', '모습', '손', '듯', '감촉', '것', '바로', '세제', '성분', '세탁물', '먼저', '후', '맨', '위', '편평', '좀더', '리얼', '함', '위해', '저희', '아들', '스트라이프', '티셔츠', '받침', '보이', '저', '쎈스', '과연', '종이', '한장', '양', '세제', '의', '구심', '일반', '세제', '거품', '오염', '세탁물', '빛깔', '저', '안심', '탈수', '마치', '나니', '세제', '성분', '옥', '시트', '요건', '세척', '분', '위해', '딸아이', '음식', '얼룩', '티셔츠', '항상', '부분', '손질', '요', '교복', '블라우스', '깃', '부분', '다누', '런', '얼룩', '때', '자국', '모두', '휘뤼릭', '단지', '쩜', '점', '하나', '향', '강도', '다소', '섬유', '린스', '효과', '바랬던', '제', '욕심', '습관', '유연제', '살짝', '추가', '봄', '햇살', '밭으', '더욱', '옷', '제', '맘', '절로', '절로'",네이버 블로그,https://mskim1747.blog.me/120067682774
