,Keyword,Contents,Words,Source,URL
0,테크세제,"[테크 실내건조 냄새제거 드럼용 액상세제, 3L, 1개 사용리뷰]구매할까 망설이는 당신, 지금 이 후기 및 리뷰를 보면 마음이 결정 될 것이다.(구매에 도움되시라고 평이 좋은 것들만 골랐으니 참고바랍니다)9,400원 (1회당 63원)테크 실내건조 냄새제거 드럼용 액상세제▶ 자세한 가격 및 정보 확인하기 ◀coupa.ng'테크 실내건조 냄새제거 드럼용 액상세제 사용리뷰'총 5,730개 상품평의 평균 별점 ★★★★☆2018.06.24 ★★★★★오피스텔이라  다우니를 써도 빨래를 말리면 늘 꿉꿉하고, 빨래가 다 마르면 눅눅한 냄새가 나서매번 페브리즈를 뿌리면서 옷을 입었는데,이런 고생에서 드디어 해방됐어요실내건조용 세제같은게 있는지도 모르고, 쿠팡에서 스크롤 내리다가우연히 실내건조라는 네글자를 보고 이거다 싶어서 바로 충동구매했는데요정말 후회가 하나도 없는 정도가 아니라 매우 만족스러운 구매가 됐어요빨래에서 나는 꿉꿉하고 눅눅한 냄새가, 이 제품을 쓰니까 순식간에 다 없어졌어요세제하나 바꿧는데 어떻게 이렇게 변할 수 있는지 신기하네요원룸/오피스텔 사시는 분들은 여름에 습해지면 정말 빨래널기 지옥이실텐데꼭 구매하세요2017.07.23 ★★★★★꿉꿉한 냄새 끝 이라는 이 슬로건에 충실한 역할을 해주어서 만족스럽습니다. 원룸 드럼세탁기 쓰는데요. 여름 맞이해서 너무 냄새나고 해서 전용세제 넣고 통세척하고 해도 뭔가 시원찮았는데.이거 쓰니까 불쾌한냄새가 없어요!!!!! 섬유유연제를 쓰지않았는대도!!!!! 진짜 냄새땜에 섬유유연제 고농축을 꽉채워서 넣곤했거든요세상편하고 좋으네요...??얼룩은 더 써봐야 알겠지만 실내에서 건조해야하는 자취생에게 정말 최고에요! 짱짱! 재구입의사 잇습니당!2016.11.16 ★★★★★일단 배송 빨랐고, 상품평에 내용물이 다 새서 왔다고 써져있어서 걱정했으나 그런 거 전혀 없이 안전하게 도착했습니다ㅋㅋ자취생이라 빨래는 모두 집안에서 햇빛 못보면서 건조되는 형편입니다세탁을 해도 꿉꿉하고 땀내가 가시지 않는 것 같기도 하고, 홀애비냄새도 나는 것 같아 구매했습니다세탁 후 입을 때 기분이 정말 좋습니다 이제야 세탁 후 냄새가 잡아진 것 같습니다ㅋㅋ!양도 엄청 많고 뚜껑자체가 용량컵이 돼서 양 조절도 가능합니다재구매율 100프롭니다ㅋㅋ2019.03.08 ★★★★★진짜 냄새 안 나네요. 물론 실내건조라도 비교적 환기 잘 되고 습하지 않은 계절이긴 하지만 좁은 원룸에서 이 정도면 매우 안심하고 쓸 수 있겠어요. 실내건조니까 냄새뿐 아니라 성분도 신경 썼을 거구요.그리고 양도 별로 안 넣었는데 세탁 잘 돼요.원래 드럼용은 거품이 별로 안 난다는데 이 세제 자체가 거품이 적은 게 아니에요. 세탁조 살균?느낌으로 이 세제만 뚜껑의 밑에서 두번째 눈금까지만 넣고 삶음 기능 돌렸는데 이땐 세탁물이 없어서인지 오히려 끝나고도 거품이 남아있었어요.근데 옷 넣고 세탁할 땐 거품이 별로 없더라구요.그래서 양이 적었나 하는데 옷 중에 딱 하나가 쉰 냄새 나서 실망할 뻔 했어요. 근데 그마저도 마르고 나니 냄새 하나도 안 나요!! 원룸 사시는 분들 여름 아니라도 추천합니다(세척력은 흙에서 뒹굴고 노는 게 아니라면 다 거기서 거기라고 생각하는 일인입니다)2018.01.07 ★★★★★섬유유연제는 꽃담초를 사용하고,빨래 세제는 테크 실내건조+진드기99%제거 둘이 섞어서 쓰는데 궁합이 참 괜찮은 것 같아요! 테크 세제 역할이 세탁한 옷이 마르면서 발생되는 세균을 억제 시켜 주니 섬유유연제는 꽃담초를 같이 사용하니 냄새 나는 일이 없네요*^^*바지 허리 부분은 두껍고 잘 안 말라서 자칫 세균으로 인해 걸레 냄새나기 쉬운데, 섬유유연제와 빨래 세제 궁합이 좋으니 그만하면 세균 냄새가 안 나는 편인 것 같아요!+ 1년 4개월 넘게 여지껏 빨래를 해도 수건에서 걸레 냄새가 났던 적이 딱 두 번 있었는데 이건 수건에 세균이 많은 거라서 수건은 한 번씩 삶음 코스로 뜨겁게 세탁해 주셔야 해요. 그리고 세탁기도 한 번씩 살균 코스로 돌려 주셔서 내부 청소를 해주셔서 세탁기 관리를 잘 해주셔야 빨래 세탁 효과가 배로 탁월해 지는 것 같아요!테크 액체세제 추천합니다!!!!적은 양으로도 거품이 잘 나고, 모든지 적정량을 사용해야 효과가 좋은건 아시죠?경제적이고 빨래도 깨끗하게 잘 빨립니다!오염도 잘 지워져요! ?'테크 실내건조 냄새제거 드럼용 액상세제 사용리뷰'※ 해당 포스팅은 2019년 07월 27일 21시 26분 에 작성 하였음을 알려드립니다.지금 바로 9,400원 가격에 구매 가능한 링크테크 실내건조 냄새제거 드럼용 액상세제▶ 자세한 가격 및 정보 확인하기 ◀coupa.ng사용리뷰 사진Next image※ 해당 사진은 Cou-pang 사용리뷰사진입니다 ※'액상세제 실내건조 테크 드럼용 냄새제거'#생활용품 #드럼전용세제 #세탁세제펭귄 스토어는 판매자가 아닙니다.늘 좋은 제품을 소개시켜드리도록 노력하겠습니다.","'테크', '실내', '건조', '냄새', '제거', '드럼', '용', '액', '세제', '개', '사용', '리뷰', '구매', '당신', '지금', '이', '후기', '및', '리뷰', '마음', '결정', '것', '구매', '도움', '평이', '것', '참고', '테크', '실내', '건조', '냄새', '제거', '드럼', '용', '액', '세제', '가격', '및', '정보', '확인', '테크', '실내', '건조', '냄새', '제거', '드럼', '용', '액', '세제', '사용', '리뷰', '총', '개', '상품', '평의', '평균', '점', '오피스텔', '다우니', '빨래', '말리', '늘', '빨래', '마르', '냄새', '매번', '페브리즈', '옷', '고생', '해방', '실내', '건조', '용', '세제', '쿠팡', '스', '크롤', '실내', '건조', '글자', '보고', '거', '바로', '충', '구매', '정말', '후회', '하나', '정도', '매우', '구매', '빨래', '나', '냄새', '이', '제품', '순식간', '하나', '바꿧는데', '수', '원룸', '오피스텔', '사시', '분', '여름', '정말', '빨래', '지옥', '텐데꼭', '구매', '냄새', '끝', '이', '슬로건', '역할', '원룸', '드럼세탁기', '여름', '맞이', '냄새', '전용', '세제', '통', '세척', '해도', '뭔가', '거', '냄새', '섬유', '유연제', '대도', '진짜', '냄새', '땜', '섬유', '유연제', '농축', '꽉', '상편', '얼룩', '더', '실내', '자취', '생', '정말', '최고', '짱짱', '재', '구입', '의사', '습', '일단', '배송', '상품', '평', '내용물', '걱정', '거', '전혀', '도착', '자취', '생', '빨래', '모두', '집안', '햇빛', '건조', '형편', '세탁', '해도', '땀내', '가시', '것', '홀애비', '냄새', '나', '것', '구매', '세탁', '후', '입', '때', '기분', '정말', '이제야', '세탁', '후', '냄새', '것', '양도', '뚜껑', '자체', '용량', '컵', '양', '조절', '율', '프롭니', '진짜', '냄새', '안', '실내', '건조', '비교', '환기', '계절', '원룸', '이', '정도', '매우', '안심', '수', '실내', '건조', '냄새', '성분', '신경', '거구', '양도', '별로', '안', '세탁', '원래', '드럼', '거품', '별로', '안', '이', '세제', '자체', '거품', '게', '세탁', '살균', '느낌', '이', '세제', '뚜껑', '밑', '두번째', '눈금', '기능', '땐', '세탁물', '인지', '오히려', '거품', '옷', '세탁', '땐', '거품', '별로', '양', '옷', '중', '하나', '쉰', '냄새', '뻔', '그', '마르고', '나니', '냄새', '하나', '안', '원룸', '사시', '여름', '추천', '세척', '흙', '고', '노', '게', '거기', '거기', '생각', '일인', '섬유', '유연제', '꽃담초', '사용', '빨래', '세제', '테크', '실내', '건조', '진드기', '제거', '둘', '궁합', '것', '테크', '세제', '역할', '세탁', '옷', '발생', '세균', '억제', '주니', '섬유', '유연제', '꽃담초', '사용', '냄새', '나', '바지', '허리', '부분', '안', '말', '자칫', '세균', '걸레', '냄새', '나기', '섬유', '유연제', '빨래', '세제', '궁합', '세균', '냄새', '안', '나', '편', '것', '개월', '여지', '껏', '빨래', '해도', '수건', '걸레', '냄새', '적', '두', '번', '이건', '수건', '세균', '거', '수건', '번', '코스', '세탁', '해', '세탁기', '번', '살균', '코스', '내부', '청소', '세탁기', '관리', '빨래', '세탁', '효과', '배', '것', '테크', '액체', '세제', '추천', '양으로', '거품', '모든', '적', '정량', '사용', '효과', '건', '아시', '경제', '빨래', '빨립니', '오염', '테크', '실내', '건조', '냄새', '제거', '드럼', '용', '액', '세제', '사용', '리뷰', '해당', '포스팅', '작성', '음', '지금', '바로', '가격', '구매', '링크', '테크', '실내', '건조', '냄새', '제거', '드럼', '용', '액', '세제', '가격', '및', '정보', '확인', '사용', '리뷰', '사진', '해당', '사진', '사용', '리뷰', '사진', '액', '세제', '실내', '건조', '테크', '드럼', '용', '냄새', '제거', '스토어', '판매', '자가', '늘', '제품', '소개', '노력'",네이버 블로그,https://blog.naver.com/ckdbajtwoddl/221597446871
1,테크세제,"안녕하세요! 여러분! 한 주 마무리 잘 하고 계신가요?아마 지금쯤 먼저 잠자리에 드신 분들도 있을거고, 일요일 이 시간이 아까워 쉬이 잠을 이루지 못하는 분들도 계실겁니다.저도 잘 보냈어요. 이번 주는 여느 주 보다 체력적으로 더 힘들고 정신이 없었지만, 그래도 꽉 찬 주를 보낸 것 같아 보람차네요.요즘 날씨 정말 덥지요?아직 7월 초인데도 불구하고 벌써부터 폭염주의보가 심심하지 않게 울리고 있어요. 장마기간이라고는 하지만 마른 장마가 계속 지속되고, 비는 시원하게 쏟아지지도 않고 있습니다.장마철 비가 너무 많이 오는 것도 문제지만, 너무 안 오는 것도 문제네요. :-(비가 올 거 같으면, 날이 습하고 꿉꿉해지기는 하지만 막상 비가 오지 않거나 내려도 조금만 내리니 불쾌지수만 올라 가는 날이 많았어요.그게 아니면 해가 쨍쨍 타들어가는 날씨가 연속이구요.제가 20대 초반일때만 해도 장마철엔 계속 우중충한 날이 반복되고, 비가 계속 내려서 지겨웠었어요. 장마철만의 우중충한 분위기로 인해 그때만의 차분한 감성이 좋았었는데, 이제는 그 차분한 장마철의 감성이 그리워지곤 하네요.이러한 날씨 탓에, 운동을 하면 제 땀의 양은 2배정도가 더 늘었습니다. ㅎㅎㅎ겨울에도 땀을 많이 흘리지만, 아무리 에어컨을 틀어도 여름이라는 것을 숨길 수 없듯 제 몸에서는 땀이 굉장이 많이 나더라구요.게다가 제가 사는 아파트에서는 너무 늦은 시간에는 세탁기 사용을 자제해달라고 하니 땀에 절은 운동복은 그 다음날 아침에서야 빨수가 있었습니다.겨울에는 덜 했는데, 날이 더워지면서 빨래가 조금만 지체되어도 땀에 절은 운동복 때문에 빨랫감에서 냄새가 많이 시작했습니다.빨래를 해서 건조를 잘 시켜도 냄새가 심하게 날 때에는 정말 짜증이 나더라구요. 특히나 운동을 주기적으로 하시는 분들은 더욱더 공감이 되실 겁니다. ㅜ처음 독립을 하고나서 몇 푼이라도 아껴보자는 마음에 그동안엔 조금 저렴한 드럼세탁기용 세탁세제를 사용하고 있었습니다.'세탁세제 요즘 뭐 별다른 차이 있겠어? 요즘 우리나라도 공산품을 얼마나 잘 만드는데 ~ '라고 생각하며 유명하지도 않고 가격도 더 저렴한 세탁세제를 골랐었지요.겨울에 보송보송한 빨랫감을 세탁기에 돌릴때에만 해도 가성비 갑이라며 좋아했던 세탁세제가! 여름이 되니 제기능을 못하는 것처럼 느껴지더라구요.ㅠ그 땀에 절은 운동복에서 나는 쾌쾌한 냄새는 어쩔 수 가 없었나봅니다.빨래를 해도 그 쾌쾌한 냄새가 가질 않았습니다. 섬유유연제를 아무리 많이 넣어도 저 끝에서 수줍은 듯 고개를 사알짝 드는듯한 쾌쾌한 냄새..마침 세탁세제도 다 써가는 찰나에, '이대론 안되겠다. 좀 더 강려크한 것을 구매해야겠다.' 라는 마음이 크게 자라나서구입한 LG 테크 세제! 예. 맞습니다.오늘의 포스팅은 이 '테크'라는 세탁세제에 대한 포스팅입니다. :-)쨍한 주황색과 진한 파랑의 테크 세제는 '이 세제는 아주 강려크 합니다.' 라는 아우라를 뿜어내는 듯 보였습니다.강렬한 색만큼이나 세제의 기능또한 강력하게 느껴졌어요.게다가 온라인 마트에서 1+1 세일을 하고 있었기에 가격도 아주 합리적이었어요.게다가 '냄새 걱정 끝!' 이란 문구가 제 마음을 마구 흔들어 놓았지요. :-)LG제품이라 기능도 좋겠거니, 믿음을 갖고 구입해보았습니다.기존에 쓰던 제품과는 약 3~4천원 차이가 났었습니다.좀 더 자세히 제품을 살펴보기 위해 뒷 쪽을 살펴보았습니다. :-)마법의 가루로 유명한 베이킹소다와 구연산이 들어있으며 형광증백제가 들어있지 않아 피부에 더 안전하다고 적혀있었습니다.저는 일부러 야무진 살림을 위해 베이킹소다와 구연산 가루를 따로 구매했는데, 이렇게 따로 구매하지 않고도 세탁세제에 포함되어 있다고 하니편리하다고 느껴졌습니다. 동시에 돈이 아깝기도 했구요.ㅠ 베이킹 소다는 과일 씻을 때 사용해야겠습니다. ㅎㅎ게다가 풀림성과 헹굼력이 좋고 세제찌꺼기 걱정도 안해도 된다고 하니 혹할만 하군요.빨래를 빨리 해보고 싶어지는 마음이 들기 시작했습니다. ㅎㅎ남아있는 기존의 세제를 얼른 다 써버리려고 빨래할 때 세제를 후하게 사용했었습니다.세탁세제를 한 컵만 넣어도 되는 빨래양이었다면, 두 컵을 넣는 방식으로요.ㅎㅎ 그리하여 기존의 세제를 얼른 다 쓰게 되었고, 새로 구매한 테크 세제를 쓰게 되는 날이 되었습니다. (하앍)      세제 입구는 다른 세제와 별 다른 차이가 없었습니다.세제를 깔끔하게 덜 수 있게끔 세제 입구가 좁게 만들어져 있었습니다. :-) 그리고 세제를 뚜껑에 덜어서 세탁기에 넣어 보았어요.기존에 쓰던 세제는 투명한 액체였는데, 테크는 파란색의 액체였습니다. 색에서부터 더 강려크함이 느껴졌고,기존에 쓰던 세제보다 세제의 향이 굉장히 진했습니다. 강력한 만큼 향이 강한 것일까요? :-)여기서, 한 가지 아쉬운 점이 있었는데, 전에 쓰던 제품은 뚜껑에 용량이 표시되어있어서 참 편했거든요.하지만 LG테크 세탁세제의 뚜껑에는 용량표시 눈금이 없었습니다.빨래감 키로수에 따른 세탁세제 권장량이 적혀져 있었으나 그 양을 뚜껑으로 가늠하기가 힘들었어요.예를 들면 '빨래감 5kg에는 뚜껑기준으로 2컵' 이런 식으로요.눈을 씻고 찾아보아도 알 수가 없어 제 동물적인 감각으로 세탁 세제의 양을 조절하여 빨래를 해야 했었네요. :-)지금은 이 테크 세제를 사용한 지 일주일이 다되어 가는데, 기능적인 면에서 아주 만족하고 있어요.전보다 세제양을 적게 넣어도, 빨래가 다 되었을 때부터 쾌쾌한 냄새가 시작되었지만 이 세제로 바꾸고 나서는 그 쾌쾌한 냄세가 현저히 줄어들었으며,건조를 하고 난 다음에 나는 악취도 없어졌습니다. 빨래가 잘못 되었을 땐 특히 땀을 많이 흘리는 운동복이나 스포츠 브라에서 냄새가 심하게 났었는데 그 증상이 많이 줄었습니다.기분 탓일 지는 모르겠지만 좀더 깨끗하고 산뜻하게 빨리는 느낌도 들고요. :-)세탁세제의 향이 강해서 제가 좋아하는 섬유유연제의 향이 가려질까 조금 더 부어서 쓰고 있긴 합니다.빨래 시작 전 세제를 넣을 때엔 세제 냄새가 강해서 코끝이 시큰 할 때도 있거든요! 그렇다고 해서 독한 냄새의 수준은 아니고 조금 강한 느낌일 뿐이니 참고해주세요.운동하는 저로서는 맘에 드는 세제였습니다.앞으로 계속 쓸 것 같네요. :-)어느덧 글을 다 쓰고 나니 12시가 넘었네요!저도 이제 글을 마무리하고 잘 준비를 해야겠습니다.여러분들도 모두 꿀잠 자시고 내일 하루 상쾌하게 월요일 아침을 맞이하시길 바라요. 그럼 저는 오늘은 여기까지! 다음 포스팅에서 뵙겠습니다. 안뇽~! ","'여러분', '주', '마무리', '아마', '지금', '먼저', '잠자리', '분', '일요일', '이', '시간', '쉬이', '잠', '분', '저', '이번', '여느', '주', '체력', '더', '정신', '꽉', '찬', '주', '것', '보람', '요즘', '날씨', '정말', '초인', '데', '불구', '벌써', '폭염', '주의보', '장마', '기간', '장마', '계속', '지속', '장마철', '비', '것', '문제', '안', '것', '문제', '비', '거', '날', '지기', '막상', '비', '오지', '조금', '불쾌', '지수만', '날', '그게', '해', '타', '날씨', '이구', '제', '초반', '때', '해도', '장마철', '계속', '날', '반복', '비', '계속', '장마철', '분위기', '그때', '감성', '이제', '그', '장마철', '감성', '날씨', '탓', '운동', '제', '땀', '양은', '배', '정도', '더', '겨울', '땀', '에어컨', '여름', '것', '수', '제', '몸', '땀', '굉장', '게다가', '제', '아파트', '시간', '세탁기', '사용', '자제', '하니', '땀', '절', '운동복', '그', '다음', '날', '아침', '겨울', '덜', '날', '빨래', '조금', '지체', '땀', '절', '운동복', '때문', '빨랫감', '냄새', '시작', '빨래', '건조', '냄새', '날', '때', '정말', '짜증', '나', '운동', '기적', '분', '더욱더', '공감', '처음', '독립', '몇', '푼', '마음', '그동안', '조금', '드럼세탁기', '용', '세탁', '세제', '사용', '세탁', '세제', '요즘', '뭐', '차이', '요즘', '우리나라', '공산품', '얼마나', '생각', '가격', '더', '세탁', '세제', '겨울', '빨랫감', '세탁기', '때', '해도', '가성', '비', '세탁', '세제', '여름', '기능', '것', '그', '땀', '절', '운동복', '나', '쾌쾌', '냄새', '수', '빨래', '해도', '그', '쾌쾌', '냄새', '섬유', '유연제', '저', '끝', '듯', '고개', '알짝', '쾌쾌', '냄새', '마침', '탁세', '제도', '찰나', '대론', '좀', '더', '강려', '것', '구매', '마음', '크게', '구입', '테크', '세제', '예', '오늘', '포스팅', '이', '테크', '세탁', '세제', '대한', '포스팅', '쨍', '주황색', '파랑', '테크', '세제', '이', '세제', '아주', '강려', '아우라', '듯', '색', '세제', '기능', '또한', '게다가', '온라인', '마트', '일', '가격', '아주', '합리', '게다가', '냄새', '걱정', '끝', '이란', '문구', '제', '마음', '마구', '제품', '기능', '믿음', '구입', '기존', '제품', '약', '차이', '좀', '더', '제품', '위해', '쪽', '마법', '가루', '베이', '킹소', '구연산', '형광', '증', '백제', '피부', '더', '저', '일부러', '살림', '위해', '베이', '킹소', '구연산', '가루', '구매', '구매', '세탁', '세제', '포함', '하니', '동시', '돈', '기도', '베이', '킹', '소', '과일', '때', '사용', '게다가', '풀림', '성과', '헹굼력', '찌꺼기', '걱정', '안해', '하니', '혹', '군', '빨래', '마음', '시작', '기존', '세제', '얼른', '빨래', '때', '세제', '후', '사용', '세탁', '세제', '컵', '빨래', '두', '컵', '방식', '요', '기존', '세제', '얼른', '구매', '테크', '세제', '날', '하앍', '세제', '입구', '다른', '세제', '별', '다른', '차이', '세제', '덜', '수', '세제', '입구', '세제', '뚜껑', '세탁기', '기존', '세제', '액체', '테크', '파란색', '액체', '색', '더', '강려', '함', '기존', '세제', '세제', '향', '만큼', '향', '것', '요', '여기', '가지', '점', '전', '제품', '뚜껑', '용량', '표시', '테크', '세탁', '세제', '뚜껑', '용량', '표시', '눈금', '빨래', '감', '키', '수', '세탁', '세제', '권', '장량', '그', '양', '뚜껑', '가늠', '예', '빨래', '감', '뚜껑', '기준', '컵', '식', '요', '눈', '알', '수가', '제', '동물', '감각', '세탁', '세제', '양', '조절', '빨래', '지금', '이', '테크', '세제', '사용', '일주일', '기능', '면', '아주', '전보', '세제', '빨래', '때', '쾌쾌', '냄새', '시작', '이', '세제', '그', '쾌쾌', '현저', '건조', '난', '다음', '나', '악취', '빨래', '잘못', '땐', '땀', '운동복', '스포츠', '브라', '냄새', '그', '증상', '기분', '탓일', '좀더', '느낌', '세탁', '세제', '향', '제', '섬유', '유연제', '향', '조금', '더', '부어', '빨래', '시작', '전', '세제', '때', '세제', '냄새', '코끝', '시', '때', '냄새', '수준', '조금', '느낌', '일', '참고', '운동', '로서', '맘', '세제', '앞', '계속', '것', '글', '나니', '저', '이제', '글', '마무리', '준비', '여러분', '모두', '꿀잠', '자시', '내일', '하루', '월요일', '아침', '맞이', '저', '오늘', '여기', '다음', '포스팅', '안뇽'",네이버 블로그,https://blog.naver.com/minblow/221580081494
