,Keyword,Contents,Words,Source,URL
44,테크세제,"테크 액체세제 베이킹소다+구연산도저히 끝날 것 같지 않던 무더위가 어느 날 갑자기 물러나더니 날이 선선해졌어요.급격한 날씨 변화에 적응하기 쉽지 않지만, 지금은 여름을 정리해야 할 때.여름 이불을 빨면서 설레는 마음으로 새로운 계절을 준비해요.  테크 4대 얼룩 강력 제거! 베이킹 소다+구연산이불 빨래에 이번에 업그레이드된 테크 액체세제를 사용해 봤어요. 테크 액체 세제엔 세 종류가 있어요.더욱 강력해진 세척력과 탈취력을 자랑하는 베이킹 소다+구연산섬유 속 진드기 사체 및 배설물을 제거하는 진드기 사체 배설물 제거꿉꿉한 냄새를 없애주는 실내 건조 냄새 제거이중 저는 베이킹 소다+구연산을 사용해 봤어요. 테크 베이킹 소다+구연산일반용 / 3L강렬한 오렌지빛 용기, 업그레이드된 오렌지 군단 중 하나예요.액체세제라 굉장히 묵직해요.무겁지만 손잡이 부분에 울퉁불퉁한 홈이 있어 잡기 편해요. 뒷면엔 제품에 대한 설명이 적혀있어요.테크 베이킹 소다+구연산얼룩제거 4중 효소 함유로 업그레이드!01. 생활 오염 특화 효소로 4대 얼룩 강력 제거     단백질 얼룩 / 간장, 주스 얼룩 / 흙먼지 얼룩 / 땀, 피지 얼룩02. 세척력을 강화시켜주고, 꿉꿉한 냄새를 없애주는 베이킹 소다와 구연산이 함유돼서      더욱 강력해진 세척력과 탈취력03. 형광증백제 無 첨가, 식물계 세정 성분 함유 권장 사용량 및 제조일자 옆면에 투명 창이 있어 남은 용량을 확인할 수 있어요. 뚜껑을 열고 안을 살펴봤어요.상큼한 향이 확 풍기네요.구연산 특유의 새콤한 향, 상큼하고 산뜻해 빨래할 때 기분이 상쾌해져요.  액체세제가 나오는 입구가 깔때기 모양이에요.흘리지 않고 깨끗하게 뚜껑에 따를 수 있어요.  파란색 뚜껑, 큼지막해요.자세히 보시면 안쪽에 눈금이 있어 계량컵으로 사용할 수 있어요.오렌지색 용기에 파란 뚜껑, 색의 대비가 강렬하네요.멀리서 봐도 눈에 확 띄어요.  입구가 깔때기 모양이라 힘을 덜 들이고 세제를 따를 수 있어요. 약간의 점성이 있는 초록색 세제.이제 세탁해 볼까요? 여름용 이불을 세탁기에 넣고 60ml 정도의 세제를 넣어요.세탁 모드를 설정하고 빨래가 되기를 기다려요.액체세제라 가루 날림도 없고 세탁기 주변에 묻은 가루 청소할 일도 없어 정말 편해요.  무엇보다도 세제가 완전히 용해되어 빨래 후 찌꺼기가 남는 일이 없어요.형광증백제를 첨가하지 않아 안심하고 사용할 수 있는데 식물성 세정 성분이라 더 마음에 들어요.빨래하는 동안 싱그럽고 상큼한 향이 집안 가득 풍겨요. 바삭바삭한 햇빛과 폭신폭신한 바람으로 말려요.  새 이불 같아요.여름내 붙어있던 묵은 때가 속 시원하게 제거됐어요.세척력 정말 좋아요.세척력이 좋은 만큼 피부에 자극이 있진 않을까 걱정되시죠?걱정 마세요.피부 비자극 테스트를 완료했어요.안심하고 사용하셔도 돼요. 보송보송, 부들부들, 폭신폭신.새 이불 덮고 기분 좋게 푹 잤어요.  흰옷을 세탁한 결과도 보여 드릴게요.목뒤에 염모제가 묻어 누렇게 바랜 흰 티셔츠예요.몇 번 세탁을 해 봤지만 얼룩이 빠지질 않아 포기했었는데 테크로 빨았더니 깨끗해졌어요.바랜 듯한 흰옷이 하얗게 표백돼 더욱더 하얗고, 누런 얼룩이 제거돼 속이 다 시원하네요.삶아 빤 것 같아요.정말 세척력 좋아요.오래된 묵은 때들이 쏙쏙 빠져요.베이킹 소다와 구연산이 함유돼 더욱 강력해진 세척력과 탈취력의 테크 액체세제, 마음에 들어요.사용해 보세요.테크의 제품을 소개하면서 (주)LG생활건강으로부터 무료로 제품을 받았습니다.  ","'테크', '액체', '세제', '베이', '킹소', '구연산', '도저히', '것', '무더위', '날', '갑자기', '날', '날씨', '변화', '지금', '여름', '정리', '때', '여름', '이불', '마음', '계절', '준비', '테크', '얼룩', '강력', '제거', '베이', '킹', '소', '구연산', '이불', '빨래', '이번', '업그레이드', '테크', '액체', '세제', '사용', '테크', '액체', '세제', '세', '종류', '더욱', '세척', '탈취', '자랑', '베이', '킹', '소', '구연산', '섬유', '속', '진드기', '사체', '및', '배설물', '제거', '진드기', '사체', '배설물', '제거', '냄새', '실내', '건조', '냄새', '제거', '이중', '저', '베이', '킹', '소', '구연산', '사용', '테크', '베이', '킹', '소', '구연산', '일반', '용', '오렌지', '빛', '용기', '업그레이드', '오렌지', '군단', '중', '하나', '액체', '세제', '손잡이', '부분', '홈', '잡기', '면', '제품', '대한', '설명', '테크', '베이', '킹', '소', '구연산', '얼룩', '제거', '중', '효소', '함유', '업그레이드', '생활', '오염', '특화', '효소', '얼룩', '강력', '제거', '단백질', '얼룩', '간장', '주스', '얼룩', '흙', '먼지', '얼룩', '땀', '피지', '얼룩', '세척', '강화', '냄새', '베이', '킹', '소', '구연산', '함유', '더욱', '세척', '탈취', '형광', '증', '백제', '첨가', '식물계', '정', '성분', '함유', '권장', '용량', '및', '제조', '일자', '옆면', '투명', '창', '용량', '확인', '수', '뚜껑', '안', '상큼', '향', '확', '구연산', '특유', '콤', '향', '상큼', '빨래', '때', '기분', '액체', '세제', '입구', '깔때기', '모양', '뚜껑', '수', '파란색', '뚜껑', '보시', '안쪽', '눈금', '계량컵', '사용', '수', '오렌지색', '용기', '파란', '뚜껑', '색', '대비', '멀리', '눈', '확', '입구', '깔때기', '모양', '힘', '덜', '세제', '수', '약간', '점성', '초록색', '세제', '이제', '세탁', '요', '여름', '용', '이불', '세탁기', '정도', '세제', '세탁', '모드', '설정', '빨래', '액체', '세제', '가루', '날림', '세탁기', '주변', '가루', '청소', '일도', '정말', '무엇', '세제', '용해', '빨래', '후', '찌꺼기', '형광', '증', '백제', '첨가', '안심', '사용', '수', '식물성', '정', '성분', '더', '마음', '빨래', '동안', '상큼', '향', '집안', '가득', '햇빛', '폭', '폭', '신한', '바람', '새', '이불', '여름내', '때', '속', '제거', '세척', '정말', '세척', '만큼', '피부', '자극', '걱정', '걱정', '피부', '비자', '테스트', '완료', '안심', '사용', '보송보송', '부들부들', '폭', '폭신', '새', '이불', '기분', '푹', '옷', '세탁', '결과', '목뒤', '염', '모제', '누렇', '바랜', '티셔츠', '몇', '번', '세탁', '해', '얼룩', '포기', '테크', '바랜', '듯', '옷', '표백', '더욱더', '누런', '얼룩', '제거', '것', '정말', '세척', '때', '쏙쏙', '베이', '킹', '소', '구연산', '함유', '더욱', '세척', '탈취', '테크', '액체', '세제', '마음', '사용', '테크', '제품', '소개', '주', '생활', '건강', '무료', '제품'",네이버 블로그,https://blog.naver.com/joccund/221093134284
45,테크세제,"가루세제,일반세제,천연세제,액체세제를 다써보았지만 액체로된 세제가 제일좋더라고요.그리고 세제찌꺼기가 남지않고해서 정말 마음에들더라고요.테크 세제는 피부를 생각하고 민감한피부에 딱좋고 자극이없어서 좋은듯해요.믿고 사용할수있는 테크 베이킹소다+구연산 세제를 만나보았어요.이제부터 테크 베이킹소다+구연산 세제를 소개시켜드릴께요^ㅡ^  테크 일반용이고 통돌이 세탁기를 쓰는 저희집에 사용하면 정말좋답니다.그리고 4대 얼룩 강력제거와 베이킹소다+구연산이들어간 액체세제랍니다.그리고 3L가들어있어서 정말 큼직하고 무겁답니다.매일매일 빨랫감이 나오는 저희집에는 테크 세제 금방금방 다 사용할것같아요.흰옷을 더욱더 희게해주고 색깔옷은 더욱더 선명하게해주는 효과가있는 세제랍니다.그리고 세제향기가 정말 좋았어요.제마음에 쏙 들더라고요.형광증백제 무첨가,그리고 식물계 세정성분이 함유된 일반세제랍니다.베이킹소다와 구연산이들어가서 세척력을 강화시켜주고 세제가 꿉꿉한 냄새를 없애주는 역할을해서 정말 좋답니다.그리고 세제의 제조일자가 적혀져있더라고요.2017년6월5일이더라고요.그리고 계량컵에 얼마만큼 붓는지 자세하게적혀져있더라고요.그리고 사용시 주의사항등이 적혀져있었어요.색깔은 파랑색을띄고 향기가 정말 향긋하더라고요.계량컵이커서 정말 좋았고 세제를 따를때 정말 편안했어요.그리고 한컵부어도 거품이 정말 많이 나더라고요.테크 세제를 한컵 부어줍니다.되도록이면 빨랫감에는 안붓는게좋아요.얼룩이져서 안닿이는게좋답니다.이점만 참조하면된답니다.한컵 부었는데도 거품이 정말 풍성하게잘나죠?정말 신기하더라고요.거품이 풍성하게나서 제마음에 쏙 들더라고요.삶아빤듯 깨끗한 빨래가되었어요.정말 빨랫감이 부드럽더라고요.세제찌꺼기가 남지않아서 마음에들었고 정말 세척력도 놀랍고 좋았어요.앞으로는 테크 세제만 사용할거에요.피부에 자극도없고 순해서 정말 좋네요.테크세제가있어서 저희집빨래는 정말 걱정이없네요.빨래가좋아하는 세제가좋은 테크 베이킹소다+구연산 세제 추천해드리고싶네요^ㅡ^                                                        본 포스팅은 레몬테라스에서 제품을 무상으로 지급받고 작성한 후기입니다. ","'가루', '세제', '일반', '세제', '천연', '세제', '액체', '세제', '액체', '세제', '제일', '찌꺼기', '남지', '정말', '마음', '테크', '세제', '피부', '생각', '피부', '자극', '듯해', '사용', '테크', '베이', '킹소', '구연산', '세제', '이제', '테크', '베이', '킹소', '구연산', '세제', '소개', '테크', '용이', '통', '돌이', '세탁기', '집', '사용', '정말', '얼룩', '강력', '제거', '베이', '킹소', '구연산', '액체', '랍니', '정말', '매일', '빨랫감', '집', '테크', '세제', '금방', '금방', '사용', '옷', '더욱더', '색깔', '옷', '더욱더', '효과', '랍니', '향기', '정말', '마음', '쏙', '형광', '증', '백제', '무', '첨가', '식물계', '정성', '함유', '일반세', '랍니', '베이', '킹소', '구연산', '세척', '강화', '세제', '냄새', '역할', '을해', '정말', '세제', '일자', '계량컵', '얼마만큼', '사용', '시', '주의', '사항', '등', '색깔', '파랑색', '향기', '정말', '향', '계량컵', '커서', '정말', '세제', '때', '정말', '컵', '부어', '거품', '정말', '테크', '세제', '컵', '부어', '이면', '빨랫감', '얼룩', '이점', '참조', '컵', '거품', '정말', '정말', '거품', '마음', '쏙', '빨래', '정말', '빨랫감', '찌꺼기', '남지', '마음', '정말', '세척', '앞', '테크', '세제', '사용', '피부', '자극', '정말', '테크', '세제', '집', '빨래', '정말', '걱정', '빨래', '세제', '테크', '베이', '킹소', '구연산', '세제', '추천', '포스팅', '레몬', '테라스', '제품', '무상', '지급', '작성', '후기'",네이버 블로그,https://blog.naver.com/cherrym1/221094171185
46,테크세제,"테크 액체세제진드기제거더욱 더 새로워진NEW 테크 액체세제에요.이불빨래에 집착하는 저............ㅋㅋㅋㅋㅋㅋㅋㅋㅋㅋㅋㅋㅋㅋㅋㅋㅋㅋㅋ오늘도 이불빨래 놓치지 않을거에요.가을볕 정말 좋아요.파아란 하늘에 강한 햇빛이런날은 꼭 이불빨래 해야함 ;)짜자쟌새로운 모습을 하고 등장한 테크업업 UP UP4대 얼룩 강려제거와 진드기 사체 배설물 제거까지!!3L의 거대한 용량에 매우 놀랐지요.저희집은 드럼세탁기를 이용하기 때문에 드럼용으로 사용해보려고 합니다.테크 액체세제는생활오염 특화효소 함유가 되어서 4대 얼룩 (단백질, 간장 주스, 흙 먼지, 땀 피지)을 강력히 제거해주고요.계피추출물과 유칼립투스 오일 함유로 진득이 사체 배설물을 제거해준데요.형광중백제 무첨가는 기본! 식물계 세정성분이 함유되어있답니다.통이 온통 주황 주황해서얼마나 남았는지 용량체크를 어떻게 할까 싶었는데요리조리 돌려보니이쪽으로 확인할수있더라구요.세밀하게 신경쓴 테크액체세제권장사용량에 맞게뚜껑으로 계량해서 빨래를 돌려주면 된답니다.태크 액체세제로 진드기는 안녕~~~눈에 안보이기에 더욱 꼼꼼하게 관리해주어야해요.아기가 있는 집이라 무지 신경쓰이더라구요.일단 아빠옷 부터 테크 액체세로신명나게 돌려주었어요.아빠옷에 각종먼지가 우글우글!!세제투입구에 알맞게 넣어 주고돌려주면 끝!참 쉽죠잉 ;)아빠 빨래야 아빠가 쓴 수건들아바싹 말라라~테크액체세제로 돌려주고 햇볓에 바싹 말려주면빨래 기가막히게 잘되요.그 다음 엄빠 이불빨래와울 애기 이불빨래애기이불에 진득이라니.. 상상도 안되구요.이렇게 자주 자주 빨아서 햇빛에 말려주면아가도 건강하겠죠?결론은 엄마가 부지런해야함ㅋㅋㅋㅋㅋㅋㅋㅋㅋㅋㅋㅋㅋㅋㅋㅋㅋㅋㅋㅋㅋㅋㅋㅋㅋㅋㅋㅋㅋㅋㅋ테크 액체세제로 우리가족 이불빨래는 완벽하게 했네요.","'테크', '액체', '진드기', '제거', '더욱', '더', '테크', '액체', '세제', '이불', '빨래', '집착', '저', '오늘', '이불', '빨래', '가을', '볕', '정말', '파', '아란', '하늘', '햇빛', '날', '꼭', '이불', '빨래', '함', '쟌', '모습', '등장', '테크', '업업', '얼룩', '강려', '제거', '진드기', '사체', '배설물', '제거', '의', '용량', '매우', '집', '드럼세탁기', '이용', '때문', '드럼', '용', '사용', '테크', '액체', '세제', '생활', '오염', '특', '효소', '함유', '얼룩', '단백질', '간장', '주스', '흙', '먼지', '땀', '피지', '제거', '계피', '추출', '물', '유칼립투스', '오일', '함유', '진득', '사체', '배설물', '제거', '형광', '백제', '무', '첨가', '기본', '식물계', '정성', '함유', '통', '온통', '주황', '주황', '얼마나', '용량', '체크', '요리조리', '쪽', '확인', '세밀', '신경', '테크', '액체', '세제', '장사', '용량', '뚜껑', '계량', '빨래', '태', '액체', '제로', '진드기', '안녕', '눈', '더욱', '관리', '아기', '집', '무지', '신경', '일단', '아빠', '옷', '부터', '테크', '액체', '세로', '신명', '아빠', '옷', '각종', '먼지', '투', '입구', '끝', '쉽죠잉', '아빠', '빨래', '아빠', '수건', '바싹', '테크', '액체', '제로', '햇볓', '바싹', '빨래', '기', '그', '다음', '엄빠', '이불', '빨래', '울', '애기', '이불', '빨래', '애기', '이불', '진득', '상상', '자주', '자주', '햇빛', '결론', '엄마', '함', '테크', '액체', '제로', '우리', '가족', '이불', '빨래'",네이버 블로그,https://blog.naver.com/yn1636/221087492150
47,테크세제,"테크 파워액체세제 대용량 본품, 8L, 1개오늘 구매 시 화요일 8/13까지 도착 보장!이 포스팅은 2019년 8월 8일 6시 41분을 기준으로 작성되었습니다.'테크 파워액체세제 대용량 본품, 8L, 1개'▼ 제품후기 및 상세정보 열어보기 ▼12275개 상품평★★★★☆11,500 (0% 할인 적용)11,500원하단 링크를 통해 쿠팡 공식 사이트로 이동하실 수 있습니다테크 파워액체세제 대용량 본품, 8L, 1개COUPANGcoupa.ng품명 및 모델명테크 파워 일드겸용 액체세제 8L인증사항자가검사번호 : F-A02B-A001005-A150제조국(원산지)대한민국제조자(수입자)㈜LG생활건강소비자상담 관련 전화번호-개당 용량 × 수량: 8L × 1개상품평최고 72%좋음 19%보통 6%별로 1%나쁨 2%향 만족도아주 만족해요 61%적당히 만족해요 37%만족스럽지 않아요 2%지속도예상보다 오래 남아요 28%적당히 지속 돼요 62%향이 금방 달아나요 10%세척력예상보다 좋아요 45%설명과 비슷해요 52%예상보다 떨어져요 3%'테크 파워액체세제 대용량 본품, 8L, 1개'이웃신청 환영합니다. 서로이웃도 받고 있으니 부담없이 신청주시기 바랍니다제휴마케팅 정보는 상시변동될 수 있으니 공식 사이트에서 정보를 꼭 확인하세요","'테크', '파워', '액체', '세제', '용량', '품', '개', '오늘', '구매', '시', '화요일', '도착', '보장', '이', '포스팅', '기준', '작성', '테크', '파워', '액체', '세제', '용량', '품', '개', '제품', '후기', '및', '상세', '정보', '보기', '개', '상품', '평', '할인', '적용', '링크', '통해', '쿠팡', '공식', '사이트', '이동', '수', '테크', '파워', '액체', '세제', '용량', '품', '개', '품명', '및', '모델', '테크', '파워', '일드', '겸용', '액체', '세제', '인증', '사항', '검사', '번호', '조국', '원산지', '대한민국', '제조', '수입', '생활', '건강', '소비자', '상담', '관련', '전화번호', '용량', '수량', '개', '품평', '최고', '보통', '별로', '향', '만족도', '아주', '만족', '도예', '남아', '지속', '향', '금방', '세척', '예상', '설명', '예상', '테크', '파워', '액체', '세제', '용량', '품', '개', '이웃', '신청', '환영', '서로', '이웃', '부담', '신청', '시기', '제휴', '마케팅', '정보', '상', '변동', '수', '공식', '사이트', '정보', '꼭', '확인'",네이버 블로그,https://blog.naver.com/ehdgur2206/221609368193
48,테크세제,"[테크 파워 드럼용 액상세제 본품, 5L, 1개 구매리뷰]이 평을 보고도 구매할 마음이 안드는가..? 껄껄껄 그렇다면, 어쩔 수 없지... 하하(구매에 도움되시라고 평이 좋은 것들만 골랐으니 참고바랍니다)10,500원 (1회당 42원)테크 파워 드럼용 액상세제 본품▶ 자세한 가격 및 정보 확인하기 ◀coupa.ng'테크 파워 드럼용 액상세제 본품 구매리뷰'총 688개 상품평의 평균 별점 ★★★★☆2018.06.06 ★★★★★바쁘게 살다보니 쿠팡 로켓배송을 자주 이용하게 되네요.테크를 사용하면서 베이킹 소다가 함유 되어 있다는 점이 재구매를 하게 되는 이유인 것 같아요.지인에게 추천하는데, 드럼용인지 일반용인지 꼭 확인하고 주문하시길  권해요.저도 이번엔  드럼용으로 제대로 구매 했어요.2019.03.15 ★★★★★입구에 흐르지 않게 돌출되어잇는 부분이 너무 좋아요 센스 엄지척 입니다 용량이 많아서  기존에는 쓸만큼 담기가 힘들엇는데 기울이면 줄줄새고,,, 확실히 새지도 않고 쓸만틈 옮겨담을수 있어 좋아요2018.11.11 ★★★★☆세척력이야 말할 필요 없는거 같고...  액체세제니 잔여물 걱정도 덜되구요... 단지 무거운 통에  있는 세제를 매번 덜어쓰기 힘이 드니 세제 배출구에 배출양을 조절하여  덜어쓸수 있는 장치?가 더 필요할듯요.  그것만 해결 되면..  드럼세탁기에 얹어 놓고 사용하기 편하겠는데...2018.05.01 ★★★★★산지가 언젠데 아직도 쓰고있습니다.뭐 눈으로 보는거로는 충분히 깨끗하게빨리고 드럼세탁기위에 올려놓고 쓰기 편합니다 입구 부분이 흐름방지? 같은느낌으로 되어있어서 어디로 세거나 튀지않아서 좋습니다.2018.06.28 ★★★★★이것보다 비싼 타제품들도 많이 사용하다가 이걸로 정착했어요두번째 구매인데 아마 앞으로도 쭉 사용할것같아요애들이 둘이고 여름이라 거의 매일 빨래 돌리는데 양도 많고 세척력도 우수해요굳이 유연제 안써도 빨래가 거칠지도 않아요'테크 파워 드럼용 액상세제 본품 구매리뷰'※ 해당 포스팅은 2019년 07월 28일 08시 13분 에 작성 하였음을 알려드립니다.지금 바로 10,500원 가격에 구매 가능한 링크테크 파워 드럼용 액상세제 본품▶ 자세한 가격 및 정보 확인하기 ◀coupa.ng구매리뷰 사진Next image※ 해당 사진은 Cou-pang 구매리뷰사진입니다 ※'테크 액상세제 드럼용 본품 파워'#세탁세제 #드럼전용세제 #생활용품펭귄 스토어는 판매자가 아닙니다.늘 좋은 제품을 소개시켜드리도록 노력하겠습니다.","'테크', '파워', '드럼', '용', '액', '세제', '품', '개', '구매', '리뷰', '이', '평', '보고', '구매', '마음', '껄껄', '껄', '수', '하하', '구매', '도움', '평이', '것', '참고', '테크', '파워', '드럼', '용', '액', '세제', '품', '가격', '및', '정보', '확인', '테크', '파워', '드럼', '용', '액', '세제', '품', '구매', '리뷰', '총', '개', '상품', '평의', '평균', '점', '쿠팡', '로켓', '배송', '자주', '이용', '테크', '사용', '베이', '킹', '다가', '함유', '점', '재', '구매', '이유', '것', '지인', '추천', '드럼', '용인', '용인', '꼭', '확인', '주문', '권해', '저', '이번', '드럼', '용', '제대로', '구매', '입구', '돌출', '부분', '센스', '엄지', '척', '용량', '기존', '줄줄', '지도', '틈', '세척', '말', '필요', '액체', '제니', '잔', '여물', '걱정', '덜', '단지', '통', '세제', '매번', '쓰기', '힘', '드니', '세제', '배', '출구', '배출', '조절', '장치', '더', '듯', '그것', '해결', '드럼세탁기', '사용', '산지', '젠데', '뭐', '눈', '거', '고', '드럼세탁기', '위', '쓰기', '입구', '부분', '흐름', '방지', '느낌', '어디', '것', '제품', '사용', '걸', '정착', '두번째', '구매', '아마', '앞', '쭉', '사용', '애', '둘', '여름', '거의', '매일', '빨래', '양도', '세척', '굳이', '유연제', '빨래', '테크', '파워', '드럼', '용', '액', '세제', '품', '구매', '리뷰', '해당', '포스팅', '작성', '음', '지금', '바로', '가격', '구매', '링크', '테크', '파워', '드럼', '용', '액', '세제', '품', '가격', '및', '정보', '확인', '구매', '리뷰', '사진', '해당', '사진', '리뷰', '사진', '테크', '액', '세제', '드럼', '용', '품', '파워', '스토어', '판매', '자가', '늘', '제품', '소개', '노력'",네이버 블로그,https://blog.naver.com/ckdbajtwoddl/221597772954
