,Keyword,Contents,Words,Source,URL
150,테크세제,"비가...내리네요...시원한 바람이 불어요...천둥번개와함께...얼마전...아니..조금오래전에  홈쇼핑에서..세제를 구입했어요...테크에서나온  한장빨래....전 액체세제, 가루세제, 다 써봤는데 저마다의 장.단점이 있더라구요...액체세제는...찬물에 잘 풀리지만...오래쓰면 세탁기에 찌꺼기 같은것이 생기네요..가루세제는...찬물에 잘 풀린다고해도..뭉쳐있는경우가종종...그래서 항상  뜨거운물에  풀어서 넣어줘야한다는...번거로움..그래서...시트지로 되어있는  한장빨래를 구매!!거의 한통을 다 써본결과...만족스럽네요...전...항상  한장을 넣고 사용하네요...고수위에서는...한장반..사용하라고 하는데...전 그냥  한장만 사용...빨랫감 위로  툭..던지고..문 닫고..돌리면 끝!!한통에....15장묶음으로된 봉지가 세개들어있어요..한통에..45장의 시트지가 들어있죠~~^^한쪽면은...울퉁불퉁다른면은..매끈하네요...왜그런지는...잘 모르겠다는...두께는  요정도~~^^잘찢어져요...손으로 쉽게 쭈우욱~~~들기 편하고...세제찌꺼기 안 생겨서 좋네요...^^시트지를조금 뜯어...물에 녹여봤어요...찌꺼기없이 잘 녹네요~~전...한장빨래 맘에드네요..8통에  6만원 안되게 구입했으니..가격도..그리 나쁘지 않네요...^^*이제품은 수엠이 직접 구입하여  솔직하게 쓴 글입니다...^^","'비', '바람', '불어', '천둥', '번개', '얼마', '전', '조금', '홈쇼핑', '세제', '구입', '테크', '온', '한장', '빨래', '전', '액체', '세제', '가루', '세제', '저', '장', '단점', '액체', '세제', '찬물', '세탁기', '찌꺼기', '가루', '세제', '찬물', '해도', '경우', '종종', '항상', '물', '움', '시트', '지로', '한장', '빨래', '구매', '거의', '통', '결과', '전', '항상', '한장', '사용', '수위', '한장', '반', '사용', '전', '그냥', '한장', '사용', '빨랫감', '위로', '툭', '문', '끝', '통', '장', '묶음', '봉지', '개', '통', '장의', '시트', '한쪽', '은', '왜', '두께', '요정', '손', '쭈우욱', '찌꺼기', '안', '시트', '조금', '물', '찌꺼기', '전', '한장', '빨래', '맘', '에드', '통', '구입', '가격', '제품', '수엠', '직접', '구입', '글'",네이버 블로그,https://blog.naver.com/vanityvn/220449638273
151,테크세제,"     톡! 톡! 뽑아쓰는 세탁세제 테크 간편시트~ 생활이 한층 더 가벼워 집니다~~        바로보기가 지원되지 않는 파일입니다.클릭하여 팝업창으로 플레이 해보세요.          테크 간편시트(후레쉬 브리즈) [ 시트형 세탁세제, 간편시트, 테크시트] 가 별이맘 손안에~~1팩에 20매, 드럼/일반 겸용 이라 일반세제처럼 구분해서 안사도 되겠어요~      뒷면을 보기로 해요~간편시트 사용방법과 사용량에 대해 나와 있네요~자세히 함 볼까여??      테크 간편시트로 누리는 센스있는 세탁..저희집에 액상세제를 사용하는데 가루가 아니여도세제 투입구에 넣을때 간혹 흘리곤 하거든여~그런데 왜 테크 간편시트인지 알것 같네여~~시트에 담은 세탁세제~테크 간편시트~~한장한장 뽑아 쓸수록깨끗한 옷 만큼이나 우리 가족 얼굴에도 여유로운 웃음이 크게 번질거리라 생각되여~~^^      테크 시트 한장(10g)이 일반 부말세제 2스푼(45g)과 액체세제 1컵(60g)의양과 같은 세척효과가 있네요~      시트가 녹는 제품이 아니여서 세탁조안에 의류와 함께 넣고요~드럼 세탁기의 경우 드럼창 쪽으로 나오거나 배수구가 막힐 염려가 있어세탁조 안쪽 깊숙이 넣어 줘야 한답니다~      저는 보통 드럼창기준에서 반정도 찰때 세탁을 돌리는데요~기본 간편시트 1장으로 사용 할듯 해요~~테크 간편시트 사용량에 대해 자세히 나와 있어요~      테크 간편시트 박스 옆 곳곳에주의사항과 품질경영 및 공산품 안전관리법에 의한 표시 등이 적혀있는데요젤 중요한 제조년월일을 볼까요?09년 11월 24일 이네요~간혹 체험단 제품 오는거 보면 제조년월이 한참 된것이 와서 좀 씁쓸했는데최근껄로 보내주셨네요~~^^      박스 옆면에 적혀있는 문구~센스있는 테크 간편시트~~강추~~      믿을수 있는 LG생활건강 에서 출시한 테크간편테크..강력 세척력 + 정전기 완화 + 말끔함 + 피부보호믿을수 있는 제품 만들었을꺼라 믿어요~      친환경까지 생각한 테크 간편시트..재활용종이를 사용한 친환경 포장재를 사용했군요~~    이제 테크 간편시트 개봉, 사용 해볼까요?        박스를 개봉해볼까여?      가볍게 위로 올리면 잘 뜯어집니다~      가운데 절개부분은 사용하지 않을때 끼워 사용하라고 절개 되어있네요~~      박스를 개봉하니 물티슈처럼 포장이 되어 있네요~포장지가 너무 이뻐요~~      스티커를 부착하면 더욱 깔금하게 보관할수 있고시트가 건조되어도 물에 풀어진 후의 세탁 효과는 동일하다고 써있네용~      오른쪽에 OPEN을 살짝 열어볼까여??      오픈해보니 시원한 향과 함께 하늘색의 시트가 보이네여~~      간편시트를 뽑아볼까요?세제가 시트에 묻어서 그런지 뽑을때 시트에 묻은 세제가 손톱에 꼈어용~^^::      시트를 뽑아 펼쳐보니 물티슈 크기구요~세제가 묻어있어 두꺼워요~가운데 절취선이 있어서 1/2장 사용하기에 불편함이 없어요~        저는 드럼세탁기 안에 드럼창기준 2/3 빨래량이 채워져가편시트 1장을  세탁조 안쪽 깊숙이 넣었답니다.위에 사용방법에 나와 있지만드럼세탁기의 경우, 시트가 드럼창 쪽으로 빠져나오거나,배수구가 막힐 수 있으므로 세탁조 안쪽 깊숙이 넣어야 한다네요~      원래 세탁할때 세탁, 헹굼 3번, 탈수를 한번에 설정하는데요일반 섬유유연제는 세제 투입구에 세제와 같이 한번에 넣으면 되는데샤프란 아로마시트를 사용하려면드럼세탁기의 경우 세탁이 종료된 후 추가 헹굼 시에만 사용해야 한다고 되어있더라구요그래서 할수 없이 헹굼을 2번으로 설정했습니다  마지막 추가 헹굼때 샤프란 아로마시트를 넣고 탈수를 하려구요~이중으로 해야하는 번거로움이 있네요~(제 개인적으로 샤프란 아로마시트 단점중의 하나네용~~)      드럼창을 닫고 이제 돌아갑니다~      시트 한 장으로 거품이 날까? 괜한 의심에 ㅎㅎ 세탁조 안을 봤더니사진상으로 잘 안보이지만 밑부분에 거품이 보이시나요?잘 돌아가고 있습니다~~    테크 간편시트 한장씩 뽑아쓰고사용하지 않을때 요렇게 절개부분에 살짝 끼워주세요~~  자 이제~테크 간편시트로 세탁을 마쳤으면마지막 추가 헹굼시에 샤프란 아로마시트를 넣어보아여~~샤프란 아로마시트는 다음 후기에 기대하세용~~^^바로 이어집니다~~ ","'톡', '톡', '세탁', '세제', '테크', '간편', '시트', '생활', '한층', '더', '바로', '보기', '지원', '파일', '클릭', '팝업창', '플레이', '테크', '간편', '시트', '후', '레쉬', '브리', '시트', '세탁', '세제', '간편', '시트', '테크', '시트', '이맘', '손안', '팩', '매', '드럼', '일반', '겸용', '세제', '구분', '면', '보기', '해', '간편', '시트', '사용', '방법', '용량', '대해', '함', '여', '테크', '간편', '시트', '센스', '세탁', '집', '액', '세제', '사용', '가루', '세제', '투', '입구', '때', '간혹', '왜', '테크', '간편', '시트', '시트', '세탁', '세제', '테크', '간편', '시트', '한장', '한장', '옷', '우리', '가족', '얼굴', '여유', '웃음', '크게', '번', '생각', '테크', '시트', '한장', '이', '일반', '세제', '스푼', '과', '액체', '세제', '컵', '의', '세척', '효과', '시트', '제품', '세탁', '조안', '의류', '드럼', '세탁기', '경우', '드럼', '창', '쪽', '배수', '구가', '염려', '세탁', '안쪽', '저', '보통', '드럼', '창', '기준', '반정', '찰때', '세탁', '기본', '간편', '시트', '장', '사용', '해', '테크', '간편', '시트', '용량', '대해', '테크', '간편', '시트', '박스', '옆', '곳곳', '주의', '사항', '품질', '경영', '및', '공산품', '안전', '관리', '법', '표시', '등', '젤', '년월', '일', '요', '간혹', '체험', '단', '제품', '년월', '한참', '좀', '최근', '껄', '박스', '옆면', '문구', '센스', '테크', '간편', '시트', '강추', '생활', '건강', '출시', '테크', '간편', '테크', '강력', '세척', '정전기', '완화', '함', '피부', '보호', '제품', '친환경', '생각', '테크', '간편', '시트', '재활용', '종이', '사용', '친환경', '포장재', '사용', '이제', '테크', '간편', '시트', '개봉', '사용', '요', '박스', '개봉', '여', '위로', '가운데', '절개', '부분', '사용', '때', '사용', '절개', '박스', '개봉', '물티슈', '포장', '포장', '스티커', '부착', '더욱', '금', '보관', '시트', '건조', '물', '후의', '세탁', '효과', '오른쪽', '살짝', '여', '오픈', '향', '하늘색', '시트', '보이', '간편', '시트', '요', '세제', '시트', '때', '시트', '세제', '손톱', '시트', '물티슈', '크기', '구', '세제', '가운데', '절취', '선', '장', '사용', '저', '드럼세탁기', '안', '드럼', '창', '기준', '빨래량', '가편', '시트', '장', '세탁', '안쪽', '위', '사용', '방법', '드럼세탁기', '경우', '시트', '드럼', '창', '쪽', '배수', '구가', '수', '세탁', '안쪽', '원래', '세탁', '때', '세탁', '헹굼', '번', '탈수', '한번', '설정', '일반', '섬유', '유연제', '세제', '투', '입구', '세제', '한번', '샤프란', '아로마', '시트', '사용', '드럼세탁기', '경우', '세탁', '종료', '후', '추가', '헹굼', '시', '사용', '헹굼', '번', '설정', '마지막', '추가', '헹굼때', '샤프란', '아로마', '시트', '탈수', '이중', '움', '제', '개인', '샤프란', '아로마', '시트', '단점', '하나', '용', '드럼', '창', '이제', '시트', '장', '거품', '괜', '의심', '세탁', '안', '사진', '안보', '밑', '부분', '거품', '테크', '간편', '시트', '한장', '때', '절개', '부분', '살짝', '자', '이제', '테크', '간편', '시트', '세탁', '마지막', '추가', '헹굼시', '샤프란', '아로마', '시트', '보아', '샤프란', '아로마', '시트', '다음', '후기', '바로'",네이버 블로그,https://blog.naver.com/monica7109/50083436613
152,테크세제,하는데 있어서 세탁세제와 섬유유연제는 없어서는 안되는 필수품이 된것 같아요요즘같이 세탁세제에도 다양한 종류가 나오다보니어떤분은 분말세제를 사용하고 또 어떤분은 액체세제를 사용하고 기호에 따라 선택의 폭도 다양해서소비자입장에서는 다양하게 고를수있어서 참 좋은듯 싶어요.    LG생활건강에서 특허를 낸 한장한장 뽑아쓰는 세탁세제와 섬유유연제가 있다고 해서정말 궁금하던차에 사용을 해보니 정말 편하더라구요.    광고를 통해서 톡톡 뽑아쓰는 세탁세제를 보고  정말 편한만큼 세탁효과가 있을까 의문이 생기기는 했지만막상 사용해보니 간편하면서도 세탁효과까지 있으니 정말 강추하고 싶은 세탁세제인것 같아요^^    용기도 작고 가벼워서 사용감이 넘 편한 테크간편시트톡톡 뽑아쓰는 세탁세제라서 기존에 무거운 세탁세제를 투입구에 넣었던 지난날들이 후회스럽기까지 하네요     시트 한장에  담은 세탁세제로 세탁은 더욱 깨끗하게 생활은 더욱 여유로와질것같은 느낌이 드네요.  ☞주의☜시트는 녹는제품이 아니기때문에세제투입구에 넣지말고 잘펴서 세탁조안에 깊숙이 넣어주어야 더욱 좋아요    테크간편시트를 사용해서 세탁을 한 의류입니다.눈으로 확연히 볼수있는 깨끗함.. 시트한장이 이렇게도 깨끗하게 세탁이 된다고 하니정말 앞으로는 테크간편시트를 늘 함께 해야할것같아요    시트한장이라고해도 분말2스푼과 액체1컵과 같은 세척효과를 본다고 하니 정말 놀라운것같네요.    시트한장의 효과는 정말 놀랍기만 한데강력한 세척과 정전기까지완화시키는 테크간편시트.. 정말 매력적으로 다가오네요^^    또 하나의 간편시트 샤프란아로마시트..한장 한장 뽑아쓰는 섬유유연제라서 그런지 기존에 무거운 액상유연제를 사용했던나에게는정말 매력적으로 다가오는 섬유유연제네요    꼭 물티슈를 사용하는 것처럼 편하게 사용할수있는 샤프란아로마시트      일반세탁기에는 마지막헹굼시에 세탁기뚜껑을 열고 시트를 평평하게 펴서 넣어주고드럼세탁기는 빨래가 끝난뒤 드럼창을 열어 시트를 세탁조 깊숙이 넣은후에 추가헹굼해주면 됩니다.  ☞주의☜샤프란아로마시트도 녹는제품이 아니기때문에섬유유연제투입구에 넣은 안되고 세탁조안쪽깊숙이 넣어주어야해요    처음으로 만나는 아로마시트 똑똑한 Tip으로잘 활용해보면 좋을듯 싶네요^^    향긋한 향기가 나는 아로마시트는 방향제로 사용해보아도 좋을듯 해요..아이들방에 놓아주었더니 넘 좋아하더라구요.  샤프란아로마시트는 종류에 따라 세가지향이 있어요. 기호에 따라 향을 고르면 되겠죠    싱그러운 꽃향기와 부드럽고 달콤한 향이 나는핑크센세이션    깨끗함과 달콤함이 부드럽게 어우러진 향코튼블로썸    화사함과 은은함이 조화된향후레쉬드림  향이 오래가는 샤프란아로마시트로 고급스럽고 풍부한 향기를 느껴보아요  톡톡 뽑아쓰는 세탁세제 테크간편시트와 샤프란아로마시트가 있어서  이젠 빨래가  넘 즐거워질것만 같네요.. ,"'세탁', '세제', '섬유', '유연제', '필수품', '요즘', '세탁', '세제', '종류', '분', '분말', '세제', '사용', '또', '분', '액체', '세제', '사용', '기호', '선택', '폭도', '소비자', '입장', '듯', '생활', '건강', '특허', '한장', '한장', '세탁', '세제', '섬유', '유연제', '정말', '차', '사용', '정말', '광고', '통해', '톡톡', '세탁', '세제', '보고', '정말', '세탁', '효과', '의문', '생기', '막상', '사용', '세탁', '효과', '정말', '강', '세탁', '세제', '것', '용기', '작고', '용감', '테크', '간편', '시트', '톡톡', '세탁', '세제', '기존', '세탁', '세제', '투', '입구', '지난날', '후회', '시트', '한장', '세탁', '세제', '세탁', '더욱', '생활', '더욱', '유로', '느낌', '드네', '주의', '시트', '제품', '때문', '투', '입구', '세탁', '조안', '더욱', '테크', '간편', '시트', '사용', '세탁', '의류', '눈', '확', '시트', '한장', '세탁', '하니', '정말', '앞', '테크', '간편', '시트', '늘', '시트', '한장', '해도', '분말', '스푼', '액체', '컵', '세척', '효과', '하니', '정말', '시트', '한장', '효과', '정말', '데', '세척', '정전기', '완화', '테크', '간편', '시트', '정말', '매력', '또', '하나', '간편', '시트', '샤프란', '아로마', '시트', '한장', '한장', '섬유', '유연제', '기존', '액', '유연제', '사용', '정말', '매력', '섬유', '유연제', '꼭', '물티슈', '사용', '것', '사용', '샤프란', '아로마', '시트', '세탁기', '마지막', '헹굼', '시', '세탁기', '뚜껑', '시트', '드럼세탁기', '빨래', '뒤', '드럼', '창', '시트', '세탁', '후', '추가', '헹굼', '주의', '샤프란', '아로마', '시트', '제품', '때문', '섬유', '유연제', '투', '입구', '세탁', '안쪽', '해', '처음', '아로마', '시트', '활용', '향', '향기', '나', '아로마', '시트', '방향', '제로', '사용', '해', '아이', '방', '샤프란', '아로마', '시트', '종류', '가지', '향', '기호', '향', '꽃', '향기', '향', '나', '핑크', '센세이션', '향', '코튼', '블로썸', '조화', '향후', '레쉬', '드림', '향', '샤프란', '아로마', '시트', '향기', '보아', '톡톡', '세탁', '세제', '테크', '간편', '시트', '샤프란', '아로마', '시트', '젠', '빨래', '것'",네이버 블로그,https://blog.naver.com/ppumpkin72/90082667105
153,테크세제,"상품명 : 테크 파워액체세제 대용량 본품, 8L, 1개가격은 11,500원 입니다제품후기 보러가기지금은 쇼핑중 블로그에 오신것을 환영합니다 다양한 제품 정보를 소개하고 있습니다↓쿠팡 공식 홈페이지 링크↓테크 파워액체세제 대용량 본품COUPANGcoupa.ng해당 블로그에서 소개하는 특정 제품들의 경우 상세정보 및 가격은 변동이 될 수 있습니다2019년 08월 07일 06시 13분에 발행하였습니다","'상품', '테크', '파워', '액체', '세제', '용량', '품', '개', '가격', '제품', '후기', '지금', '쇼핑', '블로그', '환영', '제품', '정보', '소개', '쿠팡', '공식', '홈페이지', '링크', '테크', '파워', '액체', '세제', '용량', '품', '해당', '블로그', '소개', '특정', '제품', '경우', '상세', '정보', '및', '가격', '변동', '수', '발행'",네이버 블로그,https://blog.naver.com/kkw7107/221608194110
154,테크세제,"테크 시트세제 후레쉬 브리즈 36매x2, 36매, 2개오늘 구매하면 화요일 7/23까지 보장됩니다.위 날짜는 2019년 7월 19일 17시 43분을 기준으로 작성되었습니다.'테크 시트세제 후레쉬 브리즈 36매x2, 36매, 2개'▼ 후기 및 제품정보 열기 ▼10,500 (0% 할인률)10,500원★★★★☆ 17개 상품평테크 시트세제 후레쉬 브리즈 36매x2, 36매, 2개COUPANGcoupa.ng품명 및 모델명테크 시트세제 후레쉬 브리즈 36매x2인증사항상세페이지참조제조국(원산지)대한민국제조자(수입자)엘지생활건강소비자상담 관련 전화번호-개당 수량 × 수량: 2개 × 36매상품평최고 72%좋음 11%보통 17%별로 0%나쁨 0%'테크 시트세제 후레쉬 브리즈 36매x2, 36매, 2개'매일 주기적으로 안내해드리는 핫딜 정보를 구독하세요발행중인 포스팅 정보는 시간이 지남에 따라 변동될 수 있습니다","'테크', '시트', '세제', '후', '레쉬', '브리', '매', '매', '개', '오늘', '구매', '화요일', '보장', '위', '날짜', '기준', '작성', '테크', '시트', '세제', '후', '레쉬', '브리', '매', '매', '개', '후기', '및', '제품', '정보', '열기', '할인', '률', '개', '상품', '평', '테크', '시트', '세제', '후', '레쉬', '브리', '매', '매', '개', '품명', '및', '모델', '테크', '시트', '세제', '후', '레쉬', '브리', '매', '인증', '사항', '상세', '페이지', '참조', '조국', '원산지', '대한민국', '제조', '수입', '엘지', '생활', '건강', '소비자', '상담', '관련', '전화번호', '수량', '수량', '개', '매상', '품평', '최고', '보통', '별로', '테크', '시트', '세제', '후', '레쉬', '브리', '매', '매', '개', '매일', '기적', '안내', '핫딜', '정보', '구독', '발행', '포스팅', '정보', '시간', '지남', '변동', '수'",네이버 블로그,https://blog.naver.com/hbh3213/221590020547
