,Keyword,Date,Title,Contents,Words,Comments,Source,URL
223,샤프란,2015.06.05. 14:06,섬유유연제 꽃담초? 그거 어때요?,"★수다방 이용수칙~! 꼭 확인해주세요^^★ 1) 카페이용 전 반드시 카페규정?http://cafe.naver.com/imsanbu/28123090 읽어주세요.(게시물의 이동,삭제,강퇴에 대한 내용 꼭 확인하셔서, 규정위반으로 인한 카페활동제약 등 불편함이 없으시길 바랍니다.)2) 광고·홍보글/이벤트 스크랩/보험가입사은품 낚시글 등은 게시불가합니다.? 3) 판매,대여,양도,부동산거래 등 금전이 오가는 거래/공구모집/구함글(판매,대여,구인구직,영업사원·홈스쿨선생·베이비시터·가사 도우미 등) 등은 게시불가합니다. 4) 후기글은 해당 후기게시판으로, 의료분쟁 관련 등?지역사회 분쟁글은 이슈게시판으로 각 이동되고, 과도한 논쟁글(욕설과 비하 등)은 삭제됩니다. 5) 수다방 성격에 맞지않는 이탈글은 이동 또는 삭제됩니다. (예: 임신을기다리는맘들수다방->임테기 두줄사진 등 임신확인문의글, 싱글방->이혼문의글, 외동아방->둘째찬반논쟁글, 예비신부의 임신얘기->낙태고민글, 박람회관련 질문과 후기글등은 박람회게시판으로?이동)6) 임산부 회원이 많은 카페입니다. 보는?이에 따라?불쾌감을 줄 수도 있는 사진은 특별히 자제바라며, 부득이?올려야 하는 경우에는?제목에 경고문구 및 매너사진으로 올려주세요. 많은 협조 바랍니다. ^^??샤프란 코튼앤크림 쓰다가 섬유유연제 좀 바꿔보려고 했더니요즘 꽃담초? 그거 많이 쓰신다고 하더라구요. 인터넷에서..?꽃담초 써보신 분들 어떤가요? 괜찮나용?^^괜찮으셨다면 향 추천 좀 해주세요^^????","'다방', '이용수', '칙', '꼭', '확인', '카페', '이용', '전', '반드시', '카페', '규정', '게시', '물의', '이동', '삭제', '강퇴', '대한', '내용', '꼭', '확인', '규정', '위반', '카페', '활동', '제약', '등', '광고', '홍보', '글', '이벤트', '스크랩', '보험', '가입', '사은', '품', '낚시글', '등', '게시', '판매', '대여', '양도', '부동산', '거래', '등', '금전', '거래', '공구', '모집', '구함', '글', '판매', '대여', '구인', '구직', '영업', '사원', '홈', '스쿨', '선생', '베이비', '터', '가사', '도우미', '등', '등', '게시', '후기', '글', '해당', '후기', '게시판', '의료', '분쟁', '관련', '등', '지역', '사회', '분쟁', '글', '이슈', '게시판', '각', '이동', '과도', '논쟁', '글', '욕설', '등', '은', '삭제', '다방', '성격', '이탈', '글', '이동', '삭제', '예', '임신', '맘', '다방', '줄', '사진', '등', '임신', '확인', '문의', '글', '싱글', '방', '이혼', '문의', '글', '외동', '방', '찬', '논쟁', '글', '예비신부', '임신', '얘기', '낙태', '고민', '글', '박람회', '관련', '질문', '후기', '글등', '박람회', '게시판', '이동', '임산부', '회원', '카페', '이', '불쾌감', '줄', '수도', '사진', '자제', '부득이', '경우', '제목', '경고', '문구', '및', '사진', '협조', '샤프란', '코튼', '앤', '크림', '섬유', '유연제', '좀', '요즘', '꽃담초', '그거', '인터넷', '꽃담초', '보신', '가요', '향', '추천', '좀'","'전완전좋았어요.보라색이요.그거만써요ㅋ', '전 꽃담초만 쓰고있어요^^라벤더향 강추~', '은은하니 괜찮아요 ㅎ 연꽃향 많이들 쓰더라구용 ㅎ', '저는  연꽃향좋더라구요  써보면 좋긴하나  가격이  좀  비싸긴해요   ^^', '전 보라색만 써요 강추^^', '꽃 담초 좋아요 ㅋㅋ파란색이요 !!바꾸고 쭉 그거만 쓰고 있어요', '하늘색 좋네요', '향도 오래가고~ 웬지 좀  향나면서 뽀드득한 기분? ㅎㅎ 전 좋아요~^^', '유연제 써보 꿉꿉한 냄새처럼 날때 있는데 이건 안그런거 같아요.저는 괜찮더라구요. ㅋ', '저 꽃담초 전에 썼는데 약간 달달한 향 나더라고요~괜찮기는 했는데 전 피죤이나 샤프란 향이 더 잘맞는것 같아요!', '저는 작년 여름에 썼었는데 토할뻔했어요향이 너무 강하던데;; 저는 다우니가 좋은거같아요', '저도 요고만써요', '전 좋아요.ㅋㅋ 냄샏 좋고.ㅋㅋ', '말그대로 초..초냄새나던데요? 향기롭긴한데 새콤한냄새가났어요.ㅋㅋㅋ친정엄마 쓰는거 보니까.ㅋㅋ다우니는 향이 넘 무겁고.ㅠㅠ전 그냥 쓰는것중엔 샤프란이 제일 무난한것같아요.ㅋㅋ;;매번섬유유연제살때마다 고민해요,ㅋㅋ 근데 샤프란은 펑펑쓰게되는것같아요제기준에 향이 연한것같아서..', '전 좋아요 연꽃^^', '저도 써봤는데.. 샤프란에 비해 용량이 너무 작아요ㅠㅠ 비싸고..', '연꽃향 좋구요.카페서 본 팁인데 탈수직전 유연제 넣고 20분?정도 둔뒤    돌리면 향이 오래간다 하더라구요.그리고 이번에 꽃담초 신제품 나왔어요. 려미향인가 뭐신가.봄,여름,가을 테마던데ㅎ봄향 강추요. 고농축이라 조금만 쓰셔야 돼욤.'",네이버 카페,https://cafe.naver.com/ArticleRead.nhn?clubid=10094499&page=12&inCafeSearch=true&searchBy=0&query=%BB%FE%C7%C1%B6%F5&includeAll=&exclude=&include=&exact=&searchdate=2015-01-152018-08-18&media=0&sortBy=date&articleid=28368610&referrerAllArticles=true
224,샤프란,2015.05.26. 16:24,브라이택스 유모차 문의드려요.,"? ★질문방 이용수칙~! 꼭 확인해주세요^^★ 1) 카페이용 전 반드시 카페규정?http://cafe.naver.com/imsanbu/28123090 읽어주세요.(게시물의 이동,삭제,강퇴에 대한 내용 꼭 확인하셔서, 규정위반으로 인한 카페활동제약 등 불편함이 없으시길 바랍니다.)?2) 광고·홍보글(이벤트 스크랩 포함)/보험 관련글(가입 후기 및 사은품 등 낚시글, 보험사 기재,?설계사 소개, 가입시기, 보험료문의 등)은 게시불가 합니다. ?3) 판매,대여,양도,부동산거래 등 금전이 오가는 거래/공구모집/구함글(판매,대여,영업사원 등) 등은 게시불가합니다. ?4) 후기글은 해당 후기게시판으로,?게시판의 주제에 맞지 않는 글들은 적정한 수다방으로?무통보 이동 또는 삭제됩니다.?5) 임신 중 주수놀이(특히 노출이 심한)나 주요부위 사진,?그리고?분비물 등 불쾌감을 줄 수도 있는 사진들은?자제해주시고,?부득이한 경우에는 매너사진으로 올려주세요.??많은 협조 바랍니다. ^^???35주차를 달려가고 있는 맘이에요.친구가 브라이택스 비스마트유모차를 물려주었는데디럭스형이고 샤프롱인가? 아기바구니 호환된다고 하더라구요.아기바구니만 띠어서 카시트에 장착하면 된다고 해서 우선 덥썩 받았는데요.이게 예전모델이라서 그런지 샤프롱은 다 단종되었구요요즘은 비애자일 트래블팩으로 나오는것 같더라구요그래서 그런데...어차피 카시트는 사야되거든요.브라이택스는 다 호환이 가능한가요?> 그랬으면 좋겠어요.아니면 샤프롱인지 샤프란인지 중고나라에서 알아봐야할까요??브라이택스 잘 아시는 분 답변해주세요.그리고 신생아용 시트는 아무거나 사면 다 장착 가능한가요??????? ???????","'질문방', '이용수', '칙', '꼭', '확인', '카페', '이용', '전', '반드시', '카페', '규정', '게시', '물의', '이동', '삭제', '강퇴', '대한', '내용', '꼭', '확인', '규정', '위반', '카페', '활동', '제약', '등', '광고', '홍보', '글', '이벤트', '스크랩', '포함', '보험', '관련', '글', '가입', '후기', '및', '사은', '품', '등', '낚시글', '보험사', '기재', '소개', '가입', '시기', '보험료', '문의', '등', '은', '게시', '불가', '판매', '대여', '양도', '부동산', '거래', '등', '금전', '거래', '공구', '모집', '구함', '글', '판매', '대여', '영업', '사원', '등', '등', '게시', '후기', '글', '해당', '후기', '게시판', '게시판', '주제', '글', '다방', '무', '통보', '이동', '삭제', '임신', '중', '놀이', '노출', '나', '부위', '사진', '분비물', '등', '불쾌감', '줄', '수도', '사진', '자제', '부득이', '경우', '사진', '협조', '주차', '맘', '친구', '브라', '택스', '비', '스마트', '유모차', '디럭스', '샤프', '롱', '아기', '바구니', '호환', '아기', '바구니', '띠', '카시트', '장', '우선', '썩', '이', '모델', '샤프', '롱', '단종', '요즘', '비애', '일', '트래블', '팩', '어차피', '카시트', '브라', '택스', '호환', '샤프', '롱', '샤프란', '중고나라', '요', '브라', '택스', '아시', '분', '답변', '신생아', '용', '시트', '거나', '사면', '장착'","'브라이텍스에서 나오는 인펀트카싯은 바로 딸깍하고 맞아요 하지만 다른 카싯은 어답터를 키우셔야할거에요 유모차 진짜 좋아요 ㅎ 바구니크고 높고 핸들링도 좋고 양대면이구, ,'",네이버 카페,https://cafe.naver.com/ArticleRead.nhn?clubid=10094499&page=12&inCafeSearch=true&searchBy=0&query=%BB%FE%C7%C1%B6%F5&includeAll=&exclude=&include=&exact=&searchdate=2015-01-152018-08-18&media=0&sortBy=date&articleid=28279363&referrerAllArticles=true
225,샤프란,2015.05.06. 23:22,애기 섬유유연제 뭐쓰시나요? ,																																																																																												애기 섬유유연제가 다 떨어져서 샤프란썼더니 바로 올라오네요ㅠㅠ 괜찮은거 추천해주세요!!!! ?,"'애기', '섬유', '유연제', '샤프란', '바로', '거', '추천'","'비앤비꺼 쓰는데 향이너무 안좋아서 저도 바꾸려구요뭐가 좋을ㅇ라나 저도 고민중', '첨엔 비앤비 괜찮은줄알았는데 계속쓰니까 별로더라구요 ㅠㅠ', '저는 그냥 식초요 ㅎㅎ', '그냥 식초쓰면 옷이 뻣뻣하지않나요???', '전 애티튜드꺼 무향써요', '답변감사해요^^', '아토세이프유아 제품 썼어요', '참고할게요 감사해요^^', '저두애티튜트~', '애티튜드 많이들 쓰시네요~^^', '섬유유연제 안써요.', '안쓰면 옷감이 뻣뻣하지않나요?', '식초로 바꾼지 얼마안됐는데 뻣뻣하지않구 세제향이 그대로 살아있어서 향도 괜차나요', '전 궁중비책이요~', '저는오클린써요향도좋구옷감두뻣뻣하지않아요', '호호에미요~~', '저는 이번에 토루토루 아기섬유유연제 사용해보았는데 일단 믿고 사용할수있고 세탁력도 좋아서 추천해드려요!!이번에 토루토루 아기섬유유연제를 사용하면서 알게 된 사실인데천연향료가 들어갔다는 대부분의 제품들이 석유계 인공향료라고해요 ㅠㅠ그래서 토루토루는 어떠한 향료도 넣지않고 천연항균제인 매실추출물을 사용했다고해요~'",네이버 카페,https://cafe.naver.com/ArticleRead.nhn?clubid=10094499&page=12&inCafeSearch=true&searchBy=0&query=%BB%FE%C7%C1%B6%F5&includeAll=&exclude=&include=&exact=&searchdate=2015-01-152018-08-18&media=0&sortBy=date&articleid=28119883&referrerAllArticles=true
226,샤프란,2015.04.24. 23:57,"[다우니]향수를 뿌린듯, 다우니 퍼퓸으로 향기롭게~ ","▶맘스홀릭 베이비 이벤트 후기가 아닌 아이 사진이나 돌잔치 후기 다른글등이 올라오면 게시글 삭제/강퇴될수 있으니 올리지 말아주세요!! ▶후기?작성시 가이드라인 참고하여 반드시 원문으로 작성해주세요 http://cafe.naver.com/imsanbu/16256962▶이벤트 후기 게시판에?작성된 후기는?해당 업체로부터 무료로?제품을 제공 받고 작성된 후기입니다. ??다우니 퍼퓸다우니가 신제품이 출시 되었데요, 신제품이 출시되면서 다우니의 향기를 경험할 수 있는 다우니 클래식 체험단에 선정되었답니다:)화이트 상자 너무 아름답지 않아요? 저는 무슨 샤넬이 배달 된 줄 알았어요 언뜻, 까멜리아 같기도 하고하하그만큼 이번 다우니는 향기에 우아함을 담았을 것 같아요싸구려 향이 아닌 고급스러운 향 냄새에 민감한 저와, 많은 운동으로 옷이 항상 땀 냄새로 쩔어 있는 신랑의 옷에 어떤 향기를 입혀 줄지 정말 기대가 되요^^ 신제품 다우니 <클래식 컬렉션>우아하고 예쁜 화이트 상자에는향이 오~래가는""다우니 퍼퓸 클래식"" 과 다우니 퍼퓸 클래식의 향기를 오래 지속 시켜주는 ""아로마 쥬얼 펄 클래식""이 들어 있어요저 혼자 사용하는 체험단이 아닌, 지인들과 함께 써보는 체험단이라 더 좋았어요!한번에 4개의 상자를 보내 주셔서 하나는 엄마, 하나는 막내 이모집으로 선물을 했답니다:)좋은건 함께 나누며, 좋다고 소문내고 써야죵! 상자 안쪽은 선물을 할 수 있게, 메모란도 있어요 요렇게 작성해서 선물 했지요?다우니 퍼퓸 클래식 4개를 쪼르륵 놓고 사진 찍어 놓으니 귀엽네요,이번에 출시된 그레이스프린세스 향기는요 향수처럼 미들노트,탑노트,베이스노트로 구성되어 망고와 복숭아 향기 자스민향, 머스크와 샌들우드의 향이 조화가 잘 어우러져 고.급. 스럽다는 단어가 딱! 맞는 향이 나더라구요다우니 퍼퓸 클래식+아로마쥬얼 펄 클래식 = 그레이스 프린세스기품있고 온화한 향기를 내는 레시피예요이외에도 아로마 쥬얼과 섬유유연제를 어떤 걸 쓰냐에 따라 향기가 달라진다고 하니 향기도 직접 만들어서 사용해보세요:)요, 이쁜것이 아로마 쥬얼! 보석처럼 반짝반짝ㅡ 앙증맞은 게 섬유 유연제의 향기를 오래도록 지속시켜 준다고 하니 기특할 수밖에 없어요 아로마 쥬얼은 다우니 혹은 타 섬유 유연제와 함게 사용해 고유의 향을 만들 수도 있답니다 (향기도 만들어 사용하는 향기 레시피) 아로마 쥬얼은 섬유 유연제와는 달리 세탁조에 빨랫감과 함께 넣어 주면 된답니다!물에 잘 녹을까, 찌꺼기는 남지 않을까 걱정도 많이 했는데 전혀, 네버! 문제없었답니다! 피죤,샤프란,쉐리,메이시스 까지 그동안 모든 섬유 유연제는 모두 섭렵 해왔지만정말 진짜, 진심 다우니는 처음 접해봐요마트가면 다우니는 정말 손이 안가 더라구요~ 그리고 섬 유유연제가 다 거기서 거기라는 생각을 먼저 했으니까요, ?이제 우리집 세탁기 위에 자리 잡은 다우니어서와~~ 우리집은 처음이지? ㅋㅋㅋㅋ ?땀으로 쩔은 신랑 운동복 냄새 제거하는게 신혼초부터 늘 고민이고 숙제 였어요, 그나마, 넬리로 세제를 바꾸면서 어느정도 해결은 됐는데요 섬유유연제는 향을 오래 지속 시켜 주지는 못 하더라구요~그나마 메이시스는 빨래감이 완젼히 말라도 보들보들 해져서 쭉~ 사용하고는 잇었지만 마른빨래를 게면서 향을 맡으면 정말 무향 이였어요다우니 vs 타사 섬유유연제 (비교해볼게요)?다우니는 색상도 진하고 따르면 걸쭉하게 따라지는 게 그래서 다른 섬뮤 유연제에 비해 고농축이라는 말이 눈으로 보여요:) 타사 섬유유연제 피* 따르는순간 콸콸콸콸~ 다우니에 비해 확실히 많이 묽은게 보여요,역시 고농축이라 표준사용량에 맞게 사용하시면 되겠어요빨래양이 많은날도 1/2뚜껑이면 충분! 더 풍부한 향을 원할땐 3/4!평상시엔 1/3만 써도 된다고 해요, 아로마 쥬얼세제 통에 섬유 유연제를 넣고 아로마 쥬얼은 세탁조에 빨래와 함께 넣어주면섬유 유연제의 향이 더 오래 지속 되도록 도와준답니다! 그리고, 저는 향이 너무 좋아서 화장실과 옷장에 방향제 용도로 놔뒀는데...들어갈 때마다... 향이 너무 좋아요 요렇게 빨래와 함꼐 투척해 주면 되요, 간단하죠? 요렇게 빨래와함꼐 넣어 세탁해도, 아로마 쥬얼은? 싹! ?녹아 찌꺼기 없이 깨끗하고 향기로운 빨래가 가능해요:) 잘 빨아져 나온 수건과 아래는 제가 입고 있는 남방이예요보들보들한데 동시에 향기도 너무 좋아요! 정말 은은한 향수를 뿌린 기분, 비누 향보다 고급스러우면서도 향수처럼 과하지 않은 향다우니 클래식 컬렉션으로 빨래하고 4일 동안 입어 본 저는요 앞으로 다우니만 쓸 것! ㅋㅋㅋㅋㅋㅋ 너무 했나요? 제가 입고 있는 셔츠는요, 정말 4일동안 안 빨았구요,ㅠㅠ 4일 연속 입어주었 거든요,ㅋㅋㅋㅋㅋㅋㅋㅋㅋㅋㅋㅋㅋ그동안 향수도 단 한 번도 뿌리지 않았구요ㅡ 근데 정말 향기가 4일 연속 지속!! 향기가 언제까지 가는지 도대체 언제까지 날 건지, 언제까지 기분 좋게 해줄건지! 이런 섬유유연제는 처음이예요! ㅋㅋㅋㅋㅋㅋㅋㅋㅋㅋ 더 신기한 건 바로 ""향기캡슐""쓱샥쓱샥 마찰을 주면 향기가 더 진하게 올라와!!!!!!!!!!!!!!!!!!!!!!!!!!!!!! 이게 왠...뭐 이런게 다있지?할 정도로 향이 화르르륵~ 완젼 깜놀! ㅋㅋㅋㅋㅋㅋㅋㅋㅋㅋㅋ기존의 섬유 유연제에 만족하지 못하셨던 분들, 늘...... 1%가 부족하다고 느끼셨던 분들 갈아타요! 갈아타! 진짜 이건.... 괴물! ?우리 김서방, 물어보지도 않았는데 일하다가, 향이 좋다고 깨톡까지 보내옴! ㅋㅋㅋㅋ ?한동안은, 빨래 제대로 안 하냐고까지..... 했었어요 ㅠㅠㅠㅠ 빨래는 내가 하나? 세탁기가 하지! ㅋㅋㅋㅋㅋㅋㅋㅋ 어쨋든, 저런 카톡도 오는거 보니.... 꽤... 좋아나 봅니다씨익 ^_______^향이 이렇게 강한데도, 전혀 거북스럽지 않은 향.향이 진해서 혹시나 피부에 자극이 되진 않을까 걱정도 했는데 그것도 안심안심,비자극인증으로 민감한 피부에도 안심이예요^^ 조만간, 이불빨래 왕창해서향기로운 이불위에서 살 비비면서 자야겠어요<본 포스팅은 피앤지 체험단으로 선정되어 제품을 지원 받아 작성하였습니다>?????","'맘스홀릭', '베이비', '이벤트', '후기', '아이', '사진', '돌잔치', '후기', '글등', '게시', '글', '삭제', '강퇴', '리지', '후기', '작성', '시', '가이드라인', '참고', '반드시', '원문', '작성', '이벤트', '후기', '게시판', '작성', '후기', '해당', '업체', '로부터', '무료', '제품', '제공', '작성', '후기', '퍼퓸', '다우니', '신제품', '출시', '신제품', '출시', '다우니', '향기', '경험', '수', '다우니', '클래식', '체험', '단', '선정', '화이트', '상자', '저', '무슨', '샤넬', '배달', '줄', '언뜻', '리아', '하그', '이번', '다우니', '향기', '것', '싸구려', '향', '향', '냄새', '저', '운동', '옷', '항상', '땀', '냄새', '신랑', '옷', '향기', '줄', '정말', '기대', '신제품', '다우니', '클래식', '컬렉션', '화이트', '상자', '향', '오', '다우니', '퍼퓸', '클래식', '과', '다우니', '퍼퓸', '클래식', '향기', '지속', '아로마', '쥬얼', '펄', '클래식', '이', '혼자', '사용', '체험', '단', '지인', '체험', '단', '더', '한번', '개', '상자', '하나', '엄마', '하나', '막내', '모집', '선물', '건', '소문', '써야죵', '상자', '안쪽', '선물', '수', '메모', '란', '작성', '선물', '다우니', '퍼퓸', '클래식', '개', '사진', '이번', '출시', '그레이스', '프린세스', '향기', '요', '향수', '노트', '탑', '노트', '베이스', '노트', '구성', '망고', '복숭아', '향기', '자스민', '향', '머스크', '샌들', '우드', '향', '조화', '고', '급', '단어', '향', '다우니', '퍼퓸', '클래식', '아로마', '쥬얼', '펄', '클래식', '그레이스', '프린세스', '기품', '향기', '레시피', '이외', '아로마', '쥬얼', '섬유', '유연제', '걸', '향기', '하니', '향기도', '직접', '사용', '요', '아로마', '쥬얼', '보석', '게', '섬유', '유연제', '향기', '지속', '하니', '수', '아로마', '쥬얼', '다우니', '타', '섬유', '유연제', '함', '사용', '고유', '향', '수도', '향기도', '사용', '향기', '레시피', '아로마', '쥬얼', '섬유', '유연제', '달리', '세탁', '빨랫감', '물', '찌꺼기', '남지', '걱정', '전혀', '네버', '문제', '피죤', '샤프란', '쉐리', '메이시스', '그동안', '모든', '섬유', '유연제', '모두', '섭렵', '정말', '진짜', '진심', '다우니', '처음', '접', '마트', '가면', '다우니', '정말', '손', '안', '섬', '유유', '연제', '거기', '거기', '생각', '먼저', '요', '우리', '집', '세탁기', '위', '자리', '다우니', '어서', '우리', '처음', '신랑', '운동복', '냄새', '제거', '신혼', '초', '늘', '고민', '숙제', '넬리', '세제', '정도', '해결', '섬유', '유연제', '향', '지속', '주지', '못', '메이시스', '빨래', '감', '완젼히', '말', '쭉', '사용', '빨래', '게', '면서', '향', '정말', '무향', '다우니', '섬유', '유연제', '비교', '다우니', '색상', '게', '다른', '섬뮤', '유연제', '농축', '말', '눈', '섬유', '유연제', '피', '순간', '콸콸', '콸콸', '다우니', '역시', '농축', '표준', '용량', '사용', '빨래', '날', '뚜껑', '이면', '충분', '더', '향', '땐', '평상시', '해', '아로마', '쥬얼', '세제', '통', '섬유', '유연제', '아로마', '쥬얼', '세탁', '빨래', '섬유', '유연제', '향', '더', '지속', '저', '향', '화장실', '옷장', '방향', '제', '용도', '때', '향', '빨래', '투척', '빨래', '세탁', '아로마', '쥬얼', '싹', '찌꺼기', '빨래', '수건', '아래', '제', '남방', '동시', '향기도', '정말', '향수', '기분', '비누', '향', '향수', '과', '향', '다우니', '클래식', '컬렉션', '빨래', '동안', '저', '요', '앞', '다우니', '것', '제', '셔츠', '요', '정말', '안', '연속', '그동안', '향수', '단', '번', '뿌리', '정말', '향기', '연속', '지속', '향기', '언제', '도대체', '언제', '날', '언제', '기분', '섬유', '유연제', '처음', '더', '건', '바로', '향기', '캡슐', '쓱샥쓱샥', '마찰', '향기', '더', '이', '뭐', '정도', '향', '륵', '완젼', '깜놀', '기존', '섬유', '유연제', '늘', '진짜', '이건', '괴물', '김', '서방', '일', '향', '깨톡', '동안', '빨래', '제대로', '안', '빨래', '내', '하나', '세탁기', '어쨋', '저런', '카톡', '꽤', '씨익', '향', '전혀', '거북', '향', '향', '혹시', '피부', '자극', '걱정', '그것', '안심', '안심', '비자', '인증', '피부', '안심', '조만간', '이불', '빨래', '왕창', '불위', '살', '포스팅', '피앤지', '체험', '단', '선정', '제품', '지원', '작성'",,네이버 카페,https://cafe.naver.com/ArticleRead.nhn?clubid=10094499&page=12&inCafeSearch=true&searchBy=0&query=%BB%FE%C7%C1%B6%F5&includeAll=&exclude=&include=&exact=&searchdate=2015-01-152018-08-18&media=0&sortBy=date&articleid=28030618&referrerAllArticles=true
227,샤프란,2015.04.22. 22:54,이탈글,																																																																																												섬유유연제중에  보란색인데 약간베이비파우더향나는 유연제아시는분..조리원에서 그유연재를썻는데 피죤이지쉐리이진샤프란이지.. 아시는분 댓글좀달아주셰용																																		,"'섬유', '유연제', '보란색', '약간', '베이비', '파우더', '향나', '유연제', '아시', '분', '조리', '유', '연재', '썻', '피죤', '쉐리', '이진', '샤프란', '아시', '분', '댓글', '좀', '셰용'","'쉐리아닐까요?', '쉐리인가용?감사합니다'",네이버 카페,https://cafe.naver.com/ArticleRead.nhn?clubid=10094499&page=12&inCafeSearch=true&searchBy=0&query=%BB%FE%C7%C1%B6%F5&includeAll=&exclude=&include=&exact=&searchdate=2015-01-152018-08-18&media=0&sortBy=date&articleid=28012693&referrerAllArticles=true
