,Keyword,Date,Title,Contents,Words,Comments,Source,URL
0,샤프란,2018.04.19. 22:31,"샤프란 2100ml*6개 9,900원이요",카카오톡 선물하기에 있어요필요하신분 구입하세요~,"'카카오', '톡', '선물', '신분', '구입'",'저 바닐라리치 샀어요 감사합니다',네이버 카페,https://cafe.naver.com/ArticleRead.nhn?clubid=10094499&page=2&inCafeSearch=true&searchBy=0&query=%BB%FE%C7%C1%B6%F5&includeAll=&exclude=&include=&exact=&searchdate=2015-01-152018-08-18&media=0&sortBy=date&articleid=39327582&referrerAllArticles=true
1,샤프란,2018.04.19. 05:55,빨래 잘 못하는 아내라...ㅜ,"결혼전 신랑에게선 늘 좋은 샤프란냄새가 났어요.향도 좋고 향도 오래가고~그런데 저와 결혼하고 제가 살림을 하면서빨래를 하게되니 그때부터 종종 옷에서 쉰내가나고샤프란 향도 오래가지않는거예요.그때부터 신랑이 자기 빨래할땐 샤프란에 담궈뒀다가탈수해서 말렸다고그렇게 해달라했는데.그래도 쉰내는 없어지지않고. 향도 오래가지않는게 똑같네요.ㅜ식초넣어보기도하고,샤프랑 강한걸로 바꿔보기도하고,제습기 풀가동도해보고따뜻한 물에 삘아보기도하고세탁기 통도 세척해보고 했지만별다른 효과가 없어요.ㅜㅜ빨래 못하는 아내로......ㅜㅜ속상하네요.ㅜ","'결혼', '전', '신랑', '늘', '샤프란', '냄새', '향', '향', '저', '결혼', '제', '살림', '빨래', '그때', '종종', '옷', '가나', '샤프란', '향', '가지', '그때', '신랑', '자기', '빨래', '땐', '샤프란', '탈수', '쉰내', '향', '가지', '식초', '보기', '도하', '샤프', '걸', '보기', '도하', '제습기', '풀', '가동', '물', '삘', '아보', '기도', '세탁기', '통', '세척', '효과', '빨래', '아내'","'건조기구매하세요아무래도 빨고 바로 말리는게 나을듯요', '건조기에 건조하면옷이 줄어든다는데 아닌가요?진지하게 건조기구매 생각해야겠네요.ㅜ', '삶기로 빨면 안나더라구요 건조기도 쓰시면 좋구요', '삶아도 안되든데.건조기가 답이네요ㅜ', '건조기 진짜 강추에요ㅠㅠ 이제 없이 못살아요 꼭 장만하세요ㅎㅎ', '옷이 줄어든다는데아닌가요?그래서 고민하고있거든요.', '저는 가스건조기 쓰는데 니트재질만 줄어요 다른 재질은 안줄어요~ 진짜 꼭 사세요 너무 강추에요', '아...다우니 향기 나는거 팔아요~따로 플라스틱병에 들어서 비비탄 반개? 같이 생긴거 있는디...저도 동향이라 잘 건조 안되는집서 살때 표백제랑 그거 썼어요.아기한텐 안좋아서...아기 낳고는 안쓰네요 ㅜㅡㅜ', '그거 쓰는데ㅜ그래도 안되네요.ㅜㅜ', '뿌리는 섬유유연제 하나 사서 쥐어주세요 자기 원하는 맘껏 뿌려 하면서..애낳고는 그런것까진 신경못쓰게 되더라구요.제때 세탁만 해줘도 좋죠 뭐 ^^;;', 'ㅜㅜ 그렇죠?샤프란에 헹굼할때 좀 담궈두라하드라구요. 근데 매번 그러기가 쉽지않네요.', '볕에 바람 쐬면서 바짝 말려보면 어떨까요. 저희는 남향집에 베란다 앞에 건물 가리는 게 없어서... 세제가 퍼실에 샤프란, 퍼실에 다우니, 베지터블에 다우니 조합 계속 바꿔도 냄새 괜찮은데...', '향은 얼마나 지속되나요?그리고 세제양은 얼마나 넣으시는지ㅜ혹시빨래양은 많이 넣으시나요?ㅜㅜ', '저흰 다음 세탁 직전까지도 향 나요. 세제는 드럼세탁기라 일반 표기량보다 적게 넣는 편이고요. 저는 베이킹소다 같이 넣어요. 빨래는 소량일 때도 가득할 때도 있어요. 냄새 같음. 건조하고 정리해서 옷장 넣으면 향기 쭉 나던데... 아닌가용;;; 세탁온도는 상관없더라고요 달리해도요', '아ㅡ어렵네요.베이킹소다 넣어 일단 해봐야겠어요.헹굼하실때 샤프란에 좀 담궈두시는편인가요?', '세탁기 통세척만 하지말고 아예 업체 불러 해보세요 그거 하고 나서 쉰냄새 없어졌어요 저도 섬유유연제에 좀 담궜다가 해요', '아이를 키우니 꾸준히 하고있는데.ㅜ이미 베어버린 옷은 없어지지않네요.ㅜ', '건조기 구매하세요 :)정말 강추요!!!', '구매하는방향으로.결정해야겠어요! ^^', '혹시.. 빨래를 모아서 하시거나 세탁기 가득 넣어서 하시나용?? 그럴경우 쉰내가 날수있어여', '모아서 가득하는편인듯해요.ㅜ소량씩 해봐야겠네요.ㅜ', '그렇게되면 빨랫감들이 잘 안돌아가서 쉰내가 나더라고여', '아...!애들.내복에서도 유연제랑 쉰내섞인 냄새가 나더라구요. ㅜ그랬구나....', '남편이 세탁할 땐 유연제를 들이부었을 수도 있어요ㅋ 저희 남편도 결혼 전에 섬유유연제 냄새가 폴폴 나서 좋다 했는데 나중에 빨래 하는거 보니 섬유유연제를 정말 콸콸 들이붓더라구요. 기겁했었네요;;', 'ㅎㅎㅎㅎㅎㅎ반전이네요.ㅎㅎ', '그리고 쉰내는 빨래보단 건조의 문제일 때가 많아요~  삶기 코스로 빨래하고 볕 좋은 날 바람 통하게해서 말려보세요! 몇 번 반복하면 쉰내 없어질 거예요~', '젖은빨래들은 기존빨래랑 나눠서 두세요(요게 냄새주범)그리고 그때그때돌리시는게좋아요^^업체불러 통분해세척한번받으시구요ㅡ통안에 곰팡이 있어서나는경우가많아요섬유유연제 많이 쓰고세제통이랑 배출구 세척자주안하면곰팡이 생겨요~', '다우니 액티브 시트러스 이거한번써보세요ㅎㅎ 빨래감에서 냄새나고 그 축축한냄새가 계속 나길래 저거써보니까 안나요~', '락스약하게 푼 물에 냄새나는옷들 헹구고 세탁하세요 안그럼 쉰내절대안없어지더라구요 세균분비물이라 일반세제로는 안없어져요 그리고 물에젖은 수건 안말리고 세탁물통에 넣으면 바로냄새나요 통옆에.걸쳐놓고 좀 말려주세요', '빨래를 반만넣고 물만 가득 넣어도 샤프란 후 좋은냄새 유지되더라구요. 전 반대로 빨래가득한날 신랑이 쉰내난다고 해서 알았어요.'",네이버 카페,https://cafe.naver.com/ArticleRead.nhn?clubid=10094499&page=2&inCafeSearch=true&searchBy=0&query=%BB%FE%C7%C1%B6%F5&includeAll=&exclude=&include=&exact=&searchdate=2015-01-152018-08-18&media=0&sortBy=date&articleid=39315125&referrerAllArticles=true
2,샤프란,2018.04.13. 12:13,무거운거 들엇어요 ㅠㅠ,"??오늘 첨으로 샤프란 20리터 짜리 3-5초 정도 들엇다 놧는데 괸찮겟죠?ㅠㅠ????????????★ 잠깐! 게시글?작성 전, 필독 공지! ★- 카페규정 : http://cafe.naver.com/imsanbu/28123090?- 게시판별 운영 정책 : http://cafe.naver.com/imsanbu/35756864???????????????????","'샤프란', '리터', '정도', '놧는데', '괸찮겟', '잠깐', '게시', '글', '작성', '전', '필독', '공지', '카페', '규정', '게시', '판별', '운영', '정책'","'삭제된 댓글입니다.', '넹 ㅋㅋㅋ', '삭제된 댓글입니다.', '네. 감사합니다', '괜찮아요 ㅎㅎ 근데 4개월이시면 아직 초기 쯤이니까.. 너무 무리하지 마시고 많이 쉬세요!', '넹감사합니다', '삭제된 댓글입니다.', '넹. ㅋㅋㅋㅋ', '그정도는 갠찮을거예요~~^^ 그치만 숙여서 으여차~ 드는건 조심88', '넹 ㅋㅋㅋ', '삭제된 댓글입니다.', '어머  명심하겟습니다 ㅠㅠ', '전 침대 나무판 분해해서 옮기고 소파옮기고 그랬어요..;남편이 맨날 해준대노코 안해줘서 속터져서 제가했어요 지금 둘째임신초긴데 첫애독박육아에 집안일에 ..에휴', 'ㅠㅠ 조심하셔요', '괜찮아여.. 대신 앞으로 무리 안하시면 되져.. 전 둘째 9주에 가구 옮겼는걸요! 여전히 매일매일 14키로 큰아이 안아주구요!!', '넹. ㅋㅋㅋ'",네이버 카페,https://cafe.naver.com/ArticleRead.nhn?clubid=10094499&page=2&inCafeSearch=true&searchBy=0&query=%BB%FE%C7%C1%B6%F5&includeAll=&exclude=&include=&exact=&searchdate=2015-01-152018-08-18&media=0&sortBy=date&articleid=39234188&referrerAllArticles=true
3,샤프란,2018.04.09. 21:08,다들 섬유탈취제는 안쓰시나요?,새옷이나 음식냄새 나는 코트에만간간히 섬유탈취제 쓰고 있어요~LG생건 샤프란꺼요다들 섬유탈취제는 일절 안쓰시나용?문득 안좋은가 걱정이 되서요,"'옷', '음식', '냄새', '나', '코트', '섬유', '탈취', '제', '생건', '샤프란', '요', '섬유', '탈취', '제', '일절', '문득', '걱정'","'세탁그대루하구요~섬유유연제도쓰고 저는향수도 옷에만뿌려서써요ㅎ', '집안에서 칙칙 뿌리기는 좀 찜찜하고  안 쓰자니 옷을 한번 입고 빨수도 없고해서 베란다 나가서 뿌리고 거기 걸어두고 문닫고 들어와요ㅋㅋ'",네이버 카페,https://cafe.naver.com/ArticleRead.nhn?clubid=10094499&page=2&inCafeSearch=true&searchBy=0&query=%BB%FE%C7%C1%B6%F5&includeAll=&exclude=&include=&exact=&searchdate=2015-01-152018-08-18&media=0&sortBy=date&articleid=39179139&referrerAllArticles=true
4,샤프란,2018.04.03. 08:26,"샤프란 3.1L 4개 (8,900원)","http://naver.me/x3sewDNZ톡톡친구 추가하셔서 쿠폰 받으시면4개에 8,900원이예요~^^","'톡톡', '친구', '추가', '쿠폰', '개'","'잘샀어요 감사합니다', '네^^ 감사해요~', '마침 딱 떨어졌는데 덕분에 저렴하게 샀어요 감사해요 ^^', '와 잘됐네요^^ 도움이되어서 기뻐요~', '감사합니다~ ^^', '네~ 감사해요^^', '사고 싶은데 향을 맡아본 적이 없어서^^;;봄 여름쓰긴 어떤 향이 좋은가요?', '저는 프레쉬로 샀어요~ 청량한 꽃향기래요^^ 원래는 크림썼었는데 여름에 어울릴것같아서요   바닐라리치는 달콤한 향이래요~', '저도 프레쉬 사봐야겠네요ㅎㅎ 감사합니다^^', '처음 구입해봐요 ㅎㅎ', '그래요?^^ 향이 마음에들면 좋겠네요~', '무슨 향이 괜찮는지 알수 있을까요?^^샤프란은 처음 사용하는거라....', '프레쉬 괜찮을것같아요~ 인터넷 후기보니 잔향도 많다하고 호불호가 없어보여요~', '상품평보니 프레쉬 마니쓰것같아서 저도 프레쉬사봤어요ㅎㅎ 아침부터 득템했네용 감사해용^^', '네^^ 저도 여름이라 프레쉬로 샀어요 향도 마음에 드시길~', '감사해용!! 시원한 향이 여름엔 좋을거같아서 프레쉬 아일랜드로 샀어용!', '저두 프레쉬로 구입했는데 기대되네요^^ 맘에드시길 바래요~', '친정엄마가 샤프란도 쓰고 하시던데 향 좋더라구요 다우니만 쓰다가 요고 사봤어요 감사해용', '저도 샤프란 오래썼는데 가성비 짱인것같아요^^ 아무래도 다우니보다는 향이 옅을수도있지만 맘에드셨음 좋겠네요~', '엄청 싸게 샀네요~~', '도움이 되어서 기쁘네요^^', '친정집에보냈네요감사합니다', '우왕 효녀시네요^^ 향도 마음에드셨음 좋겠어요~', '감사해요~ 구매했오요', '네^^ 감사해요~', '저도 덕분에 싸게구입했어요~감사해요', '도움이될수있어서 다행이예용^^', '감사해요~ 잘 샀어요^^', '네^^ 향도 맘에드시길 바래요~', '감사해요 덕분에 잘샀어요~^^', '네^^ 향도 마음에 드시길 바래요~', '오호 잘 샀어요', '감사해요~^^', '프레쉬가 허브향과 비슷할까요?', '덕분에 잘샀어요~~^^', '도움이되어서 기쁘네요~^^', '너무 잘 샀어요  감사합니다', '감사해요~^^'",네이버 카페,https://cafe.naver.com/ArticleRead.nhn?clubid=10094499&page=2&inCafeSearch=true&searchBy=0&query=%BB%FE%C7%C1%B6%F5&includeAll=&exclude=&include=&exact=&searchdate=2015-01-152018-08-18&media=0&sortBy=date&articleid=39083124&referrerAllArticles=true
5,샤프란,2018.03.04. 10:30,이불 빨래 중성세제 대신 합성세제 부어버렀어요 ㅠ,이미 비트 합성세제 액체 붓고 나서 아래 글을 봤습니다 ㅠ지금이라도 꺼내서 대충이라도 씻어내고 중성세제를 넣어야할지그냥 합성세제로 돌릴지..아직 물붓기 전이거든요 ㅠㅠ그리고 중성세제란 다우니 샤프란 같은게 아니라울샴푸를 말하는거죠 ?? 집에 울샴푸가 없는데 그냥 비트로 해얄지 슈퍼을 가얄지 ;;더 스며들기전 바로 댓글좀 부탁드려요 흑,"'비트', '합성세제', '액체', '아래', '글', '지금', '대충', '중성세제', '지그', '합성세제', '물', '붓기', '전이', '중성세제', '란', '다우니', '샤프란', '샴푸', '말', '집', '샴푸', '그냥', '비트', '해얄', '슈퍼', '을', '가얄', '더', '기전', '바로', '댓글', '좀'",'괜찮아요. 매번 이불빨래 세제로 해도 아무이상 없어요.',네이버 카페,https://cafe.naver.com/ArticleRead.nhn?clubid=10094499&page=2&inCafeSearch=true&searchBy=0&query=%BB%FE%C7%C1%B6%F5&includeAll=&exclude=&include=&exact=&searchdate=2015-01-152018-08-18&media=0&sortBy=date&articleid=38649444&referrerAllArticles=true
6,샤프란,2018.02.05. 22:13,아기옷 어른세제써도되나요??ㅜㅜ,아기옷세탁하는데 신랑이 저희쓰는 샤프란을넣었는데 헹굼마니하면되나요??아님 다하구 아기껄루다시빨아야할지 ㅜㅜ아기가 피부가썩좋은편이아니라..헹굼마니해서입혀두되겠졍??ㅜㅜ,"'아기', '옷', '세탁', '신랑', '저희', '샤프란', '헹굼', '아기', '껄루', '다시', '빨', '아기', '피부', '썩', '편이', '헹굼', '졍'","'저라면 한번의 실수하면 헹굼 더하고 그냥 입힐 듯해요~ㅎㅎㅋㅋㅋㅋ', '그래도되겠죠???신랑이도와준다고했는데 뭐라고하기도그렇궁ㅜㅜ헹굼마니하고그냥입혀야게써용~~'",네이버 카페,https://cafe.naver.com/ArticleRead.nhn?clubid=10094499&page=2&inCafeSearch=true&searchBy=0&query=%BB%FE%C7%C1%B6%F5&includeAll=&exclude=&include=&exact=&searchdate=2015-01-152018-08-18&media=0&sortBy=date&articleid=38299372&referrerAllArticles=true
7,샤프란,2018.01.31. 09:26,드럼세탁기 빨래 뻣뻣..,드럼세탁기고요ㅜㅜ빨래하면 뭐든 뻣뻣하게 만드는 신기한 마술 능력을 가지고 있어요....속싸개든..손수건이든.. 옷이든..옷감도 부풀일어나듯 상하고요ㅜㅜ뭐가 문제일까요..드럼용액체세제 쓰고있고 선물받은 샤프란 넣고있는데...  세제나 섬유유연제의 문제일까요?육아고수님들 도와주쎄여ㅜ.ㅜ,"'드럼세탁기', '고요', '빨래', '뭐', '마술', '능력', '가지', '싸개', '손수건', '옷', '옷감', '부풀', '상하', '고요', '뭐', '제일', '드럼', '용', '액체', '세제', '선물', '샤프란', '세제', '섬유', '유연제', '제일', '육아', '고수'","'세제양을 줄이거나 행굼을 한번더추가해보세요.드럼이 물을적게써서 의외로 세제가 남아있을수 있대요', '한번해보겠습니다!  은근스트레스네요ㅜㅡㄴ', '이거 저도그래요 ㅠㅠ 진짜 스트레스받아요 ㅡㅡ^ 통돌이로 돌아가고싶네요 ㅠㅠ', '드럼세탁기도 나름인건지...  그래도 부드럽게 빨아지는 집도 있던데ㅜㅜㅜㅜ이제 곧 애기태어나는데 신경쓰입니다..ㅜㅜ', '전 지금 90일된 애기있는데 애기옷도 뻣뻣하고 ㅠㅠ 세제도 조금씩 넣고 빨아봤는데 도데체 뭐가 문젠지모르겠어요 ㅋㅋㅋ 수건은 완전 수세미같아요 ㅡㅡㅋㅋㅋ'",네이버 카페,https://cafe.naver.com/ArticleRead.nhn?clubid=10094499&page=2&inCafeSearch=true&searchBy=0&query=%BB%FE%C7%C1%B6%F5&includeAll=&exclude=&include=&exact=&searchdate=2015-01-152018-08-18&media=0&sortBy=date&articleid=38217732&referrerAllArticles=true
8,샤프란,2018.01.13. 09:45,섬유유연제유통기한!,																																																																																												뜯지않은섬유유연제...유통기한언제까지에요??? ㅠ ㅠ 샤프란입니당																																		,"'섬유', '유연제', '유통', '언제', '요', '샤프란'",,네이버 카페,https://cafe.naver.com/ArticleRead.nhn?clubid=10094499&page=2&inCafeSearch=true&searchBy=0&query=%BB%FE%C7%C1%B6%F5&includeAll=&exclude=&include=&exact=&searchdate=2015-01-152018-08-18&media=0&sortBy=date&articleid=37957422&referrerAllArticles=true
9,샤프란,2018.01.08. 10:12,(수량 다시 풀림)섬유유연제 핫딜,롯데닷컴에서 샤프란 1000미리 2개 2500원이에요.무배구요~http://m.lotte.com/product/m/product_view.do?goods_no=453945707,"'롯데', '샤프란', '미리', '개', '무', '배구'","'싰어요 감사해요', '네^^벌써 품절이라는데 성공하셨네요~ㅎ', '감사합니다^.^', '품절전에 건지셨군요ㅎ', '덕분에 잘 샀습니다~~!!', '네^^품절전에 사서 다행이에요~ㅎ', '로그인하다 품절돼써요ㅠㅋㅋㅋ', '벌써 품절됐어요?ㅠ 담번엔 꼭 성공하시길..', '수량 풀렸대요~', '와~ 감사합니다^^ 덕분에 샀어용ㅎ', '품절이에요ㅜㅜ 빠르군요', '벌써 품절인가요ㅠ', '수량 풀렸대요~ 다시 달리세요~ㅎ', '하나만 살수 있는건가요?', '저도 방금샀어요~감사합니다~^^', '성공하셨네요^^', '지금샀어요', '품절이랬는데 풀렸나봐요~ㅎ', '네 덕분에 엘머니엘포조합으로 0원으로 구매했네요 감사용', '오오 샀어요^^ 감사해요^^', '아직 수량 남았나봐요~ㅎ', '감사합니다^^', '감사합니다~ ^^ 엘포인트로 구매해 0원으로 샀네요 ㅎㅎ'",네이버 카페,https://cafe.naver.com/ArticleRead.nhn?clubid=10094499&page=2&inCafeSearch=true&searchBy=0&query=%BB%FE%C7%C1%B6%F5&includeAll=&exclude=&include=&exact=&searchdate=2015-01-152018-08-18&media=0&sortBy=date&articleid=37880180&referrerAllArticles=true
10,샤프란,2018.01.07. 01:16,섬유유연제 추천해주세요 ~ ㅠㅠ,"임신7주 입덧으로,,, 매우 괴로운 상태인데요 ㅠㅠ *건강을 위해 샴푸, 바디워시 천연으로 사용하다가 향이 너무 느껴져서 상큼한 느낌의 일반제품으로 바꾸었어요(천연아니구요 ㅠㅠ) *그리고 유연제도 가급적 안사용하는게 좋다고 해서 식초나 구연산으로 대체하다가 결국 물비린내가 너무 강하게 느껴져서,, 다우니 대용량 사용했는데요 너무너무너무 그 향이 역하게 느껴지네요 ㅜㅜㅜ 그래서 못사용하겠어요 ㅠㅠ 그리고 집에남아있던 친정어머니가 주신 샤프란분홍색을 쓰니 이것도 너무 맡을때마다 울렁울렁하네요,, *치약도 매일 양치하며 입덧하다 한살림 치약으로 바꾸니 괜찮아졌어요(저에게 이제 맞나봐요~~) 섬유유연제 끝향이 꽃향처럼 은은하게 나고 ,, 과일향도 좋구요 ~~ 자연스럽게 은은하게 나는 향이 있을까요 ? 스너글 , 꽃담초가 후기가 좋아서 왠지 괜찮아보이는데요 ㅜㅜ 다우니와 같은 사태가 벌어질까봐 선뜻 못구입하겠어요,,, 저같이 입덧으로 향이 너무 느껴지시는 경우 어떤섬유유연제가 좋을까요? 추천부탁드려요 ㅠㅠㅠ 너무 간절히 찾고있어요,,,","'임신', '주', '입덧', '매우', '상태', '요', '건강', '위해', '샴푸', '바디', '워시', '천연', '사용', '향', '상큼', '느낌', '반제품', '천연', '유연제', '식초', '구연산', '대체', '물', '다우니', '용량', '사용', '그', '향', '역', '집', '친정', '어머니', '주신', '샤프란', '분홍색', '것', '때', '치약', '매일', '양치', '입덧', '한살림', '치약', '저', '이제', '섬유', '유연제', '끝향', '꽃향', '과일', '향', '자연', '나', '향', '스', '너글', '꽃담', '초가', '후기', '다우니', '사태', '선뜻', '못', '구입', '저', '입덧', '향', '경우', '섬유', '유연제', '추천'","'아예 아기꺼 순한걸로 사서쓰시능것도 괜찮을거같아요', '네 ㅜㅜ 혹시 아기 섬유유연제 중엔 어떤게 좋은가요?', '에티튜드 꺼 무향이있아요!', '감사합니다^^', '저 꽃담초쓰는데 만족하고 있어요~마트가셔서 향을 맡아보시고 사세요~', '저도 꽃담초 쓰는데 그나마 머리 안아프고 은은은은해서 좋더라구용', '네~~^^', '스너글 너무 좋은데요ㅠㅠ', '꽃담초연꽃향이요 강하지도않고괜찮은거같아요 스너글은향이강해요~'",네이버 카페,https://cafe.naver.com/ArticleRead.nhn?clubid=10094499&page=2&inCafeSearch=true&searchBy=0&query=%BB%FE%C7%C1%B6%F5&includeAll=&exclude=&include=&exact=&searchdate=2015-01-152018-08-18&media=0&sortBy=date&articleid=37865236&referrerAllArticles=true
11,샤프란,2018.01.01. 22:40,드럼세탁기 섬유유연제 고농축 된거 넣으면 세탁기가 상하나요?,세탁기 설치해주시는 분이 유연제는 농축된거 넣으면 세탁기가 상한다고 하던데 그럼 혹시 꽃담초도 안될까요..?ㅠㅠ요즘 다들 농축된거 쓰시는거같던데혹시 농축되지않은거 피죤이나 샤프란 이런것들 중에혹시 추천해주실거 있으면 답글 부탁드립니다!ㅜㅜ,"'세탁기', '설치', '분', '유연제', '농축', '된거', '세탁기', '상', '혹시', '꽃담', '초도', '요', '요즘', '농축', '된거', '혹시', '농축', '피죤', '샤프란', '것', '중', '혹시', '추천', '답글'","'삭제된 댓글입니다.', '네 그렇다더라구요 ㅠㅠ저도 이번에 처음 알게된 사실이에요!ㅋㅋ', '고농축이라아주조금써야되는데ㅎㅎ일반섬유유연제만큼이나써서문제생긴데요ㅎㅎ양조절못할꺼면그냥섬유유연제를쓰라며ㅎㅎ세탁기분해청소하시는분이고농축유연제덕에돈버신대요ㅎㅎ', '와 그렇군요!ㅋㅋㅋ 알려주셔서 정말 감사드립니다!ㅋㅋ', 'http://m.storefarm.naver.com/organick/products/2068322984?NaPm=ct%3Djbw9awgg%7Cci%3Dcheckout%7Ctr%3Dppc%7Ctrx%3D%7Chk%3D4cef1cdd36060b118e640d9320ffc60e26760efc저는 이거쓰는데 향 좋더라구용.. ㅎㅎ', '오 이거 인기많은것 같던데!ㅋㅋㅋㅋ 감사합니다'",네이버 카페,https://cafe.naver.com/ArticleRead.nhn?clubid=10094499&page=2&inCafeSearch=true&searchBy=0&query=%BB%FE%C7%C1%B6%F5&includeAll=&exclude=&include=&exact=&searchdate=2015-01-152018-08-18&media=0&sortBy=date&articleid=37790351&referrerAllArticles=true
12,샤프란,2017.12.21. 08:02,"아기냄새나는 아기세제,유연제 추천",개인적으로 아기냄새..그니까 쁘띠마망냄새라고해야하나분냄새?또는 샤프란 분홍색향 좋아해요.지금 아기세제랑 유연제찾고있는데라벤더향 극혐 목련향 극극혐 취향입니다ㅜ입덧도 릴리향맡고 몇시간 죽을뻔ㅜㅜ그래서 최대한 아기냄새 순하게나는 세제랑 유연제찾는데추천부탁드려요ㅜㅜ,"'개인', '아기', '냄새', '쁘띠', '마망', '냄새', '하나', '냄새', '샤프란', '분홍색', '향', '지금', '아기', '세제', '유연제', '라벤더', '향', '극혐', '목련', '향', '혐', '취향', '입덧', '릴리', '향', '시간', '죽', '뻔', '최대한', '아기', '냄새', '세제', '유연제', '추천'","'마마앤부 베이비파우더향이요!ㅋ울 애기 자면 제가 계속 킁킁대요ㅋ', '저랑 향취향(?)이 약간 비슷하신듯 ㅎㅎ 저도 찾고찾다 이번에 베비언스 알게됐는데 만족해서 재구매하려구요. 베이비파우더향이 심하진않고 은은한데 괜찮더라구요~', '저렴하고 은은한점에 끌려 방금 위메로 구매햇어요. 세제+유연제 1500ml로 10620원에구매했는데 싸게잘산걸까요?'",네이버 카페,https://cafe.naver.com/ArticleRead.nhn?clubid=10094499&page=2&inCafeSearch=true&searchBy=0&query=%BB%FE%C7%C1%B6%F5&includeAll=&exclude=&include=&exact=&searchdate=2015-01-152018-08-18&media=0&sortBy=date&articleid=37647045&referrerAllArticles=true
13,샤프란,2017.12.18. 22:23,"섬유유연제,세제 추천해주세요...",안녕하세요!14주를 바라보고있는 예비맘입니다..요즘 섬유유연제에 냄새덧이 너무심해서 고민이에요ㅠ섬유유연제를 사용 안해도 세제냄새때문에 역겨워요...피존 샤프란 다우니등등 정전기가 썩은냄새가 나요..혹시 어떤 세제나 섬유유연제 사용하시나요?임신전에는 사람들지나가면 다우니냄새가 진해서 좋았는데 요즘엔 다우니 냄새만 나도 우엑하네요ㅠㅠ,"'주', '예비', '맘', '요즘', '섬유', '유연제', '냄새', '덧', '너', '고민', '섬유', '유연제', '사용', '안해', '냄새', '때문', '피존', '샤프란', '다우니', '등등', '정전기', '냄새', '혹시', '세제', '섬유', '유연제', '사용', '임신', '전', '사람', '다우니', '냄새', '요즘', '다우니', '냄새'","'임신중이시면 피부도예민하실텐데슈가버블 섬유세제랑섬유유연제써보세요.계속쓰시다가 애기태어나면 애기도 같이사용하면되구요저도그렇게하고있거든요.', '저도그래서 꽃담초 한번 써볼려구요.. 다우니 쓰고있는데 역해서 빨래는 신랑몫이네요..', '저도 임신했을때는 어떤향을 맡아도 역하더라구요 ㅠ'",네이버 카페,https://cafe.naver.com/ArticleRead.nhn?clubid=10094499&page=2&inCafeSearch=true&searchBy=0&query=%BB%FE%C7%C1%B6%F5&includeAll=&exclude=&include=&exact=&searchdate=2015-01-152018-08-18&media=0&sortBy=date&articleid=37614666&referrerAllArticles=true
