,Keyword,Date,Title,Contents,Words,Comments,Source,URL
306,샤프란,2015.04.20. 17:09,집에서 백일잔치 했어요 ^^,백일상 검색하다가 까르르를 알게 됐는데요 양가 부모님들과 친척들이 보시곤 푸짐하게 잘했다며 칭찬받았습니다~박스 포장도 뽁뽁이와 함께 정성들여 되어 있었어요~ 나중에 넣을때도 여유공간이 있어서 어렵지 않았습니다~드레스 두벌도 우리 딸래미 입혀놓으니 너무 예쁘네요 ~ 둘다 포기할수 없어서 두벌다 입혔지용 ㅋㅋㅋㅋ그리고 현수막인지 테이블보에서인지 샤프란 향기가 나서 너무 좋았습니다. 세탁이나 관리도 꼼꼼하신거 같았어요 ㅋ집에서 하는 백일상이라 걱정많이 햇는데 집에서도 할만 하죠? ^___^ 백일 준비하는 맘들꼐 도움이 되셨기를~~?,"'일상', '검색', '까르르', '알', '양가', '부모님', '친척', '칭찬', '박스', '포장', '뽁뽁이', '정성', '나중', '때', '유공', '드레스', '벌', '우리', '딸', '래미', '포기', '두', '현수막', '테이블', '보', '인지', '샤프란', '향기', '세탁', '관리', '집', '일상', '걱정', '햇', '집', '백일', '준비', '맘', '도움'",,네이버 카페,https://cafe.naver.com/ArticleRead.nhn?clubid=10094499&page=12&inCafeSearch=true&searchBy=0&query=%BB%FE%C7%C1%B6%F5&includeAll=&exclude=&include=&exact=&searchdate=2015-01-152018-08-18&media=0&sortBy=date&articleid=27991216&referrerAllArticles=true
307,샤프란,2015.04.11. 18:46,로즈향 섬유유연제,																																																																																												길 가다 보면  자주 맡는 섬유유연제 향인데도대체 어떤건지 알수가 없어요ㅎㅎㅎ진한 로즈향인데 샤프란 피죤 이런건 아닌거같아요. 맘님들  요즘 많이 쓰는 섬유유연제 뭐 있나요?다우니 종류인가?다우니는 꽃향기는 잘 모르겠고가끔 집 엘베에서도 향 나는데 궁금해죽겠어요ㅋㅋ,"'길', '자주', '섬유', '유연제', '향', '도대체', '건', '로', '향', '샤프란', '피죤', '맘', '요즘', '섬유', '유연제', '뭐', '다우니', '종류', '다우니', '꽃', '향기', '가끔', '집', '엘베', '향'",'버넬 아닐까요?',네이버 카페,https://cafe.naver.com/ArticleRead.nhn?clubid=10094499&page=12&inCafeSearch=true&searchBy=0&query=%BB%FE%C7%C1%B6%F5&includeAll=&exclude=&include=&exact=&searchdate=2015-01-152018-08-18&media=0&sortBy=date&articleid=27918516&referrerAllArticles=true
308,샤프란,2015.03.27. 21:52,가끔 보면 절에서 나는 향냄새 나는 분들이 계세요..,																																																																																												진짜 향냄새같은 진하고 독특한 향이 나는데..이거 향수에요?!..아님 화장품?..궁금해서요 ㅋ그분들께 산 옷들은..샤프란넣고 헹궈도.. 몇번을 세탁기돌려도.. 그 냄새가 정말 꿋꿋이 남아있구..절대 안없어지네요..무슨향이죠.. 이거..?,"'진짜', '향냄새', '향', '거', '향수', '화장품', '그', '산', '옷', '샤프란', '헹궈', '몇번', '세탁기', '그', '냄새', '정말', '꿋꿋', '절대', '향', '거'","'저 향 냄새좋던데', '아앗...', '저희신랑 향수 딥디크 탐다오 요거 향냄새, 절에나는냄새 비슷한데 매력있어요ㅎㅎ', '네ㅠㅠ저한텐안맞나봐여..', '저만그렇게 느끼는지모르겠는데 샤넬 넘버파이브향수 약간 절냄새안나요? ㅎㅎ', '넘파는 화장실냄새요 ㅋㅋ', '헉 ㅋㅋㅋ 뿌리면안되겠네요 ㅋㅋ', '샤넬은 다 향이 넘 진해서.. 사람들이 머리아파해요 ㅋㅋ못 뿌리고 다 유통기한지나버렸다죠ㅠ', '삭제된 댓글입니다.', '아..전 롤리타램피카ㅠㅠㅠㅠㅠ불호요..', '삭제된 댓글입니다.', '', '  '",네이버 카페,https://cafe.naver.com/ArticleRead.nhn?clubid=10094499&page=12&inCafeSearch=true&searchBy=0&query=%BB%FE%C7%C1%B6%F5&includeAll=&exclude=&include=&exact=&searchdate=2015-01-152018-08-18&media=0&sortBy=date&articleid=27798015&referrerAllArticles=true
309,샤프란,2015.03.13. 20:28,친정에왔는데...,																																																																																												친정에 와서 엄마랑 장보러 왔어요~샤프란 3.1리터짜리가 2500원 하길래 7개나 샀네요...샤프란은 두고써도 되니까 그냥 질렀는데집에는 무거워서 못가져가겠네요 ㅠ?,"'친정', '엄마', '장', '샤프란', '리터', '리가', '개', '샤프란', '그냥', '집', '무거워'","'그럴땐택배를요ㅋㅋ', '택배 ㅋㅋ 그건 생각못했네요'",네이버 카페,https://cafe.naver.com/ArticleRead.nhn?clubid=10094499&page=12&inCafeSearch=true&searchBy=0&query=%BB%FE%C7%C1%B6%F5&includeAll=&exclude=&include=&exact=&searchdate=2015-01-152018-08-18&media=0&sortBy=date&articleid=27679730&referrerAllArticles=true
310,샤프란,2015.03.12. 10:52,"돌잔치 한복(엄마,아빠,아기한복) 후기에요~","?[의상]? 한복대여 ????엄마,아빠한복 /이랑한복http://cafe.naver.com/eranghanbok???????????????????????????????????????????????????일하는 워킹맘 이라 처음에 걱정만 오억만개가 머리속을 뒤집고 있어서 일도 제대로 못했던게 기억나네요 ㅜ 일은 해야겠고 돌잔치 준비를 해야 한다는 압박감에 어떻게 있었는지모르겠어요.? 정말인지 지나고 나면 별일이아님에도 불구하고 그땐 정말 큰일로만 느껴졌었거든요?아직도 그 압박감을 생각 하면 진저리가 납니다?아무래도 전통상이기도 하고 갑자기 들어선 연년생 아기때문에 배가 엄청 부른상태여서한복을 고를수밖에 없었어요.? 한복을 입게 되면 전 꼭 당의가 입고 싶어 당의로만 보았어요. 전통당의. 제가 한복 퓨전은 매우 시러하거든요검색어만치면 무수한 대여업체들이 뜨니 거기서 마음에 드는 곳을 고르는것도 일이었어요다들 너무 요란한 한복 세트라 맘에 안들기도하고 ..ㅜ그러다 검색에 검색끝에 이랑한복이라는?한복이 전체적으로 단아해서 제마음에 쏘옥드는 업체를 알게됐어요여기 본 이후로는 여기 한복에서만 눈에 불나게 찾았네요ㅎㅎ원단도 고급스럽고 기본구성품외 악세서리. 그리고 신발. 핸드백까지 가격면에선?착하진 않았지만? 제값다하는 한복이였습니다 제가 고른한복은 원래 신부한복인데ㅎㅎㅎㅎ 화이트당의에 핑크치마라서 어떤 배경이든 잘어울릴듯 했어요처음 옷을 받았을때도 꼼꼼히 포장되어와서 좋았구요돌잔치 당일날 한복 이쁘다는 소리 굉장히 많이 들었어요^^이렇게 이쁜 한복은 본적이 없다고하더라구요~?사실 처음에는 한복을 인터넷으로 대여한다는게 고민스러웠거든요. 사이즈도 그렇고 실제 느낌과 많이 틀리면 어쩔까 싶어서요. 괜한 고민을 했던것같아요 정말 사랑스러운 느낌을 더한 샤프란 한복이였어요^^?????????아기한복/ 메르헨&노블레스 http://www.nobledress.com/???사시사철 내복만 입힌 어미라서 특별한 날이니만큼 의복만은 제대로 하자고 벼르고 있었어요전통 돌잔치에 아가도 전통으로 입히고 싶었던게 저의 개인적인 로망으로..엄마욕심으로는 드레스, 한복 둘다 대여하고싶었는데 평소에 입지 않던 불편한 옷을 두벌이나 갈아입히기는어려울것같아서 한복만 대여했어요(스냅때 입었던 정장은 파티파라나 돌잔치 업체에서?무료대여해준옷이에요)?화려한 색감의 한복이 사진빨 잘 받는다고 해서 고민했는데너무 화려한 것보다는 은은한 색동이 더 고급진거 같아서?아빠 의상에 맞춰 같이 보라 계열로 했어요.한복 이름이 누비 색동 두루마기 인가 그랬던거 같아요.한복 받을 때 복건이랑 호건 둘 다 와서 호건 씌웠더니 제법 그럴듯 하더라구요ㅋ근데 금방 벗어버렸다는 ㅠㅠㅠㅠㅠ이쪽 업체도 꼼꼼히 포장되어 와서 좋았네요 ? ? ?","'한복', '대여', '일', '워킹맘', '처음', '걱정', '오억만', '머리', '속', '일도', '제대로', '일', '돌잔치', '준비', '압박', '감', '정말', '이아', '불구', '그땐', '정말', '큰일', '로만', '그', '압박', '감', '생각', '진저리', '전통', '갑자기', '연년생', '아기', '때문', '배', '상태', '한복', '한복', '전', '꼭', '의', '당', '로만', '전통', '제', '한복', '퓨전', '매우', '검색', '치면', '무수', '업체', '거기', '마음', '곳', '일', '한복', '세트', '맘', '안', '기도', '검색', '검색', '끝', '이', '한복', '한복', '전체', '단아', '마음', '옥', '업체', '알', '여기', '이후', '여기', '한복', '눈', '원단', '성품', '외', '신발', '핸드백', '가격', '면', '값', '한복', '제', '복은', '원래', '신부', '한복', '화이트', '의', '핑크', '치마', '배경', '처음', '옷', '때', '포장', '돌잔치', '당일', '날', '한복', '소리', '한복', '본적', '사실', '처음', '한복', '인터넷', '게', '고민', '사이즈', '실제', '느낌', '괜', '고민', '정말', '느낌', '샤프란', '한복', '아기', '한복', '메르', '헨', '노블레스', '사시', '사철', '내복', '어미', '의복', '제대로', '하자', '벼르', '전통', '돌잔치', '아가', '전통', '저', '개인', '로망', '엄마', '욕심', '드레스', '한복', '대여', '평소', '입지', '옷', '벌이', '한복', '대여', '스냅', '때', '정장', '파티', '파라나', '돌잔치', '업체', '무료', '옷', '색감', '한복', '사진빨', '고민', '것', '색동', '더', '고급', '아빠', '의상', '보라', '계열', '한복', '이름', '누비', '색동', '두루마기', '한복', '때', '복건', '호건', '둘', '호건', '제법', '금방', '쪽', '업체', '포장'","'아이고 ~~ 아이한복이 너무 이쁘네요 ~~~ 귀여워요 ~~', '한복이쁘네요~~', '아 너무 이쁘네요 @@', '아이도 한복도 넘 이쁘네요~~', '아이한복이뻐요', '파티파라나에서 하셨네요. 저도 다음달에 여기서 하는데 완전 기대하고 있어요~', '저도 파티파나에서 돌찬치하는데... 음식,스냅,의상,화장 모두 기대됩니다', '저희도 파티파라나에서 하는데 메르헨에 예약했어요^^피팅할때 보니 한복 정말 이쁘더라고요^^', '저도 파티파라나에서 하는데 한복 이쁘네용~전 정장할까 고민중인데 참고해야 겠네요~', '여기 음식이 맛있다고 소문이 자자하더라구요^^', '너무너무 예뻐요~~축하드려요', '한복이 정말 멋지네요. 리사테에서 한건가요? 축하드려요~', '한복이 넘 이뿌네용저도 7월에 돌찬치해용~~주차,음식 좋은거 같아용', '한복이 너무이쁘네요. 저희도 저걸로 할까나.', '저도 7월에 파티파라나에서 돌잔치해요~아 기대가 됩니다. 아가 사진 넘 잘나왔네요..', '한복이 정말 고와요~~ 저도 여기서 하는데 기대되네요~~', '우와~ 한복이 너무 예뻐요~ 전 정장입을건데 한복입고싶네요 ㅎㅎ 저도 9월에 여기서해요~', '한복 정말 이쁘네요... 홀이 요란하지 않아 은은한 한복 색깔도 잘 어울리는 것 같아요..', '파티파라나에서 저도 두 달 뒤에 하는데 사진보니 이쁘게 잘 나온거 같아요.아기 한복도 너무 이쁘네요세련된거 같아서 맘에 들어요..', '저두 여기서 11월 마지막 주에 하는데 아직 의상결정이 안되서 고민이요.', '저는 다음달에 파티파라나에서 하는데요전통홀도 예쁜거 같네요 한복잘어울리시네요~', '이쁘네요 저도 이곳에서 하는데 기대됩니다.', '어머~아가가 도련님같아요^^너무 귀여워요~저도 10월 파티파라나 예정인데 사진보니 너무기대되네요^^', '한복도이쁘고사진도 좋고 장소랑 어울려요 저도 여기서 잔치하기로했어요', '파티파라나에서 돌잔치 준비중인데 정보 감사해여 ^^'",네이버 카페,https://cafe.naver.com/ArticleRead.nhn?clubid=10094499&page=12&inCafeSearch=true&searchBy=0&query=%BB%FE%C7%C1%B6%F5&includeAll=&exclude=&include=&exact=&searchdate=2015-01-152018-08-18&media=0&sortBy=date&articleid=27665492&referrerAllArticles=true
311,샤프란,2015.03.10. 17:36,돌잔치 한복 칭찬많이들었어요!,"??아무래도 전통상이기도 하고 갑자기 들어선 연년생 아기때문에 배가 엄청 부른상태여서한복을 고를수밖에 없었어요.? 한복을 입게 되면 전 꼭 당의가 입고 싶어 당의로만 보았어요. 전통당의. 제가 한복 퓨전은 매우 시러하거든요검색어만치면 무수한 대여업체들이 뜨니 거기서 마음에 드는 곳을 고르는것도 일이었어요다들 너무 요란한 한복 세트라 맘에 안들기도하고 ..ㅜ그러다 검색에 검색끝에?한복이 전체적으로 단아해서 제마음에 쏘옥드는 업체를 알게됐어요여기 본 이후로는 여기 한복에서만 눈에 불나게 찾았네요ㅎㅎ원단도 고급스럽고 기본구성품외 악세서리. 그리고 신발. 핸드백까지 가격면에선?착하진 않았지만? 제값다하는 한복이였습니다 제가 고른한복은 원래 신부한복인데ㅎㅎㅎㅎ 화이트당의에 핑크치마라서 어떤 배경이든 잘어울릴듯 했어요처음 옷을 받았을때도 꼼꼼히 포장되어와서 좋았구요돌잔치 당일날 한복 이쁘다는 소리 굉장히 많이 들었어요^^이렇게 이쁜 한복은 본적이 없다고하더라구요~?사실 처음에는 한복을 인터넷으로 대여한다는게 고민스러웠거든요. 사이즈도 그렇고 실제 느낌과 많이 틀리면 어쩔까 싶어서요. 괜한 고민을 했던것같아요 정말 사랑스러운 느낌을 더한 샤프란 한복이였네요^^강추합니다!!?????==? 순수 후기가 아닌 특정업체홍보성으로 판단될경우에는 삭제 또는 강퇴사유가 될수 있습니다. ==## 타인의 아이디를 빌려 돌잔치 후기를 작성하는 경우, 아이디를 빌려준 분은 물론 아이디를 빌려쓰신 분도 글 삭제 및 강퇴처리 될 수 있으니 절대 아이디를 빌려주지 말아주세요!!!??????????????????????????","'전통', '갑자기', '연년생', '아기', '때문', '배', '상태', '한복', '한복', '전', '꼭', '의', '당', '로만', '전통', '제', '한복', '퓨전', '매우', '검색', '치면', '무수', '업체', '거기', '마음', '곳', '일', '한복', '세트', '맘', '안', '기도', '검색', '검색', '끝', '한복', '전체', '단아', '마음', '옥', '업체', '알', '여기', '이후', '여기', '한복', '눈', '원단', '성품', '외', '신발', '핸드백', '가격', '면', '값', '한복', '제', '복은', '원래', '신부', '한복', '화이트', '의', '핑크', '치마', '배경', '처음', '옷', '때', '포장', '돌잔치', '당일', '날', '한복', '소리', '한복', '본적', '사실', '처음', '한복', '인터넷', '게', '고민', '사이즈', '실제', '느낌', '괜', '고민', '정말', '느낌', '샤프란', '한복', '강', '순수', '후기', '특정', '업체', '홍보', '판단', '경우', '삭제', '강퇴', '사유', '타인', '아이디', '돌잔치', '후기', '작성', '경우', '아이디', '준', '분', '아이디', '분도', '글', '삭제', '및', '강퇴', '처리', '수', '절대', '아이디'","'한복도 너무 단아하고, 사진 느낌이 너무 좋네요', '한복업체 쪽지부탁드려요^^', '쪽지보내드렸어요~ㅎ', '한복이쁘네요', '한복이뻐요 봄기운이 느껴지네요^^', '한복 너무고급스럽네요~*예뻐요 이랑한복 한복이 다 너무고급스럽네요'",네이버 카페,https://cafe.naver.com/ArticleRead.nhn?clubid=10094499&page=12&inCafeSearch=true&searchBy=0&query=%BB%FE%C7%C1%B6%F5&includeAll=&exclude=&include=&exact=&searchdate=2015-01-152018-08-18&media=0&sortBy=date&articleid=27650181&referrerAllArticles=true
312,샤프란,2015.03.01. 01:25,일산돌잔치 플로렌스 후기(플로렌스/서연메이크업/야무진돌복/아기똥아기똥),"돌잔치를 치룬지 한달정도가 지났네요~!돌잔치를 준비하면서 뱃속에서 열달,세상에서 1년동안 아이와 함께한 시간들을 다시 생각해볼수 있어 참 즐거웠습니다.첫째라서 여기저기 물어도 많이보고 카페후기도 많이 읽고 덕분에 준비잘해서? 무사히 잘 치룬것같아 후기를 써보려고 합니다.1. 장소: 플로렌스 파티하우스 일산점?http://blog.naver.com/hsnylove1/ 031-921-6114?돌잔치를 해야겠다고 마음먹고 인터넷과 카페후기를 참고해 3군데 정도 가야할곳을 정하고 투어시작했습니다.투어시작하고 교통편과 주차장, 단독홀, 포토스튜디오 등등에 반해 그날 당일 예약했어요!! 플로렌스는 직원들이 너무친절하고 궁금한게 있어 전화로 귀찮게 물어봐도 친절친절~ 또 성장동영상과 포토테이블,덕담카드도 사진만보내주면 업체에서 해주니깐 편하더라구요~ 제가 이것저것 신경쓰지않아도 알아서 예쁘게 만들어주셨어요. 포토테이블에 하트보드,손발조형물을 올릴까 했었지만 지저분해 보일것같아 안했는데 안하길 잘한것같아요! 플로렌스에서 준비해준것만 했는데도 넘 예뻤어요! 플로렌스는 음식이 맛있다고 소문났더라구요~^^ 저역시 플맘데이때 시식해봐서 그맛은 잘 알고 있었구요^^ 음식 가지수가 10가지 정도 늘었다고 하는데 솔직히 티는 별로 안났어요ㅎㅎ얘기 안해주셨음 몰랐을꺼예요ㅜ.ㅜ 행사 사회자분도 깔끔하게 진행해주시고??따로 사진찍을수 있는공간이 있어서 다양하게 사진을 찍을수 있어 좋았습니다.^^???2. 헤어/메이크업: 서연메이크업http://cafe.daum.net/tiaraM?/ 010-5517-6533플로렌스 제휴업체도 있었지만 돌쟁이 아기를 데리고 미용실을 가기에는 무리인것같아 출장 메이크업을 알아봤습니다.샵에가서 받는거랑 금액이 많이 차이나면 좀 서두르더라도 샵에 가서 받아야지 생각했는데 공동구매와 출석체크이벤트를했을때 샵가격과 거의 같았기때문에 망설임 없이 선택했습니다. 행사당일 머리스타일은 제가 원하는 머리 모양사진을 보여드렸고 메이크업은 화사한느낌으로 예쁘게 해주셨어요. 행사 끝날때까지 머리흐트러짐도 없고 화장 번짐도 없었어요! 지인들도 헤어/메이크업 모두 이쁘다며 칭찬많이 받았습니다^^3.돌잔치 가족한복: 야무진 돌복http://cafe.daum.net/doolnara?/1566-3622돌잔치 후기를 읽어보던중 너무 이쁜 한복이 눈에 들어와 찾아봤더니 플로렌스 제휴업체 였어요!!!더군다나 이벤트 기간이여서 3인한복을 거의 하나 빌리는가격에!! 그날 바로 찜해둔 한복 예약했어요^ㅆ^한복도 생각보다 빨리 보내주더라구요~ 일요일이 돌잔치 였는데 화요일날 도착했어요! 여유있게 보내주셔서 저도 여유있게 입어보고 했어요 처음 옷을 받았을때 꼼꼼히 포장되어서 와서 좋았어요. 아이옷 엄마옷 아빠옷 편하게 볼수있게끔 보내주셨어요. 돌잔치 당일날 한복이쁘다는 소리 굉장히 많이 들었어요! 친구들은 드레스 느낌도 난다고~ 이렇게 이쁜 한복은 본적이 없다고하더라구요~^^ 사실 처음에는 한복을 인터넷으로 대여한다는게 고민스러웠거든요. 사이즈도 그렇고 실제 느낌과 많이 틀리면 어쩔까 싶어서요. 괜한 고민을 했던것같아요 정말 사랑스러운 느낌은 샤프란 한복이였어요^^????4.답례품: 아기똥 아기똥http://www.agiddongagiddong.com?/ 032-203-6667답례품은 처음부터 수건으로 생각했었습니다. 나눔접시도 많이 받아봤고 컵,우산등등 많이 받아봤지만 나눔접시도 잘사용안하게되고 수건이 제일 활용도가 좋고 무난해서 선택했습니다. 중량이 얇은 수건은 저도 사용하기 별로 여서 조금 도톰하고 무게감 있는걸로 원해서 아기똥 아기똥에서 주문했습니다. 중량은 도톰한데 가격은 다른데 보다 저렴하고 또 한달전에 주문하면 이쁜액자가 서비스로 와서 저도 한달전에 주문해서 받았습니다~^^? 따로 이벤트 선물을 준비할까 했었는데 아기똥아기똥에 가격도 저렴하고 포장까지 해주니~ 이벤트선물도 같이 주문했습니다.^^??사진정리 하면서 돌잔치했을때 생각이 많이 나네요. 긴장도 많이 했고~ 끝나서 시원섭섭하기도 했고 제일 좋았던건 후련했어요^^ 돌잔치 준비잘하시고 돌잔치 잘치루세요^^","'돌잔치', '치룬', '달', '정도', '돌잔치', '준비', '뱃속', '달', '세상', '아이', '시간', '다시', '생각', '첫째', '여기저기', '물어', '보고', '카페', '후기', '덕분', '준비', '치룬것같', '후기', '장소', '플로렌스', '파티', '하우스', '일산', '점', '돌잔치', '인터넷', '카페', '후기', '참고', '군데', '정도', '가야', '곳', '정', '투어', '시작', '투어', '시작', '교통', '편', '주차장', '단독', '홀', '포토', '스튜디오', '등등', '그날', '당일', '예약', '플로렌스', '직원', '전화', '친절', '친절', '또', '성장', '동영상', '포토', '테이블', '덕담', '카드', '사진', '업체', '해주', '제', '것', '것', '신경', '포토', '테이블', '하트', '보드', '손발', '조형', '물', '플로렌스', '준비', '플로렌스', '음식', '역시', '맘', '데이', '때', '시식', '맛', '알', '음식', '가지', '수가', '가지', '정도', '티', '별로', '얘기', '행사', '사회자', '진행', '사진', '공간', '사진', '헤어', '메이크업', '플로렌스', '제휴', '업체', '돌', '아기', '데리', '미용실', '가기', '출장', '메이크업', '샵', '금액', '좀', '샵', '생각', '구매', '출석', '체크', '이벤트', '때', '샵', '가격', '거의', '때문', '선택', '행사', '당일', '머리스타일', '제', '머리', '사진', '메이크업', '느낌', '행사', '때', '머리흐트러짐', '화장', '번짐', '지인', '헤어', '메이크업', '모두', '칭찬', '돌잔치', '가족', '한복', '돌잔치', '후기', '중', '한복', '눈', '플로렌스', '제휴', '업체', '더군다나', '이벤트', '기간', '인', '한복', '거의', '하나', '가격', '그날', '바로', '찜', '한복', '예약', '한복', '생각', '일요일', '돌잔치', '화요일', '날', '도착', '여유', '저', '여유', '처음', '옷', '때', '포장', '아이', '옷', '엄마', '옷', '아빠', '옷', '돌잔치', '당일', '날', '한복', '소리', '친구', '드레스', '느낌', '한복', '본적', '사실', '처음', '한복', '인터넷', '게', '고민', '사이즈', '실제', '느낌', '괜', '고민', '정말', '느낌', '샤프란', '한복', '답례', '품', '아기', '똥', '답례', '처음', '수건', '생각', '나눔', '접시', '컵', '우산', '등등', '나눔', '접시', '수건', '제일', '활', '용도', '무난', '선택', '중량', '수건', '저', '사용', '별로', '여서', '조금', '무게', '감', '는걸', '아기', '똥', '아기', '똥', '주문', '중량', '가격', '또', '달전', '주문', '액자', '서비스', '저', '달전', '주문', '이벤트', '선물', '준비', '가격', '포장', '이벤트', '선물', '주문', '사진', '정리', '돌잔치', '때', '생각', '긴장도', '제일', '돌잔치', '준비', '돌잔치', '루세'",,네이버 카페,https://cafe.naver.com/ArticleRead.nhn?clubid=10094499&page=12&inCafeSearch=true&searchBy=0&query=%BB%FE%C7%C1%B6%F5&includeAll=&exclude=&include=&exact=&searchdate=2015-01-152018-08-18&media=0&sortBy=date&articleid=27567129&referrerAllArticles=true
313,샤프란,2015.01.15. 16:45,(지역방드림) 샤프란쓰시는분드려요!!,																																																																																												저희는 다우니밖에 안써서샤프란드려요 전곡고근처에요^-^??,"'저희', '다우니', '샤프란', '전곡', '근처'","'저용♡♡♡', '우와!!!빠르시네요ㅎㅎ가지러오실수있나요??ㅎ', '네네 당연가야죠^^  오늘은 저녁준비때매  늦었구 내일 3시이후 언제괜찮으세요?', '제가 워킹맘이라...오늘 늦어도 괜찮아요ㅎㅎ 저녁에만 집에 있어서요ㅠ', '채팅드렸어요^@^', '삭제된 댓글입니다.', '그러게요ㅠ 간발의 차이ㅠ', '삭제된 댓글입니다.', '글쓰자 마자 달려서 저도 놀랐네요ㅋ'",네이버 카페,https://cafe.naver.com/ArticleRead.nhn?clubid=10094499&page=12&inCafeSearch=true&searchBy=0&query=%BB%FE%C7%C1%B6%F5&includeAll=&exclude=&include=&exact=&searchdate=2015-01-152018-08-18&media=0&sortBy=date&articleid=27198910&referrerAllArticles=true
